titulo,subtitulo,texto,data,url,portal
"Guerra no Irã dá fôlego à Rússia, mas não resolve contas de Putin",Especialistas projetam que o rombo nas contas do regime da Rússia continuará crescendo mesmo com alta dos preços do petróleo e do gás,"Especialistas projetam que o rombo nas contas do regime de Vladimir Putin continuará crescendo mesmo com alta dos preços do petróleo e do gás (Foto: SERGEI ILNITSKY/EFE/EPA )

Antes do início da guerra de Israel e Estados Unidos contra o Irã, a Rússia vivia um cenário econômico pessimista.

A decisão da Índia de parar de comprar petróleo russo, após pressão do governo Trump, e a paralisação de 40% da capacidade do país de exportação da commodity (índice calculado pela agência Reuters com base em dados de mercado), devido a ataques da Ucrânia à sua infraestrutura do setor e à apreensão de petroleiros, deixavam um horizonte nebuloso para o regime do ditador Vladimir Putin.

Porém, veio o conflito no Irã, e as altas nos preços do petróleo e do gás devido ao bloqueio do estratégico Estreito de Ormuz pelo regime dos aiatolás, aliadas a uma retirada parcial das sanções americanas às exportações de energia russas, deram um alento a Moscou.

Colaborando com o Irã com drones, inteligência militar e ajuda humanitária, o desejo de Putin é de uma guerra longa, para que os cofres russos continuem contando com a renda extra.

Porém, especialistas têm apontado que nem o conflito no Oriente Médio poderá ser capaz de resolver um grande gargalo russo dos últimos anos: o déficit público.

O déficit orçamentário consolidado da Rússia saltou de 1,7% do PIB para 3,9% em 2025.

“Graças à alta dos preços do petróleo, é improvável que o pior cenário para a Rússia se concretize. Mas o déficit inevitavelmente continuará a aumentar devido à queda nas receitas não provenientes de petróleo e gás”, afirmou o analista econômico Sergei Shelin, em artigo para o jornal The Moscow Times.

O especialista destacou que a grande preocupação para Putin é que os gastos da Rússia com a guerra na Ucrânia “têm superado as projeções todos os anos desde 2022”.

De acordo com dados do Banco Mundial, as despesas militares da Rússia subiram de 3,6% do PIB em 2021, ano anterior ao início da guerra no leste europeu, ",Data Indisponível,https://www.gazetadopovo.com.br/mundo/guerra-ira-folego-russia-mas-nao-resolve-problema-contas-putin/,gazetadopovo
Vorcaro enviou mensagem para número funcional de Moraes,O presidente da CPMI do INSS revelou detalhes sobre uma mensagem de Daniel Vorcaro para o celular funcional de Moraes no STF.,"Vorcaro enviou mensagem para número funcional de Moraes no STF, segundo o senador Carlos Viana (Podemos-MG). Pois, o presidente da CPMI do INSS revelou detalhes sobre uma mensagem do banqueiro Daniel Vorcaro. No dia de sua primeira prisão, o empresário enviou um texto para um telefone funcional do Supremo Tribunal Federal (STF). Na conversa, ele perguntou se o interlocutor conseguiu ""bloquear"" algo.

Além disso, a colunista Malu Gaspar, do jornal “O Globo”, indicou o alvo da mensagem. Ela afirmou que o ministro Alexandre de Moraes recebeu o texto. Logo depois, o magistrado negou a comunicação. No entanto, ele não esclareceu se manteve qualquer outro contato com Vorcaro.

Por outro lado, o jornal Estadão confirmou o episódio. Fontes ligadas às investigações garantiram a troca de mensagens entre Moraes e Vorcaro na data da prisão.

Diante dessa situação, o senador Carlos Viana cobrou o afastamento do ministro das investigações. Ele avalia que o próprio STF deve decidir sobre essa saída. Por fim, o parlamentar prometeu enviar um ofício à Corte. Com isso, ele pretende descobrir quem operava o telefone funcional durante aquela troca de mensagens.

Servidores públicos do INSS e Dataprev na mira da CPMI do INSS

Senador Carlos Viana (Podemos-MG) traz novos dados a público. O presidente da CPMI do INSS apontou a participação de servidores do próprio órgão e da Dataprev em fraudes de benefícios. A Dataprev processa as informações da Previdência. Segundo o parlamentar, esses funcionários desviaram recursos de aposentados e pensionistas durante 12 a 15 anos. Com isso, o grupo pode ter recebido pelo menos R$ 1 bilhão.

Essa nova estimativa supera os cálculos anteriores. Inicialmente, a comissão apurava um prejuízo de R$ 700 milhões. As autoridades investigam o caso desde o ano passado, logo após a deflagração da Operação Sem Desconto. Naquela ocasião, a polícia descobriu um esquema bilionário. Os envolvidos cobravam mensalidades associativas sem a autorização dos segurados.

Al",Data Indisponível,https://www.gazetadopovo.com.br/cafe-com-a-gazeta/vorcaro-enviou-mensagem-para-numero-funcional-de-moraes/,gazetadopovo
"Procura-se a reputação ilibada de Messias, indicado ao STF","Falhas por ação e omissão: Jorge Messias, indicado por Lula ao STF, não tem reputação ilibada exigida para o cargo.","A Constituição brasileira exige dos indicados ao Supremo Tribunal Federal (STF) “notável saber jurídico” e “reputação ilibada”. Ao longo dos últimos anos, contudo, o nome recém escolhido pelo presidente Lula para o STF, Jorge Messias, por ação e omissão acabou comprometendo o preenchimento do segundo requisito. E manchou a própria reputação e do órgão público que chefiou.

Messias fez da Advocacia-Geral da União (AGU) a Advocacia-Geral do Governo do PT. Com direito à criação do Ministério da Verdade (Procuradoria Nacional de Defesa da Democracia). Esse departamento “messiânico” e censório acatou 35 denúncias e reclamações contra opositores do governo. Mas rejeitou todas as 25 que questionavam a atuação dos petistas no poder. O desequilíbrio evidencia o uso seletivo da máquina pública para atuação política.

Outro tema relembrado no Ouça Essa é a reação de Messias às críticas do jornalista Alexandre Garcia durante as enchentes no Rio Grande do Sul. A AGU processou Garcia por declarações dirigidas ao governo federal, levantando a discussão sobre os limites entre crítica política e uso do aparato estatal como instrumento de intimidação.

Reputação ilibada manchada por vários episódios

O advogado-geral comprometeu a “ilibada reputação” exigida para o cargo de ministro do STF devido à forma como reagiu às revelações da série Twitter Files Brasil, que expuseram ordens de remoção de conteúdo e coleta de dados sigilosos pelo Supremo. Messias tomou as dores e acusou os jornalistas de tentar “desestabilizar o Estado Democrático de Direito”. E foi além, abriu procedimento contra quem fez as denúncias. Idêntico comportamento teve em relação às queixas de Elon Musk quanto a ordens secretas e ilegais.

Mas o que mais compromete a reputação de Messias veio à tona apenas recentemente. Documentos internos mostram que a AGU alertou Messias sobre irregularidades ainda em 2024 e recomendou intervenção imediata. Messias fez vista grossa seletiva, privilegiando justamente os dois sindic",Data Indisponível,https://www.gazetadopovo.com.br/republica/procura-se-a-reputacao-ilibada-de-messias-indicado-por-lula-ao-stf/,gazetadopovo
Lula escolhe o caminho errado para a diplomacia brasileira,"De mãos dadas com ditadores, presidente brasileiro perde oportunidade de se alinhar com democratas e mancha diplomacia do país","A crise entre Venezuela e Estados Unidos colocou o Brasil em uma encruzilhada diplomática. O posicionamento conivente com a gestão autoritária de Nicolás Maduro, capturado pelo governo norte-americano, agora está cobrando seu preço. Embora o presidente Lula não esteja sozinho no discurso de violação da soberania venezuelana, sua aproximação com os regimes autoritários coloca o mandatário brasileiro (e, por consequência, todo o Brasil) em uma posição frágil de líder regional e de voz ativa pela pacificação do continente.

Nesta edição, a primeira de 2026, a Gazeta do povo Revista mostra como o caminho mal escolhido por Lula e pelo petismo deixa o Brasil na corda bamba da diplomacia mundial. Baixe já a sua!

BAIXE A NOVA EDIÇÃO DA GAZETA REVISTA EM PDF

Nessa edição você vai ler:

Manchete: Posicionamento pró-Maduro de Lula expõe risco de isolamento e reforça alinhamento com ditaduras

Editorial: No Brasil de Moraes, já não é preciso fazer nada para ir preso

Rodrigo Constantino: Três anos do golpe

Flávio Gordon: Um avivamento cristão também está em curso no Brasil?

Pressão institucional força TCU a rever ofensiva contra decisões do BC sobre o Master

10 “outsiders” da direita que podem ser candidatos ao Senado em 2026

As ideias perigosas de Yuval Harari, o autor favorito da elite global

EDIÇÃO 165: O CAMINHO ERRADO DE LULA

Lula e Nicolás Maduro, em encontro no Brasil. Presidente brasileiro evita críticas a ditador (Foto: Reprodução)

As edições da Gazeta do Povo Revista estão disponíveis para download em PDF pelos nossos assinantes todos os sábados pela manhã no site do jornal. Também é possível se inscrever para ser lembrado de baixar o arquivo. Você pode entrar em um de nossos grupos no Whatsapp ou em nosso canal no Telegram. Se preferir receber por e-mail, você pode se inscrever na newsletter exclusiva para receber o link de download. Inscreva-se no box abaixo ou pelo link.",Data Indisponível,https://www.gazetadopovo.com.br/gazeta-revista/de-maos-dadas-com-ditadores-lula-escolhe-o-caminho-errado-para-a-diplomacia-brasileira/,gazetadopovo
X suspende conta de comandante do Irã após ameaça a Israel,"O comandante da Força Quds da Guarda Revolucionária Islâmica do Irã, Esmail Qaani, fez ameaças a Israel no X e teve sua conta suspensa","O comandante da Força Quds da Guarda Revolucionária Islâmica do Irã, Esmail Qaani (ao centro), em imagem de 2024 (Foto: ABEDIN TAHERKENAREH/EFE/EPA )

O comandante da Força Quds da Guarda Revolucionária Islâmica do Irã, Esmail Qaani, postou nesta segunda-feira (30) uma mensagem no X na qual elogiava as várias frentes que enfrentam Israel na atual guerra no Oriente Médio e fazia ameaças aos israelenses. Pouco depois, a rede social suspendeu a conta de Qaani, alegando violação das suas regras.

“[O primeiro-ministro de Israel, Benjamin] Netanyahu sonhava em expandir o cinturão de segurança na região, mas o fogo inteligente e corajoso dos irmãos do Hezbollah no norte e dos houthis no sul expôs as falsas promessas do regime aos colonos”, escreveu Qaani no X, em uma conta recém-criada.

Era uma referência aos ataques do grupo terrorista libanês aliado de Teerã e dos rebeldes houthis do Iêmen a Israel desde que este e os Estados Unidos iniciaram uma guerra contra o Irã, em 28 de fevereiro.

“O desejo dos comandantes da resistência mártires foi realizado: a sala de guerra da frente de resistência é uma só. Acostumem-se à nova ordem na região”, ameaçou Qaani, cuja morte havia sido especulada desde o início da guerra e foi negada por agências estatais iranianas.",Data Indisponível,https://www.gazetadopovo.com.br/mundo/x-suspende-conta-comandante-ira-apos-ameaca-israel/,gazetadopovo
CPMI do INSS pede indiciamento de Lulinha e mais 200,"CPMI do INSS pede mais de 200 indiciamentos em esquema de R$ 40 bilhões que envolve ministro Lupi, Lulinha,"" Careca do INSS"" e Banco Master.","O relatório final da CPMI do INSS, apresentado pelo deputado Alfredo Gaspar, revela um esquema sistêmico que drenou R$ 40 bilhões de aposentados e pensionistas. O documento aponta que a fraude operava por meio de descontos associativos e empréstimos consignados sem autorização, viabilizados pela conivência de figuras do alto escalão e operadores financeiros. Entre os mais de 200 nomes listados para indiciamento, destacam-se o ministro Carlos Roberto Lupi, o ex-presidente do INSS Alessandro Stefanutto e figuras como Fábio Luís Lula da Silva, o ""Lulinha"", e Antônio Carlos Camilo Antunes, conhecido como ""Careca do INSS"", apontados por envolvimento na rede de influência e operação do esquema.

A investigação também expôs a participação direta de instituições financeiras e entidades de classe que se beneficiavam das retenções indevidas diretamente na folha de pagamento. O texto pede o indiciamento de executivos do Banco Master, como Daniel Vorcaro e Augusto Ferreira Lima, além de lideranças do Banco C6 e PicPay. No setor associativo, entidades como AMBEC, CONAFER e SINDNAPI foram citadas como peças centrais na arrecadação dos valores desviados. Diante do cenário de ""captura do Estado"", o relatório sugere o bloqueio imediato de bens dos envolvidos e mudanças rigorosas na legislação para impedir que novos descontos fraudulentos vitimem idosos vulneráveis.

PF aperta cerco contra Lulinha

O empresário Fábio Luís Lula da Silva telefonou para o pai, o presidente Luiz Inácio Lula da Silva, após relatório da Polícia Federal apontar indícios de que sua mudança para a Europa poderia configurar tentativa de fuga. Em meio à tensão no governo e à possibilidade de medidas judiciais, Lulinha buscou explicar sua permanência na Espanha, enquanto sua defesa nega irregularidades, afirma que a mudança foi planejada antes das investigações e diz que ele está à disposição para prestar esclarecimentos às autoridades.

Silêncio de Alcolumbre paralisa Congresso em meio à crise

O silêncio de pr",Data Indisponível,https://www.gazetadopovo.com.br/sem-rodeios/cpmi-do-inss-pede-indiciamento-de-lulinha-e-mais-200/,gazetadopovo
Lula confirma Alckmin como seu candidato a vice-presidente,Fala em reunião ministerial põe fim a incerteza do PSB e articulação por nome do MDB. Leia na Gazeta do Povo.,"Fala em reunião ministerial põe fim a incerteza do PSB e articulação por nome do MDB. Leia na Gazeta do Povo. (Foto: Sebastiao Moreira/EFE )

O presidente Luiz Inácio Lula da Silva (PT) confirmou que o vice-presidente e ministro do Desenvolvimento, Indústria, Comércio e Serviços, Geraldo Alckmin (PSB), seguirá como seu vice na chapa presidencial que concorrerá às eleições de outubro.

A confirmação ocorreu durante a reunião ministerial desta terça-feira (31), a primeira do ano e a última antes do prazo para que os ministros deixem seus cargos se quiserem concorrer a algum posto nas eleições de 2026.

""O companheiro Alckmin, que vai ter que deixar o MDIC, ele vai ter que deixar, porque ele é candidato a vice-presidente da República outra vez"", disse o petista, seguido por aplausos da equipe ministerial.

VEJA TAMBÉM: Caiado promete que primeiro ato como presidente seria anistiar Bolsonaro

O PSB vivia um clima de incerteza. Lula chegou a dizer que a vaga estaria garantida, mas que Alckmin ""ajudaria mais"" como candidato ao Senado por São Paulo.

A escolha do atual vice-presidente para seguir no cargo na chapa que concorrerá em outubro também contraria uma ala do próprio PT que defendeu uma articulação com o PSD. O presidente do partido em São Paulo, Kiko Celeguim, chegou a levantar a possibilidade de Gilberto Kassab sair ao lado de Lula.

“Para ganhar a eleição, precisamos de Kassab e Geraldo [Alckmin] nas posições corretas. Kassab na vice de Lula e Geraldo em São Paulo”, afirmou pontuando que “o PSD é o partido-chave para ganhar a eleição”.

O PSD, no entanto, acabou confirmando a candidatura própria à presidência na véspera com a escolha do governador goiano Ronaldo Caiado para concorrer contra a reeleição petista.

""Dança das cadeiras"" na Esplanada

Cerca de 20 ministros devem deixar a Esplanada até sexta-feira (3). Depois disso, os que ainda estiverem em seus cargos não poderão concorrer. Durante seu discurso, Lula ironizou, sem citar nomes, um ministro que pediu ",Data Indisponível,https://www.gazetadopovo.com.br/eleicoes/2026/lula-confirma-alckmin-como-seu-candidato-a-vice-presidente/?ref=mais-lidas,gazetadopovo
“Proibidão”: celular de Vorcaro vira bomba em Brasília,Celular de Vorcaro vira material sensível na CPMI após revelar conteúdos íntimos envolvendo políticos e é guardado em sala-cofre.,"O celular do empresário Daniel Vorcaro, apreendido nas investigações do caso Banco Master, passou a ser tratado como material sensível dentro da CPMI após a descoberta de conteúdos íntimos, incluindo vídeos e fotos envolvendo políticos e pessoas próximas ao banqueiro. O aparelho foi armazenado em uma “sala-cofre” no Congresso para evitar vazamentos, já que parlamentares relataram que o material expõe relações pessoais e bastidores da elite política, gerando preocupação entre autoridades citadas ou potencialmente envolvidas.

Mendonça bloqueia acesso da CPMI à dados de Vorcaro

O ministro André Mendonça (STF) decidiu vedar o acesso da CPMI do INSS aos dados e objetos pessoais de Daniel Vorcaro, dono do Banco Master, que estavam sob custódia na “sala‑cofre” do Senado, ordenando ainda que a Polícia Federal retire tudo que diga respeito exclusivamente à vida privada do investigado com “extrema urgência”. A medida interrompe temporariamente a análise de informações sigilosas pela comissão sob o argumento de proteção à intimidade, gerando nova disputa institucional em meio às investigações sobre o caso Master e o envolvimento de autoridades.

Suspeita sobre número funcional do STF em contato com Vorcaro recai em Moraes

O senador Carlos Viana, presidente da CPMI do INSS, defendeu que o ministro Alexandre de Moraes seja afastado do cargo durante as investigações sobre o caso envolvendo o Banco Master e o empresário Daniel Vorcaro. Segundo ele, a medida seria necessária para garantir imparcialidade e credibilidade às apurações, diante de suspeitas de possível relação entre integrantes do Supremo e o banqueiro. Viana também afirmou que o número que mantinha contato com Vorcaro seria funcional do Supremo, o que, segundo ele, agrava as suspeitas, além de criticar entraves enfrentados pela comissão para avançar nas investigações.

CPI aponta Master como ""lavanderia do PCC""

O senador Alessandro Vieira, relator da CPI do Crime Organizado, afirmou que as investigações indicam que",Data Indisponível,https://www.gazetadopovo.com.br/sem-rodeios/proibidao-celular-de-vorcaro-vira-bomba-em-brasilia/#comentarios?ref=comentarios-materia,gazetadopovo
Moraes manda executar multas por bloqueios em eleições de 2022,"Em carta de ordem a tribunais regionais federais, Moraes determina execução de multas contra caminhoneiros.","O ministro do Supremo Tribunal Federal (STF) Alexandre de Moraes determinou a execução de multas aplicadas a pessoas e empresas que descumpriram decisões judiciais durante os bloqueios de rodovias após as eleições de 2022.

A decisão foi assinada em 17 de dezembro de 2025, no âmbito da Petição 11.893, vinculada à ADPF 519, proposta pela União por meio da Advocacia-Geral da União, e homologou os valores calculados pelo órgão.

Posteriormente, em 5 de março de 2026, o ministro expediu cartas de ordem à Justiça Federal, determinando que a cobrança das multas seja realizada nos estados, conforme o domicílio de cada devedor.

As penalidades têm origem em decisões tomadas ainda em 2022 e 2023, quando o STF determinou a desobstrução imediata de rodovias ocupadas por manifestantes contrários ao resultado eleitoral.

Logo após o anúncio da vitória de Luiz Inácio Lula da Silva no segundo turno, em 30 de outubro de 2022, caminhoneiros bloquearam rodovias em 25 estados e no Distrito Federal em protesto contra o resultado.

No dia 1º de novembro, o STF referendou a decisão de Moraes que determinava a liberação imediata das vias, no âmbito da ADPF 519.

À época, o ministro fixou multa — em alguns casos — de R$ 100 mil por hora para os proprietários dos veículos utilizados nas interdições e determinou a atuação de autoridades federais e estaduais para desobstruir as rodovias. O então presidente Jair Bolsonaro chegou a pedir publicamente a liberação das vias.

Na decisão de dezembro, Moraes considerou “razoáveis” os critérios adotados pela AGU para calcular os valores devidos e autorizou sua execução. Ele também estabeleceu que eventuais contestações deverão ser analisadas pelos juízos responsáveis pela execução, e não mais diretamente pelo STF.

Além disso, a decisão prevê o levantamento de restrições sobre veículos cujos proprietários não estejam incluídos na lista de infratores homologada.

Os valores não aparecem consolidados na decisão e resultam da soma individual das penalid",Data Indisponível,https://www.gazetadopovo.com.br/republica/moraes-multa-caminhoneiros-eleicao-lula-2022/,gazetadopovo
Diesel: subsídio do governo será compensado por novo imposto,Governo Lula cria mais um imposto para compensar zeragem de alíquotas do PIS/Cofins e subsídio a produtores e importadores de diesel,"Governo Lula cria mais um imposto para compensar zeragem de alíquotas do PIS/Cofins e subsídio a produtores e importadores de diesel (Foto: Ricardo Stuckert / PR )

As medidas anunciadas pelo presidente Lula (PT) para tentar conter a alta no preço do diesel repetem uma fórmula bastante usual na política fiscal do atual governo: a criação de um imposto para compensar uma nova despesa.

Desta vez, a desoneração de PIS e Cofins sobre o combustível e o subsídio pago a produtores e importadores, em vigor desde o dia 12, estão sendo cobertos por uma taxação de 12% sobre a exportação de petróleo bruto e de 50% sobre a de diesel, sob críticas do setor.

A intenção do Ministério da Fazenda é arrecadar cerca de R$ 30 bilhões com a nova tributação, que não tem prazo de vigência definido. O valor foi calculado para compensar a renúncia de R$ 20 bilhões com a zeragem dos impostos federais e garantir outros R$ 10 bilhões para o subsídio.

Somadas, as medidas representam uma redução de R$ 0,64 por litro de diesel vendido às distribuidoras – metade via desoneração de impostos e metade por meio de subsídio. A zeragem dos tributos vale até 31 de maio, enquanto o subsídio está previsto até 31 de dezembro, limitado a R$ 10 bilhões.

Governo diz que imposto sobre petróleo tem caráter regulatório

Durante a coletiva de anúncio do pacote, o ex-ministro da Fazenda, Fernando Haddad, defendeu que o imposto de exportação teria caráter regulatório, ou seja, seria usado para influenciar o comportamento do mercado – neste caso, desestimular exportações e incentivar o refino no país.

“Queremos estimular as refinarias a utilizar o máximo da capacidade de processamento já instalada. Temos capacidade de processar mais aqui. E queremos estimular essas refinarias a processarem no limite de suas possibilidades”, disse.

Segundo ele, o governo teria identificado ao menos duas refinarias no país operando com até 50% de capacidade ociosa. Para o ministro, a taxação serve para incentivar o setor a redirec",Data Indisponível,https://www.gazetadopovo.com.br/economia/desoneracao-subsidio-diesel-novo-imposto-exportacao-petroleo/,gazetadopovo
STF marca para 8 de abril julgamento do mandato-tampão para governo do RJ,Corte definirá como será o processo de sucessão de Cláudio Castro a meses antes da eleição geral. Leia na Gazeta do Povo.,"Corte definirá como será o processo de sucessão de Cláudio Castro a meses antes da eleição geral. (Foto: Luiz Silveira/STF )

O presidente do Supremo Tribunal Federal (STF), ministro Edson Fachin, marcou para o dia 8 de abril o julgamento que vai definir como será a eleição do novo governador do Rio de Janeiro para um mandato-tampão até o fim do ano, em meio a reviravoltas após a renúncia de Cláudio Castro (PL-RJ) e à condenação à cassação e inelegibilidade pelo Tribunal Superior Eleitoral (TSE).

O julgamento deve estabelecer se a escolha do sucessor será feita por votação direta da população ou de forma indireta pela Assembleia Legislativa. A análise deve consolidar o entendimento do tribunal diante de um cenário de insegurança jurídica que se arrasta após decisões conflitantes dentro da própria Corte.

“A deliberação do Plenário, orientada pelos princípios da legalidade constitucional, da segurança jurídica e da estabilidade institucional, terá por finalidade fixar a diretriz juridicamente adequada à condução do processo sucessório no Estado do Rio de Janeiro, em conformidade com a ordem constitucional e a legislação eleitoral vigente”, pontua trecho do comunicado assinado por Fachin nesta segunda (30).

VEJA TAMBÉM: Inelegibilidade de Castro tira do PL candidato a senador com voto contra ministros do STF

Caso o STF opte pelo voto popular, os eleitores do Rio de Janeiro poderão ser convocados a ir às urnas duas vezes no mesmo ano: uma para escolher o governador tampão e outra nas eleições gerais de outubro. Já se prevalecer a eleição indireta, caberá à Assembleia Legislativa definir o novo chefe do Executivo estadual.

Na última sexta-feira (27), o ministro Cristiano Zanin suspendeu a realização da eleição indireta até que o plenário da Corte analise o caso de forma definitiva. A medida atende a uma ação apresentada pelo PSD, que questiona a legalidade das regras aprovadas pela Assembleia Legislativa fluminense para conduzir o processo.

Uma das ações discute po",Data Indisponível,https://www.gazetadopovo.com.br/eleicoes/2026/stf-marca-8-abril-julgamento-mandato-tampao-governo-rj/,gazetadopovo
