titulo,subtitulo,texto,data,url,portal
Ventos do Norte contra o empoderamento judicial “verde”,A esperança é de que os ventos do Norte se convertam num furacão de alcance global e desmantelem de vez essa agenda fraudulenta e nefasta.,"O retorno de Donald Trump à Casa Branca representou um revés maiúsculo para a insidiosa agenda da “descarbonização” da economia, sob o pretexto do combate às mudanças climáticas. Como lamentaram dois jornalistas-militantes da agência Bloomberg, anos de ação climática foram demolidos em dias (Bloomberg, 26/03/2025).

Entre os segmentos da agenda que já começam a ser afetados, destaca-se o até então promissor campo das litigâncias climáticas. Neste, indivíduos, organizações não-governamentais (ONGs) e entidades privadas e públicas movem processos judiciais contra empresas e governos, alegando ações ou inações deletérias para o clima do planeta.

Sem surpresa, os EUA despontam como líderes na modalidade, com mais de 1.700 casos registrados, seguidos de longe pela União Europeia, com menos de 300.

Todavia, com sua firme investida contra as leis estaduais em matéria ambiental, o “furacão Trump” tende a reduzir consideravelmente os pretextos legais para justificar tais ações, cuja maioria não passa de mal disfarçada litigância de má-fé. E o Judiciário estadunidense parece estar na mesma sintonia, como sugerem exemplos recentes.

Em fevereiro deste ano, um tribunal de apelações de New Jersey considerou improcedente um processo movido pela Procuradoria-Geral do estado contra as petroleiras ExxonMobil, BP, Chevron, ConocoPhillips e Shell e o American Petroleum Institute (API). A alegação foi por liderarem uma “campanha de desinformação para desacreditar o consenso científico sobre a mudança climática” e criarem “dúvidas nas mentes dos consumidores... sobre os impactos da queima de combustíveis fósseis na mudança do clima (ESG Dive, 10/02/2025).

Na decisão, o juiz Douglas Hurd afirmou que os argumentos da Procuradoria eram “inteiramente sobre abordar os danos da mudança climática global e buscar prejuízos por tais danos”. O que, segundo ele, contraria leis federais que não podem ser suplantadas por leis estaduais.

Em janeiro, um tribunal de Nova York já havia rejeitado um ",Data Indisponível,https://www.gazetadopovo.com.br/vozes/lorenzo-carrasco/ventos-do-norte-contra-o-empoderamento-judicial-verde/,gazetadopovo
Contra o fanatismo político,O fanatismo nasce do desespero e da frustração. Pessoas que se sentem impotentes ou sem valor são mais suscetíveis a se tornarem fanáticas.,"Nos anos seguintes ao final da Segunda Guerra, especialmente após as revelações sobre a barbárie do Holocausto, a grande questão que mobilizou intelectuais do Ocidente foi entender como e por que a sociedade alemã, culturalmente tão avançada, se deixou seduzir pelo nazismo.

Diferentes autores se dedicaram a escrever sobre o assunto, destacando-se “As origens do totalitarismo”, de Hannah Arendt. Lançado em 1951, o livro investiga as origens comuns dos principais regimes totalitários do século 20 – o nazismo e o comunismo – e sua constituição como movimentos de massa capazes de atrair milhões de seguidores fanáticos.

Após examinar em profundidade as condições que permitiram a ascensão do antissemitismo e do imperialismo na Europa, Arendt concluiu que o totalitarismo era uma nova forma de governo, que diferia essencialmente da opressão política praticada pelas ditaduras até então conhecidas.

Segundo a autora, o diferencial dos regimes totalitários é que seu objetivo não é apenas perseguir e calar adversários, mas subjugar e doutrinar toda a população, de maneira a mudar a percepção que os indivíduos têm de si mesmos, de seu papel na sociedade e da própria política.

Por isso mesmo, nos processos de dominação implementados por esses regimes, tão importantes quanto a força bruta são as técnicas de manipulação da opinião pública e de lavagem cerebral da população. O objetivo não é apenas esmagar, mas também convencer. E converter.

Se “As origens do totalitarismo” se tornou uma obra de referência sobre o tema e até hoje é reeditado, outro livro importantíssimo, publicado no mesmo ano, caiu em relativo ostracismo: “Fanatismo e movimentos de massa” (“The true believer”, no original), do americano Erich Hoffer.

O foco de Hoffer é a interpretação da mentalidade fanática, que faz pessoas comuns abandonarem a razão e entregarem seus destinos nas mãos de psicopatas. Daí o paralelo que o autor estabelece entre o fanatismo político e o fanatismo religioso. Nesse sentido, “Fana",Data Indisponível,https://www.gazetadopovo.com.br/vozes/luciano-trigo/contra-o-fanatismo-politico-o-fardo-da-responsabilidade/,gazetadopovo
Lula escolhe o caminho errado para a diplomacia brasileira,"De mãos dadas com ditadores, presidente brasileiro perde oportunidade de se alinhar com democratas e mancha diplomacia do país","A crise entre Venezuela e Estados Unidos colocou o Brasil em uma encruzilhada diplomática. O posicionamento conivente com a gestão autoritária de Nicolás Maduro, capturado pelo governo norte-americano, agora está cobrando seu preço. Embora o presidente Lula não esteja sozinho no discurso de violação da soberania venezuelana, sua aproximação com os regimes autoritários coloca o mandatário brasileiro (e, por consequência, todo o Brasil) em uma posição frágil de líder regional e de voz ativa pela pacificação do continente.

Nesta edição, a primeira de 2026, a Gazeta do povo Revista mostra como o caminho mal escolhido por Lula e pelo petismo deixa o Brasil na corda bamba da diplomacia mundial. Baixe já a sua!

BAIXE A NOVA EDIÇÃO DA GAZETA REVISTA EM PDF

Nessa edição você vai ler:

Manchete: Posicionamento pró-Maduro de Lula expõe risco de isolamento e reforça alinhamento com ditaduras

Editorial: No Brasil de Moraes, já não é preciso fazer nada para ir preso

Rodrigo Constantino: Três anos do golpe

Flávio Gordon: Um avivamento cristão também está em curso no Brasil?

Pressão institucional força TCU a rever ofensiva contra decisões do BC sobre o Master

10 “outsiders” da direita que podem ser candidatos ao Senado em 2026

As ideias perigosas de Yuval Harari, o autor favorito da elite global

EDIÇÃO 165: O CAMINHO ERRADO DE LULA

Lula e Nicolás Maduro, em encontro no Brasil. Presidente brasileiro evita críticas a ditador (Foto: Reprodução)

As edições da Gazeta do Povo Revista estão disponíveis para download em PDF pelos nossos assinantes todos os sábados pela manhã no site do jornal. Também é possível se inscrever para ser lembrado de baixar o arquivo. Você pode entrar em um de nossos grupos no Whatsapp ou em nosso canal no Telegram. Se preferir receber por e-mail, você pode se inscrever na newsletter exclusiva para receber o link de download. Inscreva-se no box abaixo ou pelo link.",Data Indisponível,https://www.gazetadopovo.com.br/gazeta-revista/de-maos-dadas-com-ditadores-lula-escolhe-o-caminho-errado-para-a-diplomacia-brasileira/#comentarios?ref=comentarios-materia,gazetadopovo
O que está em jogo no parecer da PGR sobre o aborto tardio?,O debate sobre aborto não pode ser conduzido apenas sob a ótica da autonomia individual. Há sempre uma outra vida envolvida.,"O debate sobre aborto não pode ser conduzido apenas sob a ótica da autonomia individual. Há sempre uma outra vida envolvida. (Foto: Imagem criada utilizando Open AI/Gazeta do Povo )

A recente manifestação da Procuradoria-Geral da República (PGR) sobre a ADPF 1141, que questiona a Resolução do Conselho Federal de Medicina 2.378/24, reacendeu um debate que jamais deixou de ser sensível: os limites éticos, jurídicos e humanos do aborto no Brasil. Em discussão está a proibição da chamada assistolia fetal em gestações acima de 22 semanas, inclusive nos casos de gravidez decorrente de estupro. Trata-se de um tema que envolve dor, complexidade e, sobretudo, a necessidade de não perdermos de vista o valor intrínseco da vida humana.

O parecer do procurador-geral da República apresenta uma linha argumentativa que merece atenção. Em primeiro lugar, ele delimita corretamente o objeto da controvérsia: não se discute a existência de hipóteses em que o ordenamento jurídico deixa de punir o aborto, mas sim o método utilizado para sua realização. Essa distinção é fundamental, pois impede simplificações e obriga o debate a considerar aspectos técnicos e éticos que muitas vezes são ignorados no calor das disputas ideológicas.

Outro ponto relevante do parecer é o reconhecimento da competência do Conselho Federal de Medicina para regulamentar práticas médicas. Em uma sociedade complexa, é razoável que órgãos técnicos tenham autonomia para estabelecer limites baseados em evidências científicas e princípios éticos. A medicina não é apenas um conjunto de procedimentos possíveis, mas uma prática orientada por valores, entre os quais se destaca o compromisso de não causar dano desnecessário.

Defender a vida exige constância. Exige coragem para enfrentar temas difíceis e disposição para sustentar princípios mesmo quando o cenário é adverso. O momento pede vigilância e voz ativa. Afinal, quando o valor da vida está em jogo, o silêncio nunca é uma opção

Nesse sentido, o parecer sustenta qu",Data Indisponível,https://www.gazetadopovo.com.br/opiniao/artigos/parecer-da-pgr-sobre-o-aborto-tardio/,gazetadopovo
Brasil apoia resolução da Rússia sobre direitos humanos,O Brasil apoiou resolução da Rússia no Conselho de Direitos Humanos da ONU pedindo fim de medidas coercitivas unilaterais,"O presidente Luiz Inácio Lula da Silva e o ditador russo, Vladimir Putin, em encontro em Moscou em maio de 2025 (Foto: MAXIM SHEMETOV/EFE/EPA )

O Conselho de Direitos Humanos da ONU aprovou uma resolução de iniciativa conjunta da Rússia (que não faz parte do conselho) e de Uganda (que representou o Movimento dos Países Não Alinhados), pedindo o fim de medidas unilaterais que violam o direito internacional humanitário e a Carta das Nações Unidas.

Segundo a proposta, essas ações coercitivas impedem a plena vivência dos direitos consagrados na Declaração Universal dos Direitos Humanos e criam obstáculos nas relações comerciais entre os Estados. A Rússia, um dos países que idealizaram o documento, mantém uma invasão na Ucrânia há quatro anos e é alvo de sanções ocidentais.

Ao todo, 28 países votaram a favor do documento apresentado pelo regime russo, incluindo Brasil, Colômbia e China. Outros 17, entre eles França, Reino Unido e Holanda votaram contra a resolução.",Data Indisponível,https://www.gazetadopovo.com.br/mundo/brasil-apoia-resolucao-apresentada-pela-russia-sobre-direitos-humanos-na-onu/,gazetadopovo
Conferência Internacional pró-Palestina defende o Irã em SP,Evento a favor da Palestina defende o Irã e entoa slogans antissemitas durante conferência de organizações com suspeitas de terrorismo em SP.,"Grande ato pelo fim do ""genocídio palestino"" na Avenida Paulista, na edição de outubro. (Foto: Rovena Rosa / Agência Brasil )

A cidade de São Paulo sedia, desde o fim de semana, a Conferência Masar Badil, evento internacional ligado à esquerda radical e a organizações banidas por terrorismo e antissemitismo em vários países. O movimento Masar Badil se apresenta como um “caminho alternativo” para a defesa da Palestina e realizou eventos entre o sábado e esta segunda, encerrando atividades na terça-feira.

Ao longo destes quatro dias, atividades públicas defenderam abertamente a “resistência” do Irã contra os EUA e, indiretamente, a destruição do Estado de Israel. Embora se autodenomine independente, o movimento trouxe como convidados representantes do Samidoun e da Frente Nacional pela Libertação da Palestina (FNLP), grupos banidos em diversos países por antissemitismo e vínculos com terrorismo.

O Masar Badil se descreve como um movimento popular ""de defesa do povo palestino"" que se define como “de massa”, vinculado à chamada “diáspora palestina” decorrente da ocupação de territórios antigamente pertencentes à Palestina por Israel.

Fundado em 2021, com conferências simultâneas em Madri, Beirute e São Paulo, posiciona-se como uma opção “revolucionária” à diplomacia oficial. Isso ocorre porque o grupo rejeita os tratados de Oslo e a solução de dois Estados — modelo que prevê o reconhecimento mútuo de Israel e da Palestina como estados.

""A escalada recente dos Estados Unidos e da ocupação israelense contra o Irã confirma que a Ásia Ocidental segue no centro de uma ofensiva imperial que ameaça toda a região. Essa política de guerra se soma aos ataques contínuos contra a Palestina, o Líbano, a Síria, o Iêmen e o Iraque, revelando uma estratégia sistemática de dominação e desestabilização contra os povos que resistem"", diz o site da convocação oficial.

O movimento defende a “libertação total” da Palestina “do rio ao mar”. Na prática, o termo é considerado um slogan an",Data Indisponível,https://www.gazetadopovo.com.br/vida-e-cidadania/conferencia-internacional-defende-o-ira-e-entoa-slogan-antissemita-em-sp/,gazetadopovo
Alexandre de Moraes tem errado tanto assim?,"O ativismo judicial, pelas mãos de Moraes, transformou-se em autoritarismo. A separação de poderes, tornou-se um slogan violado sempre","Eles apoiaram a atuação do ministro Alexandre de Moraes e recuaram: o que cada um disse antes, o que diz agora e o que explica a virada (Foto: Marcelo Camargo/Agência Brasil )

“Alguém devia ter caluniado Josef K., pois, sem que ele tivesse feito qualquer mal, certa manhã, foi aprisionado” – Frase de abertura de “O Processo”, de Franz Kafka.

O brasileiro tem sido bombardeado com notícias sobre o Supremo Tribunal Federal (STF). Os ministros, com sua posição ativista, assumiram o protagonismo da cena política brasileira. Dentre todos, Alexandre de Moraes, desde a instauração do Inquérito das Fake News, tem recebido especial destaque. Os jornais, impressos ou virtuais, comentam as suas decisões. As tevês e rádios transmitem trechos de seus julgamentos. O ministro é alvo de discussões no cafezinho do trabalho e no almoço de domingo, essas instituições tão brasileiras.

Em meio a isso, quem não tem formação jurídica pode se perguntar: será que Moraes tem errado tanto assim ou isso é exagero? Antes de responder, permita-me o leitor um pequeno passeio por textos clássicos do direito e da filosofia política.

O Digesto, coletânea de textos do direito romano clássico, organizada sob determinação do imperador Justiniano, concluída em 533, prevê o princípio nemo iudex in causa sua. O que isso quer dizer? É fácil: ninguém pode ser juiz em causa própria. As partes e o juiz não se confundem. Notem que os textos foram reunidos em 533, mas são muito mais antigos. A própria ideia de julgamento pressupõe que a decisão seja proferida por terceiro, sem vinculação com as partes. O conceito, portanto, é anterior à modernidade. Já existia em Roma, berço do direito ocidental.

Os historiadores do direito que me perdoem, mas vamos dar um salto. Em 1447 foi encerrada a revisão das Ordenações Afonsinas, a primeira grande coletânea de leis do reino português. O Livro I, Título I, começa com a previsão do cargo de “Regedor e Governador da Casa da Justiça”, funcionário que deveria ser informado",Data Indisponível,https://www.gazetadopovo.com.br/vozes/lexum/alexandre-de-moraes-tem-errado-tanto-assim/,gazetadopovo
Israel aprova pena de morte para terroristas palestinos,Israel aprova lei que estabelece pena de morte para terroristas palestinos condenados por ataques com vítimas fatais,"O parlamento de Israel – Knesset - aprovou nesta segunda-feira (30) um projeto de lei que estabelece a pena de morte para palestinos da Cisjordânia condenados por realizar ataques terroristas com vítimas fatais. A proposta foi aprovada por 62 votos a 48, após horas de debate, e contou com o apoio do governo do primeiro-ministro Benjamin Netanyahu.

A nova legislação estabelece que tribunais militares deverão aplicar, como regra, a pena de morte por enforcamento a indivíduos considerados culpados por ataques letais, com possibilidade de substituição por prisão perpétua em “circunstâncias especiais”, não detalhadas no texto. Como apenas palestinos da Cisjordânia são julgados por tribunais militares de Israel, a medida se aplica apenas a esse grupo, enquanto cidadãos israelenses seguem sendo submetidos à Justiça civil, onde a pena capital depende de critérios bem mais rigorosos.

A sentença de morte poderá ser aplicada por maioria simples dos juízes, sem necessidade de unanimidade, e elimina a possibilidade de recurso. A lei também não terá efeito retroativo, ou seja, não se aplicará a crimes cometidos antes de sua entrada em vigor, inclusive para os que cometeram os ataques de 7 de outubro de 2023, cujas punições seguem em discussão em um projeto separado.

De acordo com o governo, a medida busca aumentar o poder de dissuasão contra o terrorismo. Em declaração oficial, o ministro da Segurança Nacional de Israel, Itamar Ben-Gvir, afirmou que a aprovação representa “um dia de justiça para as vítimas e um dia de dissuasão para nossos inimigos”, acrescentando que “quem escolhe o terrorismo escolhe a morte”.

Organizações civis e partidos oposicionistas anunciaram que pretendem contestar a medida judicialmente. De acordo com a Associação pelos Direitos Civis em Israel, a lei viola princípios fundamentais previstos na legislação do país, como o direito à vida, ao devido processo legal e à igualdade. A entidade também argumenta que a medida cria distinções jurídicas entre is",Data Indisponível,https://www.gazetadopovo.com.br/mundo/israel-aprova-pena-de-morte-para-terroristas-palestinos-condenados-por-ataques-letais/#comentarios?ref=comentarios-materia,gazetadopovo
Temer sai em defesa de Moraes e diz que ministro colabora com “pacificação do país”,Ex-presidente vê amenização em decisões e avalia positivamente a prisão domiciliar humanitária a Jair Bolsonaro.,"O ex-presidente Michel Temer (MDB) saiu em defesa de seu único indicado ao cargo de ministro do Supremo Tribunal Federal (STF). Durante um evento em Belo Horizonte nesta segunda-feira (30), ele disse que não fala com o ministro Alexandre de Moraes há algum tempo, mas que acredita que o magistrado está disposto a colaborar com uma pacificação do país.

""Eu conversei com ele há algum tempo, já em momentos em que ele estava, vamos dizer assim, amenizando as próprias decisões que tomara em certos momentos. E eu vejo que ele está muito disposto a colaborar com esta pacificação do país. Não houve uma palavra dele, mas estou falando em coisa de dois, quase, talvez, três meses atrás. Nos últimos tempos, eu não tenho falado com ele"", declarou o ex-presidente.

Nesta terça-feira (31), completou-se uma semana desde a decisão de Moraes que concedeu prisão domiciliar humanitária ao ex-presidente Jair Bolsonaro (PL). O benefício vale por 90 dias, mas começou a contar apenas na sexta-feira (27), data da sua alta.

O portal Metrópoles questionou Temer logo após a decisão. Em resposta, o constitucionalista classificou-a como uma ""boa medida de natureza humanitária"".

Moraes fez carreira no Ministério Público do estado de São Paulo (MP-SP), mas passou a atuar na política desde 2010, passando pelos cargos de secretário municipal de Transportes de São Paulo durante a gestão de Gilberto Kassab (PSD), secretário estadual de Segurança Pública durante o governo de Geraldo Alckmin (PSB, à época PSDB) e, por fim, ministro da Justiça durante o governo Temer.

Em janeiro de 2017, o ministro Teori Zavascki morreu em um acidente de avião, abrindo margem para que Moraes fosse indicado. Apesar das críticas por seu histórico político, ministros como Marco Aurélio Mello, Gilmar Mendes e Luiz Fux manifestaram apoio à indicação que foi, por 55 votos favoráveis e 13 contrários, aprovada.",Data Indisponível,https://www.gazetadopovo.com.br/republica/temer-sai-em-defesa-de-moraes-e-diz-que-ministro-colabora-com-pacificacao-do-pais/,gazetadopovo
Crise de confiança no Judiciário aumenta risco Brasil,Confira na Gazeta do Povo: como a erosão da confiança no Judiciário impactou o risco Brasil segundo o estudo de 2024.,"A erosão da confiança no Judiciário brasileiro contribuiu para a forte trajetória de aumento de risco no Brasil, que pulou de 3,07 para 3,32 entre abril e dezembro, segundo o estudo Latin America Country Risk Index and Analysis 2024. Os dados revelam que a confiança do brasileiro nas instituições tem declinado, impulsionada pela corrupção generalizada e pela percepção de parcialidade política, especialmente no Judiciário.

Foi a maior piora entre os seis países analisados - Argentina, Brasil, Chile, Colômbia, El Salvador e México. Por outro lado, a Argentina foi a nação que apresentou uma melhora mais significativa no período, indo de 3,49 para 3,06.

Produzido pelo Adam Smith Center for Economic Freedom e conduzido no Brasil pelo Instituto Millenium, o estudo analisou os riscos políticos, econômicos, sociais e internacionais que rondam seis países da América Latina, expondo um quadro de deterioração acentuada nos principais indicadores.

Judiciário é percebido como ativista

Para Paulo Resende, um dos pesquisadores do Millenium, o resultado em relação ao Judiciário chama a atenção. O poder foi amplamente percebido como independente no país, permitindo uma autonomia sem controles efetivos e resultando em ativismo judicial, que compromete o equilíbrio entre os três poderes e acelera a crise de confiança nas instituições.

“Este foi um resultado muito interessante que obtivemos no estudo”, diz. “A independência do poder judiciário é algo fundamental para o princípio da separação de poderes, e vemos muitos casos de ditaduras em que o poder judiciário é comprometido para dar suporte institucional a um governo ilegítimo. A percepção de um judiciário independente é justamente a percepção de que o judiciário não está sendo comandado por outro poder”.

Mas ressalta: “Porém, este mesmo grau de independência institucional permite ao judiciário agir com ampla autonomia, muitas vezes sem controles efetivos, extrapolando suas atribuições tradicionais, e isto é visto como uma con",Data Indisponível,https://www.gazetadopovo.com.br/economia/erosao-da-confianca-no-judiciario-brasileiro-contribui-para-a-maior-piora-do-risco-pais-na-america-latina/#comentarios?ref=comentarios-materia,gazetadopovo
STF limita penduricalhos no Judiciário e Ministério Público,"Entenda a decisão do STF que restringe penduricalhos do Judiciário, os novos limites salariais e as brechas que ainda mantêm os supersalários no Brasil.","O Supremo Tribunal Federal aprovou nesta semana restrições aos chamados penduricalhos, adicionais que elevam os rendimentos de juízes e promotores acima do teto de R$ 46,3 mil. A medida busca gerar economia, mas mantém exceções que permitem vencimentos reais de até R$ 78 mil mensais.

O que são os penduricalhos e por que eles geram polêmica?

Penduricalhos são benefícios extras, como auxílio-moradia ou gratificações por tempo de serviço, que se somam ao salário base. A polêmica existe porque esses valores frequentemente fazem com que a remuneração final ultrapasse o teto constitucional, que é o salário máximo permitido por lei no setor público brasileiro.

Como funcionam os novos limites impostos pelo Supremo?

A Corte definiu que a soma de vantagens extras não pode ultrapassar 70% do valor do teto. Esse limite foi dividido em dois blocos: até 35% para Adicional por Tempo de Serviço (antiguidade) e outros 35% para verbas indenizatórias, como diárias e ajuda de custo para mudanças. Na prática, um magistrado ainda poderá receber cerca de R$ 78 mil somando esses blocos.

Quais verbas continuam fora do cálculo do teto salarial?

Esta é a principal brecha: o 13º salário, o adicional de férias, o auxílio-saúde (desde que os gastos sejam comprovados) e o abono de permanência (pago a quem já pode se aposentar mas continua trabalhando) não entram na conta do teto. Gratificações por funções eleitorais também ficam de fora, permitindo que o valor líquido final continue muito alto.

Qual é a situação atual dos rendimentos da magistratura no Brasil?

Dados de 2025 mostram que 98% dos juízes brasileiros receberam acima do teto constitucional em pelo menos um mês. Mais de 13 mil magistrados ganharam R$ 100 mil acima do limite anual e, em casos extremos, os valores extras ultrapassaram R$ 1 milhão. O estudo aponta que juízes no Brasil ganham, em média, mais do que seus pares em países como Estados Unidos e Alemanha.

O que acontece com os pagamentos de benefícios criados no passado",Data Indisponível,https://www.gazetadopovo.com.br/economia/como-a-nova-decisao-do-stf-afeta-os-supersalarios-no-judiciario/#comentarios?ref=comentarios-materia,gazetadopovo
