titulo,subtitulo,texto,data,url,portal
“O Debate Essencial”: censura ressurge no Brasil sob disfarce e contra regra expressa da Constituição,"Acompanhe as últimas notícias do Brasil e do mundo sobre política, economia e esportes. Leia também análises, opinião, estilo de vida e mais.","Como foi possível que, debaixo de uma regra expressa da Constituição de 1988, segundo a qual “é vedada toda e qualquer censura de natureza política, ideológica e artística”, o Tribunal Superior Eleitoral (TSE) proibisse, em 2022, a exibição de um documentário sobre o atentado contra o ex-presidente Jair Bolsonaro antes do segundo turno das eleições? Uma decisão do tipo seria compatível com parâmetros internacionalmente consolidados de proteção da liberdade de expressão? Haveria situações em que medida tão extrema se justificaria? Se sim, estariam elas presentes na ocasião?

Foi esse o tema do quarto painel do congresso “Liberdade de Expressão: o debate essencial”, realizado em Brasília em 27 e 28 de setembro. O evento foi organizado pela Gazeta do Povo e pelo Ranking dos Políticos com o apoio do Instituto Liberal, do Instituto dos Advogados do Paraná e da Federação Nacional dos Institutos dos Advogados (Fenia). Vozes influentes no tema da liberdade de expressão do Brasil e do mundo participaram de seis painéis sobre o assunto.

Para discutir a decisão do TSE que proibiu a produtora Brasil Paralelo de exibir o filme “Quem mandou matar Jair Bolsonaro?”, foram convidados Patrícia Blanco, presidente do instituto Palavra Aberta, que atua em prol da liberdade de imprensa; o advogado Rodrigo Xavier Leonardo, estudioso e atuante na área; Fernando Toller, professor de direito constitucional da Universidade Austral, de Buenos Aires, na Argentina; e Todd Henderson, consultor, jurista e professor da Universidade de Chicago, nos Estados Unidos. A mediação ficou a cargo de Fábio Losso, doutor em direito civil pela USP.

Logo no início, uma questão intrigou os debatedores: seria a decisão do TSE um caso de censura prévia, instituto que remonta a períodos autoritários da história brasileira, ou um mero “embargo”, dado seu caráter temporário e com o alegado fim de evitar desequilíbrio na disputa eleitoral, segundo a decisão do TSE?

O termo “embargo” foi introduzido na roda de conve",Data Indisponível,https://www.gazetadopovo.com.br/vida-e-cidadania/o-debate-essencial-censura-ressurge-no-brasil-sob-disfarce-e-contra-regra-expressa-da-constituicao-2/,gazetadopovo
Crianças ucranianas roubadas: governo Lula é cúmplice da Rússia,Governo Lula ignora votação da ONU que exige o retorno de crianças ucranianas sequestradas pela Rússia. Acompanhe análise no Ouça Essa.,"Numa prova de que seus parceiros ideológicos estão acima de tudo, o governo Lula optou pelo silêncio e se absteve de votar numa resolução da ONU que exige o retorno imediato de milhares de crianças ucranianas sequestradas e transferidas à força para a Rússia.

Estima-se que cerca de 20 mil menores tenham sido levados desde o início da invasão russa em 2022. Um crime de guerra que levou o Tribunal Penal Internacional (TPI) a emitir mandados de prisão contra Vladimir Putin e a comissária russa para direitos das crianças, Maria Lvova-Belova.

A resolução das Nações Unidas (clique AQUI para acessar o texto, em inglês) foi aprovada por 91 votos a favor, 12 contra e 57 abstenções. O documento condena as práticas russas de ""reeducação"" forçada: crianças são proibidas de falar ucraniano, recebem novos nomes russos e, em alguns casos, são recrutadas para montar drones usados contra sua própria pátria. Levantamento da Universidade de Yale aponta para mais de 200 instalações na Rússia onde esses menores são mantidos e submetidos à doutrinação política e cultural.

Desculpa brasileira desdenha do destino de milhares de crianças ucranianas

A delegação brasileira justificou a abstenção alegando que o ""tom do texto não contribui para fomentar o diálogo"". No entanto, o documento da ONU está longe de qualquer retórica extremada. Simplesmente exige investigações, responsabilização dos culpados, fim das deportações forçadas e retorno imediato das crianças às suas famílias. Ou seja, exatamente o que se espera de qualquer país comprometido com os direitos humanos.

A postura brasileira repete um padrão ideológico. No último ano, o governo Lula também se absteve em votações que condenavam crimes de guerra da Rússia, a repressão violenta do regime iraniano contra mulheres e a falta de transparência eleitoral na Venezuela de Nicolás Maduro. Em todos os casos, o Brasil optou por não contrariar governos autoritários aliados, mesmo quando vidas estão em jogo.

A reação da Ucrânia foi contund",Data Indisponível,https://www.gazetadopovo.com.br/republica/criancas-ucranianas-roubadas-governo-lula-vira-cumplice-de-crime-vergonhoso/#comentarios?ref=comentarios-materia,gazetadopovo
Petrobras reajusta querosene de aviação em 55% e passagens podem disparar,Combustível de aviões responde por 36% dos custos das companhias aéreas. Cada US$ 1 de reajuste corresponde a aumento de 10% nas passagens. Leia na Gazeta do Povo.,"Combustível de aviões responde por 36% dos custos das companhias aéreas. Cada US$ 1 de reajuste corresponde a aumento de 10% nas passagens. (Foto: Paulo Pinto/Agência Brasil )

A Petrobras reajustou, nesta semana, o querosene de aviação em 55% por causa dos efeitos da guerra no Oriente Médio no preço internacional do petróleo. O combustível – chamado de QAV – é responsável por 36% dos custos das companhias aéreas e pode levar a uma disparada nos preços das passagens.

Segundo uma apuração do site Aeroin e informações do Valor Econômico junto da holding Abra, que reúne as companhias Gol e Avianca, publicadas nesta terça-feira (31), o reajuste passa a valer a partir do dia 1º de abril.

“É um crescimento moderado feito pela Petrobras para o mês de abril”, afirmou o diretor da Abra, Manuel Irarrázaval em uma conferência com analistas mais cedo.

A Gazeta do Povo vem pedindo informações à Petrobras desde a tarde de segunda-feira (30) e aguarda retorno.

VEJA TAMBÉM: O que a CPMI do INSS revelou sobre o Master e que abre portas para uma nova CPI

Levantamentos realizados por plataformas de venda de passagens apontam que as tarifas aumentaram, em média, 15% em apenas 10 dias. Ao mesmo tempo, o IBGE apontou que as tarifas subiram 5,94% na primeira quinzena de março, sendo o item individual com maior impacto na inflação do mês.

Ainda na segunda-feira (30), a Vibra Energia, distribuidora de QAV nos aeroportos brasileiros, confirmou o reajuste. A empresa era parte da BR Distribuidora, estatal vinculada à Petrobras e que foi privatizada durante o governo do ex-presidente Jair Bolsonaro (PL).

“A Vibra informa que, a partir de 1º de abril de 2026, irá repassar o reajuste do preço do Querosene de Aviação (QAV) aplicado pela Petrobras”, disse à reportagem.

Irarrázaval informou, durante a conferência com analistas, que cada US$ 1 a mais no preço do querosene de aviação, o grupo precisa aumentar as passagens em 10% para compensar o reajuste. O executivo ainda pontuou que este mes",Data Indisponível,https://www.gazetadopovo.com.br/economia/petrobras-reajusta-querosene-aviacao-55-passagens-podem-disparar/#comentarios?ref=comentarios-materia,gazetadopovo
X suspende conta de comandante do Irã após ameaça a Israel,"O comandante da Força Quds da Guarda Revolucionária Islâmica do Irã, Esmail Qaani, fez ameaças a Israel no X e teve sua conta suspensa","O comandante da Força Quds da Guarda Revolucionária Islâmica do Irã, Esmail Qaani (ao centro), em imagem de 2024 (Foto: ABEDIN TAHERKENAREH/EFE/EPA )

O comandante da Força Quds da Guarda Revolucionária Islâmica do Irã, Esmail Qaani, postou nesta segunda-feira (30) uma mensagem no X na qual elogiava as várias frentes que enfrentam Israel na atual guerra no Oriente Médio e fazia ameaças aos israelenses. Pouco depois, a rede social suspendeu a conta de Qaani, alegando violação das suas regras.

“[O primeiro-ministro de Israel, Benjamin] Netanyahu sonhava em expandir o cinturão de segurança na região, mas o fogo inteligente e corajoso dos irmãos do Hezbollah no norte e dos houthis no sul expôs as falsas promessas do regime aos colonos”, escreveu Qaani no X, em uma conta recém-criada.

Era uma referência aos ataques do grupo terrorista libanês aliado de Teerã e dos rebeldes houthis do Iêmen a Israel desde que este e os Estados Unidos iniciaram uma guerra contra o Irã, em 28 de fevereiro.

“O desejo dos comandantes da resistência mártires foi realizado: a sala de guerra da frente de resistência é uma só. Acostumem-se à nova ordem na região”, ameaçou Qaani, cuja morte havia sido especulada desde o início da guerra e foi negada por agências estatais iranianas.",Data Indisponível,https://www.gazetadopovo.com.br/mundo/x-suspende-conta-comandante-ira-apos-ameaca-israel/#comentarios?ref=comentarios-materia,gazetadopovo
Prisão domiciliar e silêncio sobre conversa: a contradição Moraes,"No programa Última Análise desta terça-feira (24), convidados falam a respeito de prisão domiciliar de Bolsonaro e de silêncio de Moraes.","O ministro Alexandre de Moraes, do Supremo Tribunal Federal (STF), converteu nesta terça-feira (24) o regime de prisão do ex-presidente Jair Bolsonaro (PL) para a domiciliar humanitária. A decisão ocorreu um dia depois da Procuradoria-Geral da República (PGR) se pronunciar favoravelmente à progressão da detenção.

Bolsonaro irá para a prisão domiciliar após ter alta hospitalar em que trata de uma grave pneumonia nos dois pulmões, em princípio por 90 dias ao sair do internamento. Ele ainda determinou outras regras como o uso de tornozeleira eletrônica e limitação de visitas.

Este será o ponto de partida do programa Última Análise desta terça-feira (24). Hoje participam do programa o professor da FGV Daniel Vargas, o ex-juiz de Direito Adriano Soares da Costa e o ex-ministro da Agricultura Antônio Cabrera Mano Filho.

O desconhecido titular do telefone

Outro tema do programa de hoje serão as especulações sobre o usuário titular do telefone funcional do STF, que recebeu mensagens de socorro do banqueiro Daniel Vorcaro, dono do Banco Master, no dia em que ele foi preso pela primeira vez. Diante do silêncio da Corte, o presidente da CPMI do INSS, senador Carlos Viana (Podemos-MG), informou que irá oficiar o próprio presidente do Supremo para que esclareça os fatos.

A conversa comprometedora de Alcolumbre

O programa também vai falar a respeito de reportagem do portal Metrópoles, que publicou uma conversa do senador David Alcolumbre (União-AP) com o prefeito interino de Macapá, Pedro DaLua (União-AP). Alcolumbre teria o orientado a procurar um desembargador no Tribunal de Justiça, sem a companhia de advogado, para tratar do julgamento de uma ação contra o prefeito eleito, Antonio Furlan (PSD-AP), adversário político dos dois.

Os desdobramentos da CPMI do INSS

Os convidados vão analisar quais serão os próximos assuntos que podem voltar nas investigações da CPMI do INSS, como a quebra de sigilo de Fabio Luís Lula da Silva, o ""Lulinha"", o filho do presidente Lula, que t",Data Indisponível,https://www.gazetadopovo.com.br/ultima-analise/prisao-domiciliar-e-silencio-sobre-conversa-a-contradicao-moraes/#comentarios?ref=comentarios-materia,gazetadopovo
STJ decide se sindicatos podem pleitear verbas do Fundeb,O STJ vai decidir se sindicatos de professores têm direito de acionar a Justiça para obrigar a União a complementar verbas do Fundeb.,"O STJ vai decidir se sindicatos de professores têm direito de acionar a Justiça para obrigar a União a complementar verbas destinadas ao Fundo de Desenvolvimento da Educação Básica. Foto ilustrativa. (Foto: Brunno Covello/Gazeta do Povo )

Depois de sindicatos de professores de diversos estados do Brasil entrarem com ações na Justiça para solicitar repasse de verbas milionárias que não teriam sido pagas por meio do Fundo de Desenvolvimento da Educação Básica (Fundeb), o Superior Tribunal de Justiça (STJ) travou todos os processos sobre o tema e analisa se sindicatos podem, ou não, ajuizar as ações.

Segundo a Corte, há mais de 280 casos semelhantes em análise nos Tribunais Regionais Federais (TRFs), além de 44 acórdãos e 1.244 decisões monocráticas proferidas, com temática similar, por ministros do STJ.

O valor pleiteado chegaria a dezenas de bilhões de reais, já que apenas na Bahia o total dos recursos solicitados giraria em torno de R$ 8 bilhões, seguido por aproximadamente R$ 6 bilhões no Ceará. Pernambuco e Maranhão também estariam na lista dos maiores valores pleiteados. A Gazeta do Povo tentou contato com os principais sindicatos desses estados, mas não obteve retorno.

Apesar do grande número de ações abertas pelos sindicatos, há controvérsia a respeito dessas associações terem legitimidade para exigir na Justiça que a União transfira valores complementares do Fundeb a estados e municípios.

Segundo o STJ, a análise do tema ocorrerá de uma única vez, já que há inúmeros “recursos repetitivos”, e a decisão afetará todos os processos pendentes com recurso na segunda instância ou em tramitação no STJ.

De acordo com documentos da Corte, um dos principais argumentos em favor dos sindicatos é de que eles podem agir em prol do interesse da categoria profissional, como estabelece o artigo 8º da Constituição Federal. Como as regras do Fundeb estabelecem que parte dos recursos seja, obrigatoriamente, empregada na remuneração dos servidores da educação, o recebimento d",Data Indisponível,https://www.gazetadopovo.com.br/vida-e-cidadania/stj-decide-se-sindicatos-de-professores-podem-pleitear-na-justica-verbas-do-fundeb/#comentarios?ref=comentarios-materia,gazetadopovo
CPI do Master agora depende de Kassio Nunes Marques,"Kassio Nunes Marques foi sorteado relator de pedido da oposição para obrigar presidente do Senado, Davi Alcolumbre, a instalar CPI do Master.","Com o fim da CPMI do INSS, a chance de que as investigações sobre o Banco Master avancem no Congresso agora depende do ministro Kassio Nunes Marques. Ele é relator de um pedido da oposição no Supremo Tribunal Federal (STF) para determinar que o Senado instale uma nova comissão parlamentar de inquérito que apure as fraudes financeiras do banqueiro Daniel Vorcaro e sua rede de influência política e jurídica.

O encerramento da CPMI do INSS – que começava a investigar o Master, em razão de fraudes em operações de crédito consignado – ocorreu por obra de dois atores: o presidente do Senado, Davi Alcolumbre (União-AP), que se recusou a receber e aprovar um pedido de prorrogação, que reunia o apoio necessário de deputados e senadores; e da maioria dos ministros do STF, que decidiu rejeitar uma ação desses parlamentares para obrigar o Congresso a estender a duração da comissão, instalada em agosto.

No julgamento no STF, Nunes Marques se posicionou com a maioria dos ministros, contrários a uma intervenção no Legislativo que determinasse a continuidade da CPMI do INSS. Num curto voto, ele apenas disse que a questão seria interna e deveria ser resolvida politicamente dentro do próprio Congresso, sem ingerência do STF.

“Me preocupa não permitir que a própria Casa [Congresso] faça seus arranjos normativos. Essa aferição [dos requisitos para prorrogação da CPMI] tem que ser feita pelo próprio presidente Senado”, disse Nunes Marques.

Na ação apresentada no STF, parlamentares de oposição apontaram que Alcolumbre se omitiu, pois sequer deixou protocolar o pedido de prorrogação. Eles argumentavam que, segundo a Constituição e a própria jurisprudência do STF, a investigação parlamentar é um direito da minoria, bastando que cumpra os requisitos (apoio de 1/3 de deputados ou senadores e fato determinado) para que, obrigatoriamente, haja a instalação.

Nunes Marques, porém, se posicionou com a maioria do STF, ao entender que o cumprimento desses requisitos não leva automaticamente à ",Data Indisponível,https://www.gazetadopovo.com.br/republica/investigacao-do-congresso-sobre-master-agora-depende-de-nunes-marques/#comentarios?ref=comentarios-materia,gazetadopovo
Show trials: julgamentos políticos usados para perseguir opositores,"Os 'show trials' foram usados por ditaduras para eliminar opositores. De Stalin a Hitler, conheça a história desses julgamentos de fachada","Advogados atrás de pistas e testemunhas de última hora, jornalistas em frente aos tribunais, tensão nos corredores. O juiz está prestes a dar a sentença, mas todo mundo já sabe o veredicto: ele foi selado antes mesmo do julgamento começar. Poderia ser ficção, mas a história está cheia de exemplos reais. Os “show trials”, também conhecidos como julgamentos de fachada ou julgamentos políticos, são uma ferramenta usada por regimes autoritários para calar os opositores e reforçar seu poder.

Na definição do dicionário Cambridge, consistem em um julgamento organizado por um governo para ter efeito sobre a opinião pública e reduzir a oposição política, e não para encontrar a verdade. Ou seja, não importa o que for apresentado pela defesa ou acusação, o réu já está condenado.

Os primeiros julgamentos de fachada datam da década de 1930, na União Soviética, quando o ditador Joseph Stalin, depois de afundar a economia, passou a eliminar vários oponentes políticos. O objetivo era manter o poder por meio do terror, mandando um claro recado sobre o que aconteceria com os “inimigos do povo”.

Este tipo de julgamento costuma ser feito “para cumprir tabela”, com cartas marcadas. No nazismo, eram rápidos. Na URSS e na China ganhavam mais holofotes para deixarem clara as suas mensagens.

União Soviética: provas criadas e confissões sob tortura

Na União Soviética, Stalin usou três sessões para eliminar inimigos e manipular a opinião pública retratando os acusados ​​como traidores perigosos. Os “Julgamentos de Moscou” aconteceram durante o Grande Expurgo, como ficou conhecida a perseguição que levou à prisão e morte de pelo menos 750 mil pessoas, entre líderes, políticos e críticos de Stalin.

Os condenados eram fuzilados ou enviados para campos de trabalho forçado, os “gulags”, onde sofriam torturas físicas e psicológicas. Calcula-se que mais de 20 milhões de pessoas tenham passado por estes campos até sua extinção definitiva, na década de 1980.

O expurgo incluía antigos aliados, t",Data Indisponível,https://www.gazetadopovo.com.br/ideias/show-trials-julgamentos-politicos-perseguir-opositores/#comentarios?ref=comentarios-materia,gazetadopovo
Silêncio das classes jurídica e jornalística fortalece censura do STF,Classes jurídica e jornalística mantêm silêncio institucional em relação à censura contra a direita promovida pelo STF.,"No dia 13 de outubro, a Associação Brasileira de Imprensa (ABI) divulgou uma nota em defesa do jornalista Breno Altman, denunciado pelo Ministério Público Federal (MPF) por racismo contra judeus e apologia ao crime. No comunicado, a entidade afirmou que a denúncia representava um atentado à liberdade de expressão e declarou ""irrestrito apoio"" ao jornalista.

A manifestação ocorre em um momento em que comunicadores e veículos de direita seguem submetidos a bloqueios de contas nas redes, ordens de censura e outras medidas do Poder Judiciário. Nenhuma dessas medidas recebeu o mesmo tipo de repúdio por parte da ABI, da Fenaj ou de outras entidades de imprensa.

Por exemplo, na prisão do jornalista Oswaldo Eustáquio decretada pelo Supremo Tribunal Federal (STF) em 2020 ou na detenção com interrogatório do português Sérgio Tavares em 2024, nenhuma entidade do ramo se manifestou, mesmo após questionamentos da Gazeta do Povo. Casos de cerceamento direto da atividade jornalística não provocaram notas de repúdio ou comunicados, mesmo quando envolveram prisões e interrogatórios de profissionais da imprensa.

O silêncio diante de abusos do Judiciário contra a direita não é exclusividade de entidades jornalísticas. A classe jurídica, também diretamente ligada aos casos, tem negligenciado o papel de criticar medidas do STF. A Gazeta do Povo já questionou a Ordem dos Advogados do Brasil sobre o silêncio, mas não obteve resposta.

Não há dados públicos sobre quantos casos de censura envolvem ordens diretas do STF e do ministro relator dos principais inquéritos contra a direita, Alexandre de Moraes. A ausência de transparência impede saber a dimensão exata do fenômeno, mas os episódios documentados deixam evidente que medidas de censura prévia foram normalizadas no Brasil pelas mãos do ministro.

Mesmo assim, entidades jurídicas como a própria OAB já manifestaram apoio a Moraes em diferentes ocasiões nos últimos anos, ao mesmo tempo em que ignoraram restrições severas à liberdade de",Data Indisponível,https://www.gazetadopovo.com.br/vida-e-cidadania/silencio-das-classes-juridica-e-jornalistica-sobre-abusos-fortalece-censura-do-stf/#comentarios?ref=comentarios-materia,gazetadopovo
Jornal: Trump estaria disposto a encerrar guerra sem reabrir Ormuz,"Segundo WSJ, Trump e assessores teriam avaliado que operação para reabrir Ormuz estenderia demais a guerra com o Irã","Trump chega à Casa Branca na noite de domingo (29), após passar o fim de semana na Flórida (Foto: Yuri Gripas/EFE/EPA )

O jornal americano The Wall Street Journal publicou nesta segunda-feira (30) uma reportagem apontando que o presidente dos EUA, Donald Trump, teria dito a assessores que está disposto a encerrar a guerra contra o Irã mesmo que o Estreito de Ormuz permaneça quase totalmente bloqueado.

A passagem foi fechada quase totalmente pelo Irã após o início do conflito com EUA e Israel, em 28 de fevereiro. Cerca de 20% do petróleo e do gás natural liquefeito (GNL) do mundo transitavam por Ormuz antes da guerra.

Segundo fontes do governo americano ouvidas pelo WSJ, Trump e seus assessores têm avaliado que uma operação para reabrir a passagem estenderia a guerra além do prazo de quatro a seis semanas de conflito estabelecido pelo presidente dos EUA.

Dessa forma, o republicano teria decidido que Washington buscaria atingir os objetivos de enfraquecer a Marinha do Irã e seu arsenal de mísseis e reduzir as hostilidades atuais entre os dois países, enquanto a reabertura total de Ormuz seria negociada diplomaticamente.

Caso não houvesse resultados, Washington pressionaria aliados na Europa e no Golfo Pérsico para assumirem a tarefa de reabrir o estreito, disseram as autoridades ouvidas pelo WSJ. Trump e a Casa Branca ainda não se pronunciaram sobre o assunto.

Em post na rede Truth Social nesta terça-feira (31), Trump pressionou países aliados para que reabram Ormuz.

“Para todos os países que não conseguem obter combustível de aviação por causa do [bloqueio do] Estreito de Ormuz, como o Reino Unido, que se recusou a se envolver na decapitação do [regime do] Irã, tenho uma sugestão: número 1, comprem dos EUA, temos bastante, e número 2, criem coragem, vão até o estreito e simplesmente TOMEM [o petróleo]”, escreveu o presidente americano.

“Vocês terão que aprender a lutar por si mesmos, os EUA não estarão mais lá para ajudá-los, assim como vocês não estiveram lá",Data Indisponível,https://www.gazetadopovo.com.br/mundo/jornal-diz-trump-estaria-disposto-encerrar-guerra-sem-reabrir-ormuz/,gazetadopovo
EUA x Irã: os novos capítulos no conflito,"Podcast 15 minutos analisa as tensões geopolíticas no Oriente Médio, focando no confronto entre Israel, Irã e EUA","O podcast 15 minutos analisa os novos capítulos das tensões geopolíticas no Oriente Médio, focando no confronto entre Israel, Irã e Estados Unidos.

O programa detalha a estratégia de Donald Trump, que oscila entre a pressão militar — incluindo a possível ocupação da estratégica Ilha de Kharg — e a busca por novos acordos diplomáticos.

O comentarista Frederico Junkert discute o impacto econômico global do bloqueio no Estreito de Ormuz, por onde passa grande parte do petróleo mundial, e as dificuldades de uma transição política em solo iraniano.

Além disso, o podcast traça paralelos com a situação na Venezuela e em Cuba, avaliando como o governo americano utiliza sanções e operações especiais para forçar mudanças de regime.

O conteúdo também aborda o desgaste interno de Trump junto à sua base conservadora devido ao receio de novos conflitos prolongados no exterior. Por fim, o programa destaca o papel da Guarda Revolucionária e as implicações religiosas e humanitárias recentes na região.",Data Indisponível,https://www.gazetadopovo.com.br/mundo/eua-x-ira-os-novos-capitulos-no-conflito/#comentarios?ref=comentarios-materia,gazetadopovo
