titulo,subtitulo,texto,data,url,portal
Juiz de Nova York nega pedido de Maduro para arquivar caso,"Juiz negou pedido da defesa para arquivar caso contra Maduro e esposa, mas adiou decisão sobre pagamento da defesa do ex-ditador","Manifestantes protestam contra o ex-ditador venezuelano Nicolás Maduro em frente a tribunal federal em Nova York nesta quinta-feira (26) (Foto: OLGA FEDOROVA/EFE/EPA )

O juiz federal Alvin Hellerstein negou nesta quinta-feira (26) um pedido do ex-ditador venezuelano Nicolás Maduro e da esposa deste, Cilia Flores, para arquivar o processo contra ambos na Justiça federal de Nova York.

A defesa dos réus havia pedido o arquivamento do caso, alegando que Maduro e Flores não têm como pagar sua defesa, já que o governo dos Estados Unidos proibiu o regime da Venezuela (atualmente liderado pela chavista Delcy Rodríguez) de custear os honorários advocatícios devido às sanções econômicas impostas ao país.

A decisão de Hellerstein foi anunciada durante uma audiência em um tribunal federal de Nova York, a segunda da qual o casal participou desde que foi capturado numa operação militar dos EUA em Caracas, em 3 de janeiro. Na primeira audiência, realizada dois dias após a operação, o casal se declarou inocente.

Segundo informações da emissora CNN, Hellerstein deixou aberta a possibilidade de a defesa solicitar novamente o arquivamento do caso devido à decisão da gestão Trump de não permitir que a Venezuela pague a defesa.

Ele disse que vai avaliar se essa medida do governo americano foi arbitrária. Caso esse seja seu entendimento, os advogados de Maduro e Flores poderão solicitar novamente o arquivamento do caso, disse o juiz.

“Neste momento, [arquivar o caso] seria um passo tão sério baseado em hipóteses, que não acho que devamos abordar isso agora”, disse Hellerstein.

O juiz sinalizou que poderá emitir em breve uma decisão sobre se ordenará ou não que o governo Trump permita que a Venezuela pague os honorários advocatícios.

A defesa de Maduro e Flores alega que esse impedimento, determinado pelo Escritório de Controle de Ativos Estrangeiros do Departamento do Tesouro dos Estados Unidos (OFAC), viola direitos do casal, já que interfere no seu direito de escolher sua própr",Data Indisponível,https://www.gazetadopovo.com.br/mundo/em-nova-audiencia-juiz-de-nova-york-nega-pedido-de-maduro-para-arquivar-caso/#comentarios?ref=comentarios-materia,gazetadopovo
Corte italiana aprova extradição de Zambelli,Pedido do governo brasileiro foi aprovado e Zambelli deve vir ao Brasil para cumprir pena na penitenciária da Colmeia.,"Pedido do governo brasileiro foi aprovado e Zambelli deve vir ao Brasil para cumprir pena na penitenciária da Colmeia. (Foto: Vinicius Loures/Câmara dos Deputados )

A Corte de Apelação de Roma decidiu aprovar, nesta quinta-feira (26) a extradição da ex-deputada federal Carla Zambelli (PL). A informação foi confirmada pela defesa. A decisão foi comunicada em ofício ao Ministério de Relações Exteriores. A informação foi divulgada inicialmente pela CNN Brasil e confirmada à Gazeta do Povo pela defesa.

""O fato de a pessoa a ser extraditada possuir dupla cidadania italiana e brasileira não constitui impedimento; pelo contrário, fortalece o vínculo jurídico entre a pessoa e o Estado requerente, que a considera cidadã de pleno direito e, portanto, tem plena legitimidade para requerer sua extradição para o cumprimento da sentença"", diz a sentença.

Agora, os advogados irão apresentar dois recursos à Corte de Cassação, um contra a extradição em si e outro questionando a imparcialidade dos juízes. O prazo para recorrer é de 15 dias. Caso a decisão seja mantida, ela deve cumprir a pena na Penitenciária Feminina do Distrito Federal, conhecida como ""Colmeia"".

A cooperação, porém, tem condições: o governo brasileiro deve informar periodicamente à Itália sobre a situação de Zambelli, além de mantê-la na ""Colmeia"" e garantir o livre acesso a advogados.

Durante o julgamento, ficou a cargo do governo brasileiro demonstrar que Zambelli não passaria por violações de direitos humanos causadas por más condições do sistema penitenciário. Para isso, foram enviados documentos detalhando o ambiente e o funcionamento do estabelecimento.

Do outro lado, a defesa tentou demonstrar que houve perseguição política por parte do ministro do Supremo Tribunal Federal (STF) Alexandre de Moraes e que, com isso, sua condenação não foi justa.

Para os juízes, porém, os fatos atribuídos à ex-deputada ""não constituem crime político, nem mesmo em seu sentido mais amplo"". O entendimento é de que a integri",Data Indisponível,https://www.gazetadopovo.com.br/republica/corte-italiana-aprova-extradicao-de-zambelli/?ref=mais-lidas,gazetadopovo
Trump diz que Maduro será alvo de novos processos nos EUA,Trump afirmou que o ex-ditador Nicolás Maduro deve enfrentar novos processos nos EUA em meio ao julgamento atual por narcotráfico,"Ilustração da artista Jane Rosenberg retrata o ditador Nicolás Maduro durante audiência no tribunal federal de Nova York (Foto: Jane Rosenberg/EFE )

O presidente dos EUA, Donald Trump, afirmou antes de uma reunião de gabinete na Casa Branca nesta quinta-feira (26) que o ex-ditador Nicolás Maduro deve enfrentar novos processos nos EUA em meio ao julgamento atual por narcotráfico.

O ex-líder chavista e sua esposa, Cilia Flores, enfrentam sua segunda audiência no Tribunal do Distrito Sul de Nova York neste início de tarde. Os dois chegaram à corte por volta das 5h do horário de Brasília e o juiz Alvin Hellerstein já deu início à sessão.

Trump exaltou a ação de captura do ditador em 3 de janeiro, descrevendo-a como ""uma grande operação militar"". Maduro foi transferido de Caracas a Nova York, onde enfrenta quatro acusações por crimes graves: três de conspiração para cometer narcoterrorismo, importação de cocaína e posse de metralhadoras e dispositivos explosivos; e uma quarta acusação de posse dessas armas.

Na Casa Branca, o líder republicano argumentou que haverá outros julgamentos contra o venezuelano, ""porque eles o processaram por uma fração das coisas que fez”. O presidente americano disse que Maduro ""matou muita gente"" e ""esvaziou suas prisões em nosso país"".

O Partido Socialista Unido da Venezuela, do qual Maduro faz parte, organizou uma manifestação na Praça Bolívar, em Caracas, nesta quinta-feira, em protesto ao julgamento do ditador deposto.",Data Indisponível,https://www.gazetadopovo.com.br/mundo/antes-de-audiencia-trump-diz-que-maduro-sera-alvo-de-novos-processos-nos-eua/,gazetadopovo
O efeito Trump no comércio internacional,"Enquanto a Europa mantém firme o compromisso com pautas socioambientais, os Estados Unidos, sob Trump, seguem na contramão.","A despeito de um discurso historicamente voltado à promoção da paz e da estabilidade global, os Estados Unidos pós-Trump representam um vetor de instabilidades que atravessam Oriente e Ocidente. De representante legítimo do livre-mercado a promotor de desordens de toda sorte, seu retorno ao centro do poder amplia assimetrias, desestabiliza alianças históricas e impõe às empresas uma nova variável de imprevisibilidade: o efeito Trump.

Nos primeiros dias de governo, Donald Trump exonerou mulheres de cargos de alta patente, retirou os Estados Unidos do Acordo de Paris e deportou aos milhares. Com essas ações, impôs uma tensão adicional sobre o futuro das políticas socioambientais e de diversidade em escala global. O efeito Trump levou algumas das principais empresas americanas a anunciarem retração em seus programas de diversidade.

Enquanto a Europa mantém firme o compromisso com pautas socioambientais, os Estados Unidos, sob Trump, seguem na contramão. E consumidores, cada vez mais conscientes, observam

Seu conservadorismo, no entanto, contrasta com as condenações criminais que enfrenta, incluindo falsificação de registros, fraudes corporativas e um pagamento ilegal relacionado a uma atriz de filmes adultos. O paradoxo não se limita à vida pessoal e empresarial: estende-se à política. Trump confronta instituições, tensiona a sociedade e já ensaia alternativas para um terceiro mandato – o que, por ora, é inconstitucional nos Estados Unidos.

Ocorre que Trump reorganiza o campo de atuação das empresas. Pressões por reindustrialização a partir do cinturão da ferrugem, guerras tarifárias e políticas intervencionistas alteram a lógica decisória de empresas multinacionais. Em um país historicamente liberal, o intervencionismo simbólico gera incertezas e eleva o grau de complexidade na gestão de cadeias globais. As empresas se veem obrigadas a operar sob um novo conjunto de sinais institucionais – muitas vezes contraditórios – e a lidar com efeitos contingenciais que não ",Data Indisponível,https://www.gazetadopovo.com.br/opiniao/artigos/o-efeito-trump-no-comercio-internacional/#comentarios?ref=comentarios-materia,gazetadopovo
Toffoli fica sem saída e renuncia à relatoria da CPI do Master,"No programa desta quarta-feira (11) os comentaristas tratam da decisão de Dias Toffoli, que se declarou suspeito para relatar CPI do Master","O ministro do Supremo Tribunal Federal (STF), Dias Toffoli, foi sorteado nesta quarta-feira (11) como relator do pedido para que o Congresso Nacional instale uma CPI para investigar o relacionamento do Banco Master com o Banco de Brasília (BRB). Pouco depois, ele se declarou suspeito alegando razões de ""foro íntimo"".

O mandado de segurança (MS) foi impetrado pelo deputado Rodrigo Rollemberg (PSD-DF). Rival do governador do Distrito Federal Ibaneis Rocha (MDB), Rollemberg articulava-se para coletar assinaturas para instalar o colegiado desde novembro, quando o banqueiro e dono do Master, Daniel Vorcaro, foi preso pela primeira vez na Operação Compliance Zero. Na petição, Rollemberg alega que a presidência da Câmara se omite ao não instalar os trabalhos.

Não há prazo para que o ministro Dias Toffoli dê um parecer sobre o caso, segundo as regras do regimento do STF. O magistrado pode se declarar impedido, de acordo com o mesmo regimento. Procurado pela reportagem, o STF informou apenas o número do MS.

PGR sabia de vazamento de dados sigilosos para Vorcaro desde 2025

A Procuradoria-Geral da República foi informada ainda em novembro de 2025 de que o ex-banqueiro Daniel Vorcaro tinha acesso indevido a dados sigilosos da investigação que corria contra ele. O alerta ocorreu após a Polícia Federal apreender o celular do empresário, cuja análise revelou que os vazamentos aconteciam desde meados de 2025, por meio de documentos, prints e fotos extraídos de sistemas institucionais.

Segundo investigadores, parte do material chegava a Vorcaro por intermédio de Luiz Phillipi Mourão, o “Sicário”, apontado como operador do grupo que teria hackeado senhas de servidores para acessar informações da PF, do MPF e até da Interpol. Além de dados sobre o inquérito principal, o ex-banqueiro também teria obtido informações de apurações do Banco Central envolvendo o Banco Master.

A PGR, contudo, não comentou oficialmente o caso, enquanto a defesa de Vorcaro sustenta que não se manifestará",Data Indisponível,https://www.gazetadopovo.com.br/ultima-analise/toffoli-fica-sem-saida-e-renuncia-a-relatoria-da-cpi-do-master/#comentarios?ref=comentarios-materia,gazetadopovo
Kassab deixa governo Tarcísio para se dedicar às eleições,Gilberto Kassab deixou o comando da Secretaria de Governo da gestão Tarcísio para se dedicar às eleições deste ano.,"Gilberto Kassab deixou o comando da Secretaria de Governo da gestão Tarcísio para se dedicar às eleições deste ano. (Foto: Marcelo Camargo/Agência Brasil )

O presidente do PSD, Gilberto Kassab, anunciou nesta quarta-feira (25) que deixou o comando da Secretaria de Governo da gestão do governador de São Paulo, Tarcísio de Freitas (Republicanos), para se dedicar às eleições deste ano. Ele estava no cargo desde janeiro de 2023.

""Diante das intensas atividades nos campos partidário e eleitoral que se apresentam no calendário político de 2026, com eleições para presidente, governadores, senadores e deputados em outubro, a minha atuação como secretário de Governo e Relações Institucionais do Estado de São Paulo torna-se incompatível com minha atividade política e eleitoral neste período"", disse o dirigente nas redes sociais.

Tarcísio já declarou que disputou a reeleição neste ano. Kassab agradeceu ao governador. ""Em 2022 o PSD tomou a acertada decisão de apoiar a candidatura do Tarcísio, pois ficava claro que ele era o mais preparado para adotar as medidas, implementar os projetos e ações que o Estado de São Paulo demandava para seguir e intensificar seu desenvolvimento"", afirmou.

“O êxito alcançado em todos os setores ao longo desses quatro anos credencia o governador e seu governo a postular uma recondução, que tem o apoio do PSD, como ocorreu quando da sua eleição”, acrescentou Kassab.

O PSD conta com dois presidenciáveis, os governadores Eduardo Leite (Rio Grande do Sul) e Ronaldo Caiado (Goiás). O governador do Paraná, Ratinho Júnior (PSD), se retirou da corrida pelo Planalto nesta segunda (23).",Data Indisponível,https://www.gazetadopovo.com.br/eleicoes/2026/sao-paulo-2026/kassab-deixa-governo-tarcisio-para-se-dedicar-as-eleicoes/#comentarios?ref=comentarios-materia,gazetadopovo
Relatório da CPMI do INSS já tem 228 indiciados e não cita Lula e nem Bolsonaro,"Relator do colegiado, Alfredo Gaspar, diz que preparou relatório técnico e que irregularidades podem chegar a R$ 40 bilhões. Leia na Gazeta do Povo.","Relator do colegiado, Alfredo Gaspar, diz que preparou relatório técnico e que irregularidades podem chegar a R$ 40 bilhões. (Foto: Bruno Spada/Câmara dos Deputados )

O relatório preliminar da CPMI do INSS já aponta 228 indiciados, não cita o presidente Luiz Inácio Lula da Silva (PT) nem o ex-presidente Jair Bolsonaro (PL) e revela um possível esquema de até R$ 40 bilhões em irregularidades. O documento, com cerca de 5 mil páginas, foi elaborado pelo relator Alfredo Gaspar (União Brasil-AL) com base em dados técnicos e investigações oficiais.

Gaspar afirmou que optou por não incluir nomes de presidentes da República por considerar que o relatório precisa ser estritamente técnico e fundamentado em provas. O relatório foi preparado antecipadamente à prorrogação dos trabalhos da comissão por mais 120 dias, conforme decidiu o ministro André Mendonça, do Supremo Tribunal Federal (STF) ao dar um prazo de 48 horas para o presidente do Senado, Davi Alcolumbre (União-AP).

“Eu não cito no relatório durante essas 5 mil páginas Lula ou Bolsonaro porque eu tenho uma responsabilidade de fazer uma coisa técnica baseado nos dados da CGU, do TCU, dos depoimentos das quebras de sigilo”, declarou a jornalistas na segunda (23).

VEJA TAMBÉM: Mendonça livra servidor do BC suspeito de envolvimento com Vorcaro de depor em CPI

Alfredo Gaspar também reforçou que o foco da comissão não é político, mas sim a correção de distorções históricas no sistema previdenciário brasileiro.

“Pra mim pouco importa se foi de governo A governo B, C, D. O nosso papel aqui é corrigir uma dívida histórica da Previdência Social para com o povo brasileiro”, acrescentou.

A investigação identificou indícios de uma estrutura complexa de fraudes com possível atuação de organizações criminosas e conexões internacionais. Segundo Gaspar, o volume de recursos movimentados pode chegar a R$ 40 bilhões, o que levanta suspeitas de lavagem de dinheiro em larga escala.

A extensão da CPMI, disse Gaspar, também deve abri",Data Indisponível,https://www.gazetadopovo.com.br/republica/relatorio-preliminar-tem-228-indiciados-nao-cita-lula-bolsonaro/#comentarios?ref=comentarios-materia,gazetadopovo
A terceirização da política foi um desastre,"Acompanhe as últimas notícias do Brasil e do mundo sobre política, economia e esportes. Leia também análises, opinião, estilo de vida e mais.","A política não pode ser terceirizada. A verdadeira vitória precisa vir das urnas, em eleições limpas e transparentes, não do capricho das togas. (Foto: Fellipe Sampaio/STF )

A crise que hoje corrói o país não surgiu do nada. Ela foi, em larga medida, contratada quando a disputa contra o bolsonarismo deixou de ser travada no campo político — no debate público, na articulação parlamentar, na mobilização social — para ser terceirizada ao Poder Judiciário. Tudo o que está acontecendo agora é consequência disso.

Ao substituir o embate democrático pela judicialização sistemática e por uma estratégia de asfixia institucional dos adversários, o campo lulopetista pode ter vencido batalhas imediatas, como evitar a reeleição de Bolsonaro e mandar desafetos para o exílio. Mas, fazendo isso, pavimentou o caminho para um grave processo de perversão da democracia – que agora começa a cobrar seu preço.

Nesse processo de terceirização, naturalizaram-se inquéritos abertos de ofício, bloqueios de perfis em redes sociais, desmonetização de influenciadores, prisões preventivas prolongadas e interpretações elásticas de competências constitucionais.

Ao incorporar essas práticas ao repertório de contenção do bolsonarismo, a Corte se politizou. Para atingir seus objetivos, não hesitou em borrar a fronteira entre crime e dissenso – com o apoio entusiasmado da grande mídia, é importante lembrar.

Mas a democracia não se fortalece com atalhos institucionais. Com o passar do tempo, torna-se evidente que delegar ao STF a linha de frente do combate ao bolsonarismo foi um erro de proporções épicas.

Quando se optou pelo confronto baseado em inquéritos, decisões monocráticas, medidas cautelares e expansões interpretativas de tipos penais, a justificativa era proteger a democracia de ameaças autoritárias. Diante dos últimos acontecimentos, essa narrativa já caiu por terra. E a História ensina que é o autoritarismo que sempre vem embalado em boas intenções.

Um campo político que depende de decis",Data Indisponível,https://www.gazetadopovo.com.br/vozes/luciano-trigo/a-terceirizacao-da-politica-foi-um-desastre/,gazetadopovo
Flávio Bolsonaro: apoios do Centrão e Pablo Marçal em 2026,Saiba como a campanha de Flávio Bolsonaro atrai influenciadores e partidos do Centrão para fortalecer sua candidatura à Presidência em 2026.,"O senador Flávio Bolsonaro (PL-RJ) intensifica sua pré-campanha à Presidência mobilizando influenciadores digitais e articulando alianças com partidos do Centrão, como União Brasil e Podemos, visando fortalecer palanques estaduais e ampliar a bancada de deputados para as eleições de 2026.

Quem são os principais nomes que reforçam a campanha de Flávio Bolsonaro?

Recentemente, o influenciador Pablo Marçal filiou-se ao União Brasil após declarar apoio ao senador. No Rio Grande do Sul, o vereador Ronny Gabriel, que ganhou fama ao denunciar esquemas financeiros, migrou para o Podemos a pedido de Flávio. Esses nomes são chamados de 'puxadores de votos', que são candidatos com grande popularidade capazes de atrair milhares de eleitores e ajudar a eleger outros colegas de seus partidos.

Por que partidos do Centrão estão aceitando candidatos da direita conservadora?

O movimento é guiado pelo pragmatismo eleitoral. Para os partidos do Centrão (bloco de siglas que não possuem uma ideologia fixa e buscam proximidade com o poder), ter candidatos campeões de votos é essencial para aumentar o tamanho de suas bancadas. Quanto maior o número de deputados eleitos, mais recursos do fundo partidário e tempo de propaganda na televisão a legenda recebe nas próximas eleições.

Qual é a estratégia do PL para compensar baixas em estados como São Paulo?

Com a saída de nomes fortes como Eduardo Bolsonaro e Carla Zambelli da disputa pela Câmara, o PL aposta em jovens comunicadores digitais. O maior destaque é Lucas Pavanato, vereador mais votado do país em 2024, além da vereadora Zoe Martínez. O objetivo é repetir o sucesso de Nikolas Ferreira, que em 2022 foi o deputado mais votado do Brasil, ajudando o partido a atingir a meta de eleger 115 parlamentares.

O que é a janela partidária e qual sua importância nas movimentações atuais?

A janela partidária é um período legal, que em 2026 vai de março até o início de abril, no qual os políticos que ocupam cargos eleitos pelo sistema proporci",Data Indisponível,https://www.gazetadopovo.com.br/republica/como-flavio-bolsonaro-esta-atraindo-o-centrao-para-sua-campanha-presidencial/#comentarios?ref=comentarios-materia,gazetadopovo
Paulo Gonet: salvo pelo Senado da reprovação que ele merecia,Gonet foi reconduzido apesar das falhas graves na PGR. A decisão do Senado aprofunda o estado de exceção e revela a necessidade de renovação em 2026.,"A recondução de Paulo Gonet à Procuradoria-Geral da República, confirmada por uma margem mínima de apenas quatro votos, diz menos sobre as qualidades do procurador e muito mais sobre a subordinação e complacência que dominam o atual Senado.

Gonet merecia ser reprovado, e os fatos recentes mostram isso sem muito esforço. Basta um olhar minimamente crítico sobre o comportamento do PGR nos casos envolvendo perseguição judicial a Jair Bolsonaro, Filipe Martins, Eduardo Tagliaferro, Débora do Batom, dentre outros. Em vez de fiscal da lei, Gonet se comportou como um carimbador das decisões, desejos e vontades de Alexandre de Moraes em sua fúria contra a Direita e o conservadorismo.

A recondução de Gonet se tornou assim, involuntariamente, uma propaganda clara da urgência de renovação do Senado em 2026, especialmente com parlamentares do campo conservador capazes de confrontar estruturas viciadas, resgatar o equilíbrio entre os poderes e impedir reconduções que só reforçam o estado de exceção funcional instaurado desde 2019, quando começou o inquérito sem fim das fake News.

Gonet fez por merecer a reprovação

Em seu comentário no Ouça Essa, o jornalista Marcos Tosi demonstra que, pelos seus atos, era cristalino que o procurador fez por merecer a reprovação. Mas, numa mistura de covardia, conveniência e submissão ao STF, os senadores lhe entregaram o que ele não conquistou: mais dois anos de mandato. Não houve aprovação nem confiança, apenas resignação com o jogo de poder.

A cena ocorrida no primeiro dia após sua recondução, e que reproduzimos no Ouça Essa, resume bem o problema. Gonet ajeita o microfone, recompõe o paletó e dirige agradecimentos calorosos a Alexandre de Moraes. O tom é o de um fã diante do ídolo, uma reverência exagerada. E a mensagem institucional é ainda pior: a PGR, que deveria conter excessos, age como se prestasse satisfação ao ministro mais poderoso da República.

Longa ficha de faltas acumuladas

As razões para rejeitar a recondução eram abundan",Data Indisponível,https://www.gazetadopovo.com.br/republica/paulo-gonet-salvo-pelo-senado-da-reprovacao-que-ele-merecia/,gazetadopovo
Ativismo ideológico ganha força e se consolida na atuação do Ministério Público,"Acompanhe as últimas notícias do Brasil e do mundo sobre política, economia e esportes. Leia também análises, opinião, estilo de vida e mais.","Discursos ideológicos e pautas identitárias estão ganhando cada vez mais força na atuação do Ministério Público no Brasil. Conceitos como ""racismo estrutural"", ""racismo ambiental"", ""discurso de ódio"", entre outros jargões da cultura woke e dos movimentos antiliberdade de expressão contemporâneos têm sido mencionados em diversas recomendações, ações e documentos do órgão.

Em novembro, o Ministério Público Federal (MPF) lançou uma cartilha sobre o racismo na atividade policial no Brasil, abusando do emprego de conceitos carregados de ideologia, chamando as penitenciárias de ""senzalas contemporâneas"" e sugerindo que o pacote anticrime do governo Bolsonaro legalizou ""o genocídio em curso nas periferias e favelas"".

Também em novembro, o MPF se mostrou favorável às normas do Conselho Federal de Psicologia (CEP) que impedem a influência de crenças religiosas no exercício da profissão de psicólogo. O parecer do MPF se deu em resposta a uma Ação Direta de Inconstitucionalidade (ADI) apresentada pelo partido Novo e pelo Instituto Brasileiro de Direito e Religião (IBDR) contra normas que vedam a associação de conceitos religiosos a métodos da psicologia.

Outro caso emblemático ocorrido neste ano foi a ação civil pública ajuizada para pedir o cancelamento de três concessões de rádio outorgadas à Jovem Pan. Procuradores acusaram a emissora de promover ""desinformação em larga escala"" sobre o sistema eleitoral, com ""potencial de incitação à violência e à ruptura da ordem democrática"". As notícias veiculadas pela Jovem Pan, segundo os procuradores, teriam legitimado a invasão dos edifícios dos Três Poderes em Brasília no dia 8 de janeiro de 2023.

Em setembro, o humorista Léo Lins se tornou réu em um processo criminal depois que uma denúncia do Ministério Público à Justiça se apoiou na chamada “lei antipiadas”, sancionada pelo presidente Lula (PT) em janeiro. A lei define como crime de racismo piadas sobre grupos considerados minoritários.

Também em setembro, o MPF pediu que o ",Data Indisponível,https://www.gazetadopovo.com.br/vida-e-cidadania/discursos-ideologicos-ganham-forca-na-atuacao-do-ministerio-publico/,gazetadopovo
