titulo,subtitulo,texto,data,url,portal
Impeachment de Moraes após escândalo com Vorcaro?,"Após escândalo da troca de mensagens entre Vorcaro e Moraes, o senador Flávio Bolsonaro (PL-RJ) sugeriu o impeachment do ministro.","Após escândalo da troca de mensagens entre Vorcaro e Moraes, o senador Flávio Bolsonaro (PL-RJ) se posicionou. Como resultado, ele publicou neste sábado, 7, um vídeo nas redes sociais em que defende a renúncia do ministro do Supremo Tribunal Federal (STF), Alexandre de Moraes. Além disso, a abertura de um processo de impeachment contra o magistrado no Senado.

Na publicação, o parlamentar compartilha um vídeo do senador Magno Malta (PL-ES), que faz críticas ao ministro e afirma que Moraes não teria mais condições de permanecer no cargo. Assim, ao divulgar o conteúdo, Flávio Bolsonaro afirmou que a saída do magistrado seria necessária para “preservar a democracia e o Judiciário brasileiro”.

Mensagens do celular de Vorcaro citam ministros, líderes do congresso e Lula

As mensagens do celular do banqueiro Daniel Vorcaro revelam uma rede de contatos, que atravessa o núcleo do poder em Brasília. Portanto, há menções a ministros, líderes do Congresso e até ao presidente da República. Além disso, o envolvimento atual ou passado do banqueiro e de ex-sócios com autoridades políticas amplia a possível teia de influências. Vorcaro teria construído relação junto à alta cúpula do poder.

A Polícia Federal enviou mensagens à CPMI do INSS sobre as fraudes do Banco Master. Sendo assim, tais provas surgiram na Operação Compliance Zero. Nelas, Vorcaro cita nomes que o público associa a políticos influentes. Entre os citados estão o presidente da Câmara, deputado Hugo Motta (Republicanos-PB), e o senador Ciro Nogueira (PP-PI), figura proeminente do Centrão.

Jornal rebate Moraes e desmente versão do Ministro sobre Vorcaro

O jornal O Globo rebateu a nota do ministro do Supremo Tribunal Federal (STF) Alexandre de Moraes. Pois, ele nega ser o destinatário de mensagens de Daniel Vorcaro no dia de sua prisão. Na nota divulgada a imprensa por meio do STF, o gabinete informa que análise técnica dos dados telemáticos indica que os prints das mensagens estariam vinculados a outros contatos d",Data Indisponível,https://www.gazetadopovo.com.br/cafe-com-a-gazeta/impeachment-de-moraes-apos-escandalo-com-vorcaro/,gazetadopovo
Regressão: como o Brasil se tornou hostil à prosperidade,O debate sobre a herança econômica recente do Brasil exige abandonar tanto a retórica superficial quanto o tecnocratismo anestesiante.,"O debate sobre a herança econômica recente do Brasil, precipitado pela saída de Fernando Haddad do Ministério da Fazenda, exige abandonar tanto a retórica superficial quanto o tecnocratismo anestesiante que serviu de álibi intelectual a três anos de demolição fiscal.

O que se observa hoje não é apenas um conjunto de indicadores deteriorados, mas a consolidação de um modelo coerente em sua lógica interna indigente, porém anacrônico, asfixiante e pauperizante em seus efeitos externos, que combina expansão fiscal, hipertrofia tributária, hostilidade progressiva ao ambiente de geração de riqueza e uma recusa ideológica de incorporar ao aparato produtivo do país as ferramentas tecnológicas que estão redesenhando a economia global. Sob a condução de Haddad, esse modelo atingiu sua forma mais explícita e acabada.

A marca distintiva da gestão não é apenas o aumento de gastos, mas a naturalização de sua expansão como princípio organizador da política econômica, com trajetória claramente ascendente, contínua e estrutural, tanto em termos nominais quanto em proporção do PIB.

No início de 2023, a dívida pública registrava 71,7% do PIB, patamar elevado, mas relativamente estabilizado após o período pandêmico e os efeitos iniciais do conflito Rússia-Ucrânia. Ao final de 2023, o indicador havia avançado para 74,3%. Em 2024, superou 76,1%. Em 2025, ultrapassou R$ 10 trilhões, cerca de 79% do PIB, colocando o Brasil entre os países mais endividados do mundo emergente.

Como miséria pouca é bobagem, a projeção oficial do governo para 2026 é de 81,7%, ao passo que o mercado, essa entidade maléfica que opera diuturnamente para desfazer os planos lulopetistas de socialização da pobreza, trabalha com projeções de 84% a 85% do PIB.

Esse problema não é apenas contábil: é um mecanismo silencioso de transferência de riqueza entre gerações. Ao expandir gastos de forma irresponsável e financiar essa expansão via endividamento, o governo consome hoje a renda que ainda nem foi gerada, empurr",Data Indisponível,https://www.gazetadopovo.com.br/ideias/a-economia-da-regressao-como-o-brasil-se-tornou-hostil-a-prosperidade/#comentarios?ref=comentarios-materia,gazetadopovo
Contra o fanatismo político,O fanatismo nasce do desespero e da frustração. Pessoas que se sentem impotentes ou sem valor são mais suscetíveis a se tornarem fanáticas.,"Nos anos seguintes ao final da Segunda Guerra, especialmente após as revelações sobre a barbárie do Holocausto, a grande questão que mobilizou intelectuais do Ocidente foi entender como e por que a sociedade alemã, culturalmente tão avançada, se deixou seduzir pelo nazismo.

Diferentes autores se dedicaram a escrever sobre o assunto, destacando-se “As origens do totalitarismo”, de Hannah Arendt. Lançado em 1951, o livro investiga as origens comuns dos principais regimes totalitários do século 20 – o nazismo e o comunismo – e sua constituição como movimentos de massa capazes de atrair milhões de seguidores fanáticos.

Após examinar em profundidade as condições que permitiram a ascensão do antissemitismo e do imperialismo na Europa, Arendt concluiu que o totalitarismo era uma nova forma de governo, que diferia essencialmente da opressão política praticada pelas ditaduras até então conhecidas.

Segundo a autora, o diferencial dos regimes totalitários é que seu objetivo não é apenas perseguir e calar adversários, mas subjugar e doutrinar toda a população, de maneira a mudar a percepção que os indivíduos têm de si mesmos, de seu papel na sociedade e da própria política.

Por isso mesmo, nos processos de dominação implementados por esses regimes, tão importantes quanto a força bruta são as técnicas de manipulação da opinião pública e de lavagem cerebral da população. O objetivo não é apenas esmagar, mas também convencer. E converter.

Se “As origens do totalitarismo” se tornou uma obra de referência sobre o tema e até hoje é reeditado, outro livro importantíssimo, publicado no mesmo ano, caiu em relativo ostracismo: “Fanatismo e movimentos de massa” (“The true believer”, no original), do americano Erich Hoffer.

O foco de Hoffer é a interpretação da mentalidade fanática, que faz pessoas comuns abandonarem a razão e entregarem seus destinos nas mãos de psicopatas. Daí o paralelo que o autor estabelece entre o fanatismo político e o fanatismo religioso. Nesse sentido, “Fana",Data Indisponível,https://www.gazetadopovo.com.br/vozes/luciano-trigo/contra-o-fanatismo-politico-o-fardo-da-responsabilidade/#comentarios?ref=comentarios-materia,gazetadopovo
Quem apoiou os abusos de Moraes e depois mudou de opinião,"Eles apoiaram a atuação de Alexandre de Moraes e recuaram: o que cada um disse antes, o que diz agora e o que explica a virada","Eles apoiaram a atuação do ministro Alexandre de Moraes e recuaram: o que cada um disse antes, o que diz agora e o que explica a virada (Foto: Marcelo Camargo/Agência Brasil )

Por anos, Alexandre de Moraes acumulou poderes com a tolerância de uma parcela significativa da sociedade brasileira.

O Inquérito das Fake News, aberto em 2019 sem previsão constitucional clara, era apresentado como uma resposta necessária a ataques reais às instituições democráticas. As prisões, os bloqueios de contas e as restrições a perfis nas redes sociais eram enquadrados, por muitos, como o preço inevitável de conter um movimento que supostamente ameaçava o Estado de Direito.

E o pior: quem questionava os métodos era, com frequência, associado ao grupo que se dizia estar sendo combatido.

O cenário começou a mudar quando os alvos das ações de Moraes deixaram de ser exclusivamente figuras ligadas ao bolsonarismo. Depois, em agosto de 2024, as revelações da Vaza Toga expuseram o uso informal do aparato judicial para fins que iam além do combate à desinformação.

O escândalo envolvendo o banqueiro Daniel Vorcaro levantou questões sobre a fronteira entre a função pública e interesses privados. Até que a operação contra o jornalista maranhense Luís Pablo, determinada no âmbito do mesmo inquérito que tantos haviam apoiado, tornou o silêncio difícil de sustentar.

Assim, ganhou forma um fenômeno que merece registro: figuras e entidades de campos políticos distintos, que em momentos anteriores haviam apoiado ou tolerado a atuação de Moraes, passaram a questioná-la publicamente.

Em alguns casos, trata-se de uma revisão de posição clara e assumida. Em outros, de um amadurecimento gradual diante de fatos novos. Em todos, de um debate que o país precisava ter — e chegou tarde.

A seguir, listamos alguns dos exemplos mais emblemáticos.

1. Ordem dos Advogados do Brasil

A OAB apoiou a abertura do Inquérito das Fake News em 2019. Nos anos seguintes, enquanto a ação se expandia para além de seus l",Data Indisponível,https://www.gazetadopovo.com.br/ideias/lista-quem-apoiou-abusos-moraes-depois-mudou-opiniao/,gazetadopovo
"Manifestações, campanhas e denúncias: direita com Bolsonaro",Cristina Graeml comenta a onda de manifestações e campanhas da direita a favor de melhores condições para o ex-presidente Jair Bolsonaro,"A situação da detenção do ex-presidente Jair Bolsonaro na superintendência da PF, antes da transferência para a Papudinha, gerou uma onda de denúncias de abusos e mobilizações por parte de parlamentares e da sociedade civil. Bolsonaro, que é idoso e possui comorbidades decorrentes de cirurgias prévias, chegou a sofrer uma queda na cela onde estava e enfrentou demora para receber atendimento especializado.

Pressão Parlamentar e Medidas de Inspeção

Diante do cenário de descaso, alguns parlamentares interromperam o recesso para protocolar medidas urgentes. Mesmo nas férias, eles atuaram para tentar o mínimo de justiça para o ex-presidente da República e os demais presos políticos e perseguidos do 8 de janeiro.

A deputada federal Caroline de Toni (PL-SC) solicitou a convocação de uma sessão extraordinária do Congresso para derrubar vetos presidenciais e retomar a discussão sobre o projeto de lei da anistia.

A deputada Bia Kicis (PL-DF) foi outra que agiu. Quando o ex-presidente sofreu uma queda na cela em que estava na Polícia Federal, a parlamentar foi até o local para verificar a situação e prestar solidariedade à ex-primeira-dama, Michelle Bolsonaro.

Paralelamente, a senadora Damares Alves (Republicanos-DF) também “quebrou” as férias e acionou a Comissão de Direitos Humanos do Senado para realizar uma vistoria no local da prisão, argumentando que a estrutura não era adequada para um preso idoso e doente.

O deputado Gustavo Gayer (PL-GO) também protocolou pedidos junto à Defensoria Pública da União, que chegou a abrir um procedimento para apurar as condições de saúde e de custódia de Bolsonaro.

Embates éticos e alerta de jornalistas

Até a esfera médica também se tornou um campo de disputa. O Conselho Federal de Medicina (CFM) abriu uma sindicância para investigar possível negligência dos médicos da Polícia Federal, mas a iniciativa foi alvo de uma determinação de anulação por parte do Supremo Tribunal Federal. Esse movimento gerou críticas de sindicatos médico",Data Indisponível,https://www.gazetadopovo.com.br/vozes/manifestacoes-campanhas-e-denuncias-em-massa-direita-com-bolsonaro/#comentarios?ref=comentarios-materia,gazetadopovo
ONU declara escravidão o crime mais grave da história,"EUA, Israel e Argentina rejeitaram resolução da ONU que classifica a escravidão como o ""crime mais grave cometido contra a humanidade""","O secretário-geral da ONU, António Guterres, disse que ""chegou a hora de confrontar as consequências duradouras da desigualdade e do racismo"" (Foto: EFE/ Fraga Alves )

EUA, Israel e Argentina rejeitaram nesta quarta-feira uma resolução da ONU que classifica a escravidão africana como o ""crime mais grave cometido contra a humanidade"", proposta por Gana, que recebeu o apoio da maioria dos Estados-membros.

O texto obteve 123 votos a favor na Assembleia Geral da ONU e 52 abstenções, incluindo as da Espanha, França, Alemanha, Holanda e Reino Unido, bem como da maioria das nações europeias.

A resolução identifica ""a transgressão de africanos e a escravidão racializada de africanos"" como o crime mais grave devido às suas consequências de longo alcance.

""A ruptura definitiva que representou na história mundial, sua magnitude, duração, natureza sistêmica, brutalidade e consequências duradouras que continuam a moldar a vida de todas as pessoas por meio de regimes racializados de trabalho, propriedade e capital"", diz o documento.

O representante dos EUA no Conselho Econômico e Social das Nações Unidas (Ecosoc), Dan Negrea, justificou seu voto, afirmando que a resolução era ""altamente problemática em inúmeros aspectos"", apesar de manter sua ""firme oposição e condenação aos erros históricos decorrentes do tráfico transatlântico de escravizados"".

""Os EUA não reconhecem um direito legal à reparação por erros históricos que não eram ilegais sob o direito internacional na época em que ocorreram"", declarou Negrea.

Além disso, o representante americano afirmou que o texto promove agendas ""específicas"" e incentiva a criação de novos grupos de trabalho e relatórios ""custosos"", algo para o qual, segundo ele, a ONU ""não foi criada"".

O Secretário-Geral António Guterres referiu-se ao tráfico transatlântico de escravizados como uma ""profunda traição à dignidade humana"" e o denunciou como ""uma máquina de exploração em massa e desumanização deliberada"".

Segundo ele, ""é hora de confron",Data Indisponível,https://www.gazetadopovo.com.br/mundo/com-rejeicao-de-eua-argentina-e-israel-onu-declara-escravidao-o-crime-mais-grave-da-historia/#comentarios?ref=comentarios-materia,gazetadopovo
Moraes recua contra Elon Musk em meio à crise do Master,Alexandre de Moraes arquiva caso contra Elon Musk e pede arquivamento da investigação de Monark em meio à crise do Banco Master.,"O ministro Alexandre de Moraes (STF) tem dado sinais de recuos e ajustes recentes em decisões controversas após pressão interna e externa: nesta terça‑feira (10), ele acolheu o pedido da Procuradoria‑Geral da República (PGR) e arquivou o inquérito que investigava o bilionário Elon Musk, dono da plataforma X, por supostas irregularidades no cumprimento de ordens judiciais — a PGR entendeu que não havia provas suficientes de crime, e Moraes seguiu esse entendimento formalmente. Ao mesmo tempo, em outro caso, o ministro estipulou prazo de 30 dias para a Polícia Federal concluir a investigação sobre o influenciador Monark, que apura desobediência a ordens judiciais e estava parado há meses, evidenciando movimento de encerramento ou aceleração de inquéritos sob sua relatoria. Esses ajustes ocorrem em meio à crise política e judicial desencadeada pelo escândalo do Banco Master e pelas revelações de mensagens e contratos que colocam Moraes no centro de questionamentos, o que tem aumentado a pressão sobre o ministro e sobre a imagem do STF no debate público.

“Operação abafa”: temor de nova Lava Jato mobiliza planalto

O governo do presidente Lula decidiu acionar o Ministério da Justiça para investigar e tentar conter o vazamento de informações sigilosas sobre o escândalo do Banco Master, diante do temor de que o caso ganhe repercussão semelhante à da Operação Lava Jato, com divulgação seletiva de dados para fins políticos em ano eleitoral; a ação ocorre após críticas de líderes do Congresso e ministros do STF à forma como as investigações e vazamentos têm sido conduzidos, e o Palácio do Planalto busca mostrar controle e resposta institucional à crise que envolve autoridades, mensagens expostas e conflitos internos sobre o manejo da Polícia Federal.

Alcolumbre tenta barrar CPMI do Master, oposição aciona STF

O presidente do Senado, Davi Alcolumbre, é acusado pelo deputado Carlos Jordy (PL‑RJ) de barganhar para impedir a instalação da Comissão Parlamentar Mista de Inquérit",Data Indisponível,https://www.gazetadopovo.com.br/sem-rodeios/moraes-recua-contra-elon-musk-em-meio-a-crise-do-master/,gazetadopovo
"Irã admite contatos, mas se recusa a negociar com os EUA","Chanceler do Irã diz que há contatos com os EUA sobre fim da guerra, mas afirma que Teerã ainda não quer negociar.","O chanceler do regime islâmico do Irã, Abbas Araqchi, admitiu em entrevista divulgada nesta quarta-feira (25) que Teerã recebeu mensagens dos Estados Unidos para discutir o fim da guerra em curso, mas afirmou que o país persa não pretende iniciar negociações neste momento.

Em entrevista concedida para uma emissora estatal do Irã, Araqchi disse que há troca de mensagens com os EUA por meio de países mediadores, mas negou que isso signifique a existência de negociações formais. De acordo com o chanceler, a política atual do regime é manter o que chamou de “resistência”.

“O envio de mensagens por diferentes mediadores não significa negociação”, afirmou Araqchi.

Araqchi disse que o fato de Washington mencionar negociações para o fim da guerra neste momento é “uma admissão de derrota”.

“Eles falavam em rendição incondicional. Agora falam em negociação. Isso, por si só, é uma admissão de derrota”, declarou.

O chanceler declarou que qualquer acordo para encerrar a guerra só será aceito se ocorrer “nos termos definidos por Teerã”.

“Buscamos o fim da guerra em nossos próprios termos, de forma que ela não se repita novamente”, afirmou.

O governo dos Estados Unidos enviou ao Irã nesta semana, por meio de países mediadores, uma proposta para encerrar a guerra. O plano, inclui pontos relacionados ao fim do programa nuclear iraniano, ao fim desenvolvimento de mísseis e à segurança das rotas marítimas no Golfo Pérsico.

Teerã respondeu nesta quarta-feira de forma negativa à proposta e apresentou suas próprias condições para o fim da guerra. Entre elas estariam garantias de que novos ataques não ocorrerão, reconhecimento de “direitos do país” sobre áreas estratégicas e o fim das operações militares contra grupos terroristas aliados do Irã na região.

Mais cedo, a porta-voz da Casa Branca, Karoline Leavitt, afirmou que o presidente dos Estados Unidos, Donald Trump, está disposto a intensificar os ataques caso o Irã não aceite um acordo para encerrar a guerra. Leavitt disse ai",Data Indisponível,https://www.gazetadopovo.com.br/mundo/ira-admite-contatos-mas-se-recusa-a-negociar-com-os-eua/,gazetadopovo
EUA alertam Irã sobre negociações e reiteram prazo da guerra,"A secretária de Imprensa da Casa Branca, Karoline Leavitt, disse que EUA seguem em negociações ""produtivas"" com uma ou mais lideranças do Irã","A secretária de Imprensa da Casa Branca, Karoline Leavitt, disse que os EUA podem aumentar a intensidade dos ataques se o Irã sair de negociação (Foto: SHAWN THEW/EFE/EPA )

A secretária de Imprensa da Casa Branca, Karoline Leavitt, disse a repórteres na tarde desta quarta-feira (25) que os EUA seguem em negociações ""produtivas"" com uma ou mais lideranças do Irã, que ela não nomeou, para encerrar o conflito que já dura semanas.

Segundo a representante do governo de Donald Trump, as forças americanas estão ""muito perto de atingir os objetivos principais"" da ação militar e, caso as conversas com o Irã se tornem ""improdutivas"", novos bombardeios poderão ocorrer.

“Se o Irã não aceitar a realidade do momento atual, se não entender que foi derrotado militarmente, Trump garantirá que eles sejam atingidos com mais força do que jamais foram”, disse Leavitt na coletiva de imprensa.

As declarações surgem após um funcionário do regime iraniano não identificado dizer em pronunciamento na emissora estatal iraniana em inglês, Press TV, que o país rejeita a proposta de cessar-fogo apresentada por Trump.

Questionada sobre um prazo dos EUA para encerrar a guerra, ela disse que o cronograma ainda é de quatro a seis semanas. Leavitt evitou comentar alguns assuntos levantados por jornalistas na Casa Branca, por exemplo, se o presidente Trump enviaria um pedido de autorização do Congresso antes de enviar tropas ao Irã.

Outra questão que evitou comentar foi o plano de 15 pontos que teria sido apresentado pelos EUA. Segundo ela, algumas reportagens ""não são inteiramente factuais"" ao falar do assunto.",Data Indisponível,https://www.gazetadopovo.com.br/mundo/eua-dizem-que-negociacoes-com-o-ira-sao-produtivas-e-reiteram-prazo-para-fim-da-guerra/,gazetadopovo
CPMI do INSS prorroga trabalhos antes do STF analisar liminar de Mendonça,"Presidente da comissão, Carlos Viana, decidiu unilateralmente prorrogar os trabalhos com base em documento do STF que validou fim do prazo pela manhã.","Presidente do colegiado, Carlos Viana, exibe ofício do STF que comprova horário de vencimento do prazo para Alcolumbre oficializar prorrogação dos trabalhos. (Foto: reprodução/Youtube TV Senado )

O presidente da CPMI do INSS, senador Carlos Viana (Podemos-MG), declarou nesta quinta-feira (26) a prorrogação dos trabalhos da comissão antes mesmo do Supremo Tribunal Federal (STF) concluir a análise da liminar do ministro André Mendonça, marcada para esta tarde e que trata da continuidade do colegiado por mais 120 dias.

A decisão foi anunciada durante a segunda parte da reunião da manhã, que foi suspensa pelo próprio parlamentar e que condicionou a retomada das atividades ao desfecho do julgamento na Corte, provavelmente no final da tarde.

Segundo Viana, a decisão de prorrogar os trabalhos à revelia do presidente do Senado e do Congresso, Davi Alcolumbre (União-AP), seguiu estritamente a determinação judicial confirmada pela Secretaria Judiciária da Corte.

“Como decisão judicial a gente cumpre, a gente não questiona, exatamente o que temos feito, em nome dos aposentados, dos órfãos, das viúvas, de um Brasil que quer o combate à corrupção, eu declaro prorrogada essa CPMI”, afirmou exibindo o documento emitido pelo STF.

VEJA TAMBÉM: Alcolumbre resiste à prorrogação da CPMI do INSS e STF decide sobre liminar de Mendonça

Mais cedo, deputados e senadores da base governista e da oposição se desentenderam diversas vezes sobre o fim do 48 horas estabelecido por Mendonça para que Alcolumbre autorizasse formalmente a prorrogação. Como não houve manifestação dentro do período, em tese encerrado no meio da manhã, abriu-se margem para as discussões.

A oposição sustentou que o prazo expirou às 10h18 feira, enquanto governistas defendem que o limite seria às 18h20, com base em registro da Advocacia do Senado que aponta esse horário como o momento de ciência formal da decisão. A divergência levou parlamentares a recorrerem ao STF para esclarecer o marco inicial da contagem.

Na ",Data Indisponível,https://www.gazetadopovo.com.br/republica/presidente-comissao-prorroga-trabalhos-antes-stf-analisar-liminar-mendonca/,gazetadopovo
