titulo,subtitulo,texto,data,url,portal
O que está em jogo para China e Rússia na guerra do Irã,"Rússia e China condenaram os ataques dos EUA e Israel contra o Irã, contudo, evitaram sinalizar apoio militar direto ao regime islâmico.","Representantes diplomáticos dos regimes da Rússia, China e Irã durante encontro em Pequim no ano passado. (Foto: GETTY IMAGES/EFE/EPA )

Horas após os ataques dos Estados Unidos e de Israel contra o Irã no sábado (28), os regimes da Rússia e da China condenaram a ofensiva, pediram cessar-fogo imediato e defenderam a retomada do diálogo diplomático.

Apesar do posicionamento, Moscou e Pequim evitaram sinalizar algum tipo de apoio militar direto a Teerã, expondo os limites práticos da parceria que os dois países mantêm com o regime iraniano.

No Conselho de Segurança da Organização das Nações Unidas (ONU), a Rússia classificou os bombardeios dos EUA e Israel contra o Irã como “atos de agressão”, enquanto o chanceler do regime chinês, Wang Yi, afirmou ser “inaceitável” que os EUA atacassem o Irã em meio a negociações diplomáticas e “ainda mais inaceitável” os EUA assassinarem “o líder de um país soberano”, fazendo referência à morte do aiatolá Ali Khamenei. As declarações, no entanto, ficaram restritas ao campo diplomático, sem tom ameaçador ou bélico.

O que está em jogo para China e Rússia

Tanto a China quanto a Rússia possuem acordos estratégicos firmados com o Irã nos últimos anos, que ampliaram a cooperação política, econômica e militar entre os três regimes.

Em janeiro deste ano, os países anunciaram a assinatura de um “pacto trilateral” para reforçar a coordenação diplomática e aproximação em temas como energia, comércio e defesa. O acordo, no entanto, não estabelecia nenhuma cláusula de defesa mútua nem obrigava qualquer uma das partes a intervir militarmente em caso de ataque externo.

O Irã é um dos principais apoiadores de Moscou na invasão à Ucrânia. Desde 2022, quando o ditador Vladimir Putin ordenou a invasão em larga escala do país vizinho, o regime islâmico enviou para o Kremlin centenas de drones, que passaram a ser amplamente utilizados nos ataques contra cidades e infraestrutura ucranianas. A cooperação militar ajudou a Rússia a compensar parte das",Data Indisponível,https://www.gazetadopovo.com.br/mundo/o-que-esta-em-jogo-para-china-e-russia-na-guerra-do-oriente-medio/,gazetadopovo
Farra em Brasília ameaçada: Pedido de impeachment avança,"O governador de Romeu Zema (Novo), viajou especialmente a Brasília para protocolar um pedido de impeachment contra Alexandre de Moraes.","Farra em Brasília ameaçada, os pedidos de impeachment avançam. Pois, o governador de Minas Gerais, Romeu Zema (Novo), viajou especialmente a Brasília nesta segunda-feira (9) para protocolar um pedido de impeachment. A ação é contra o ministro do Supremo Tribunal Federal (STF), Alexandre de Moraes. Nesta ocasião, o motivo alegado na peça é a suposta relação de Moraes com o dono do banco Master, Daniel Vorcaro, exposta após a quebra do sigilo telefônico do empresário.

A iniciativa busca marcar o Novo como partido na ""vanguarda"" do combate à corrupção. Além disso, somando este pedido a um outro, mais amplo, articulado com outras legendas do Congresso. Então, o partido também anunciou a intenção de representar contra o presidente do Congresso, Davi Alcolumbre (União-AP). Objetivo é pedir afastamento do senador no Conselho de Ética. O motivo é por omissão em apreciar outros pedidos e de ingressar com uma notícia-crime contra o ministro Moraes.

Bancada do Novo pede afastamento imediato de Alcolumbre no Conselho de Ética

A bancada do Novo protocolou, nesta segunda-feira (09/03), uma representação contra o presidente do Senado, Davi Alcolumbre (União Brasil-AP), no Conselho de Ética. Sendo assim, o partido pede o afastamento imediato do senador por não dar andamento a pedidos de impeachment contra ministros do Supremo Tribunal Federal (STF) nem instalar Comissão Parlamentar Mista de Inquérito (CPMI) do Banco Master.

O documento foi apresentado pelo senador Eduardo Girão (Novo-CE). De acordo com o senador e pré-candidato ao governo do Ceará disse que Alcolumbre deveria “pedir para sair” e disse que o atual presidente do Senado é “campeão de engavetamentos de pedidos de impeachment”.

Gilmar Mendes critica vazamento de conversas privadas de Vorcaro

O decano do Supremo Tribunal Federal (STF) Gilmar Mendes se manifestou nesta segunda-feira (9) contra o vazamento de dados do sigilo telefônico de Daniel Vorcaro. Para ele, a publicação das mensagens íntimas de um casal seria ",Data Indisponível,https://www.gazetadopovo.com.br/cafe-com-a-gazeta/farra-em-brasilia-ameacada-pedido-de-impeachment-avanca/#comentarios?ref=comentarios-materia,gazetadopovo
Auditoria diz que governo Ibaneis tentou usar TCU para pressionar BC,"Governo do DF, chefiado pelo governador Ibaneis Rocha, nega irregularidades e ressalta que atuação no TCU foi legítima.","Governo do DF, chefiado pelo governador Ibaneis Rocha, nega irregularidades e ressalta que atuação no TCU foi legítima. (Foto: Lúcio Bernardo Jr/ Agência Brasília )

A área técnica do Tribunal de Contas da União (TCU) recomendou uma investigação sobre a atuação do governo do Distrito Federal (GDF), chefiado pelo governador Ibaneis Rocha (MDB), no episódio da tentativa de aquisição do Banco Master pelo Banco de Brasília (BRB).

Segundo os técnicos, a gestão de Ibaneis teria acionado a Corte de contas para pressionar o Banco Central a aprovar a compra de parte do Master pelo banco público distrital.

Em nota enviada à Gazeta do Povo, o governo do DF afirmou que não foi formalmente notificado sobre eventuais apurações e destacou que “o acionamento do TCU se deu no estrito e legítimo exercício do direito de petição do Estado”.

VEJA TAMBÉM: PF encontra despacho do TCU no celular de Vorcaro que suspenderia ações do BC contra o Master

O GDF também ressaltou que “não procedem as ilações sobre possíveis violações aos princípios da administração pública”. (Veja abaixo a íntegra do comunicado)

A recomendação consta no relatório da auditoria realizada pela Unidade de Auditoria Especializada em Bancos Públicos e Reguladores Financeiros (AudBancos), do TCU, sobre a liquidação do Master pelo BC.

Os documentos foram tornados públicos nesta terça-feira (24) pela Comissão de Assuntos Econômicos (CAE) do Senado.

Os técnicos concluíram que a conduta dos gestores do BRB e do DF (na condição de controlador do banco) revelou indícios de “falta de diligência” e potencial “gestão temerária”.

Eles sustentam que o governo do DF teria tentado utilizar o TCU como uma ""instância recursal"" para reverter o indeferimento técnico da compra pelo Banco Central.

Segundo os auditores, a tentativa de pressionar o regulador para aprovar uma operação que expunha o banco distrital a riscos desproporcionais configura conduta que ""merece reprovação no âmbito do controle externo"".

“Ademais, o Distrito ",Data Indisponível,https://www.gazetadopovo.com.br/republica/caso-master-auditoria-diz-que-governo-ibaneis-tentou-usar-tcu-para-pressionar-banco-central-gdf-nega/,gazetadopovo
Efeitos de uma nova greve dos caminhoneiros em 2026,"Entenda os 4 efeitos imediatos de uma possível nova greve dos caminhoneiros para a economia brasileira, desde a falta de comida até a alta da inflação.","Caminhoneiros em protesto bloqueando a Rodovia Presidente Dutra, em Seropédica (RJ), durante a greve de maio de 2018. (Foto: Tomaz Silva/Agência Brasil )

Caminhoneiros realizam assembleia nesta quinta-feira para decidir sobre uma paralisação nacional. Em um cenário de combustíveis caros e colheita atrasada, uma nova greve ameaça gerar desabastecimento imediato e colapso na indústria, superando os danos causados pela crise de 2018.

Qual é a situação atual do abastecimento de combustíveis?

Caso a paralisação ocorra, o desabastecimento nos postos deve ser mais rápido que no passado. Atualmente, o preço do petróleo está alto devido a conflitos no Oriente Médio e há uma grande diferença entre o preço do diesel no Brasil e no exterior. Com estoques pressionados, o esgotamento de produtos nos postos e em aeroportos pode afetar o transporte de passageiros e mercadorias em poucos dias.

Como a greve afeta o preço e a oferta de alimentos?

Sem caminhões circulando, a cadeia logística trava. Alimentos perecíveis, como carnes, leite e verduras, tendem a sumir das prateleiras em até 72 horas. Além disso, produtores rurais enfrentam prejuízos enormes, já que a safra atual está atrasada e corre o risco de apodrecer por falta de transporte ou armazenamento adequado, provocando uma alta imediata nos preços de itens básicos.

O que acontece com as fábricas brasileiras?

O setor industrial sofre um choque duplo: falta de matéria-prima para produzir e falta de transporte para entregar o que já está pronto. Durante episódios semelhantes, a produção fabril caiu drasticamente, atingindo níveis piores que grandes crises internacionais. Setores que dependem de peças importadas ou que distribuem bebidas e eletroeletrônicos são os primeiros a interromper suas linhas de montagem.

De que forma o consumidor sente o impacto no bolso?

A principal consequência para a população é a perda do poder de compra através da inflação. Com a falta de produtos e o aumento do custo do frete, os preços sob",Data Indisponível,https://www.gazetadopovo.com.br/economia/como-uma-nova-greve-dos-caminhoneiros-pode-impactar-o-brasil/,gazetadopovo
Investigação do Banco Master vira caixa-preta,No programa deste domingo (7) Cristina Graeml comenta a decisão do ministro do STF de decretar sigilo nas investigações sobre o Banco Master.,"O ministro do Supremo Tribunal Federal (STF), Dias Toffoli, decretou sigilo absoluto sobre o andamento do processo que investiga a corrupção no Banco Master, criando o que está sendo chamado de uma ""caixa preta"" para abafar o caso. A investigação, descoberta por uma ala aparentemente independente da Polícia Federal, é anunciada como o maior escândalo financeiro de todos os tempos no Brasil. O rombo provocado pelo Banco Master pode chegar a R$ 12 bilhões, gerando prejuízos não apenas para quem tinha dinheiro na instituição, mas também para o governo e o Banco Central, com a conta final recaindo sobre todos os pagadores de impostos.

O caminho para o STF e a opacidade

O caso chegou ao Supremo após a defesa do banqueiro Daniel Vorcaro, do Banco Master, ter conseguido primeiramente um habeas corpus no Tribunal Regional Federal da 1ª Região (TRF1), trocando a prisão pela domiciliar. A etapa seguinte foi o pedido para que o STF assumisse a investigação, sob a justificativa de que um dos investigados possuía foro privilegiado por ser deputado. Com o pedido aceito, Toffoli foi escolhido para cuidar do inquérito e inventou um ""sigilo absoluto"" sobre algo que já estava sob sigilo.

O resultado é que agora ninguém mais tem acesso ao andamento da investigação, e a imprensa não consegue sequer saber quem são os advogados envolvidos. A jornalista Karina Michelin, ao comentar o sigilo, afirmou que a crise do Banco Master entrou na ""zona morta da transparência brasileira"", transformando-se em um ""buraco negro"" justamente quando deveria ser pública. A blindagem total reforça a sensação de que, no Brasil, a justiça ""fecha a cortina"" quando o escândalo envolve cifras astronômicas e ""gente influente"".

Conexões e patrocínios

A decisão de Toffoli levanta questionamentos devido a ligações prévias entre o magistrado e o Banco Master. Toffoli participou de um evento jurídico em Londres patrocinado pelo banco e até hoje não esclareceu quem bancou suas despesas na ocasião. Além dele, outro",Data Indisponível,https://www.gazetadopovo.com.br/vozes/investigacao-do-banco-master-vira-caixa-preta/#comentarios?ref=comentarios-materia,gazetadopovo
"Inquérito das fake news: cai a máscara da ""defesa da democracia""","Do inquérito das fake news ao Banco Master: como ministros do STF usaram a defesa da democracia para censurar, prender e encobrir desvios.","Durante sete anos de vacas magras, desde a inauguração do inquérito das fake News, os brasileiros foram engambelados com a conversa de que os ministros do STF bloqueavam perfis, censuravam reportagens, prendiam cidadãos comuns e parlamentares, tudo em nome da “defesa da democracia”. Deveríamos agradecer, e não criticar, os desmandos, abusos e deslizes necessários no curso do inquérito de exceção para preservar o Estado de Direito.

Aplicaram condenações esdrúxulas e penas reservadas a homicidas a centenas de manifestantes do 8 de janeiro, ao ex-presidente da República e a auxiliares diretos. Tudo justificado pela necessidade imperiosa de afastar qualquer tentativa de disrupção da ordem constitucional.

Qual a surpresa, pois, quando os fatos tornam cada vez mais evidente que, na verdade, os supostos heróis e guardiões democráticos estavam enrolados no maior escândalo de corrupção do sistema financeiro nacional? E que familiares desses ministros de toga foram destinatários de depósitos milionários, por meio de consultorias e negócios mantidos na surdina?

Heróis de ontem, na verdade, eram vilões

A cortina, contudo, caiu. Disparou o número de brasileiros que não confia no STF. E que não consegue “passar pano” para relações impróprias envolvendo ministros, empresários e montanhas de dinheiro. Não é que os heróis de ontem tenham subitamente se transformado em vilões. Na verdade, suspeita-se, nunca houve heroísmo, apenas a determinação de concentrar poderes e afastar vozes incômodas contra a grande “Turma” e sua locupletação.

Nessa caminhada dos sete anos de vacas magras, o tal inquérito das fake News normalizou censura de reportagens, bloqueio de perfis em redes sociais, quebras de sigilo e prisões arbitrárias. Da dona de casa, passando pelo deputado e o ex-presidente, ninguém escapou. Para prender um parlamentar, Alexandre de Moraes inventou até um tal de “flagrante perpétuo”. Por essa inovação jurídica, um vídeo publicado na internet com “ataques à Corte” continuaria",Data Indisponível,https://www.gazetadopovo.com.br/republica/cai-a-mascara-dos-defensores-da-democracia-no-brasil/#comentarios?ref=comentarios-materia,gazetadopovo
Mudança de domicílio eleitoral vira estratégia para 2026,"Mudanças de domicílio eleitoral de candidatos para 2026 expõem estratégia partidária, disputa pelo Senado e debate sobre representação.","Antes, os políticos brasileiros eram conhecidos por mudar de partido como ninguém. Agora, eles também mudam de estado.

A poucos dias do fim do prazo legal, a política brasileira assiste a uma corrida para mudanças de domicílio eleitoral de candidatos com projeção nacional. Nomes conhecidos tentam se reposicionar no mapa para disputar as eleições de outubro onde enxergam um terreno mais favorável para obtenção de cargos.

O movimento é permitido pela lei, desde que as exigências sejam cumpridas até 4 de abril. Mas as mudanças por conveniência provocam questionamentos: isso não enfraquece as representações locais e, de uma forma geral, a política brasileira? O sistema federalista ainda faz sentido?

A discussão ganha ainda mais peso porque a eleição deste ano vai renovar dois terços do Senado Federal, com duas vagas em disputa por estado e no Distrito Federal. Assim, para além da formalidade burocrática, o domicílio eleitoral virou uma peça central no xadrez do poder no país.

Migrações à direita

Entre os candidatos do espectro da direita, o Partido Liberal tenta reposicionar nomes da família Bolsonaro e aliados em locais onde o bolsonarismo é mais forte e tem mais chances de eleger senadores ou deputados.

Santa Catarina virou o símbolo mais claro desse movimento de migração. Carlos Bolsonaro, oriundo do Rio de Janeiro, confirmou pré-candidatura ao Senado pelo estado. A chegada do 02, entretanto, provocou resistência entre lideranças catarinenses do PL.

A indicação de Carlos desagradou, especialmente, a deputada federal Caroline de Toni, também do PL e do campo bolsonarista, em busca de uma vaga no senado. A disputa em Santa Catarina promete ser concorrida, pois inclui ainda o senador Esperidião Amin (PP), nome tradicional no estado que buscará a reeleição.

No Distrito Federal, a aposta do partido é Michelle Bolsonaro. A esposa do ex-presidente Jair Bolsonaro transferiu em 2025 o domicílio do Rio de Janeiro de volta ao DF. O candidato à presidente Flávio Bolsonar",Data Indisponível,https://www.gazetadopovo.com.br/ideias/mudanca-domicilio-eleitoral-estrategia-eleicoes-2026/,gazetadopovo
Vorcaro inicia pré-delação na PF; defesa não quer poupar ninguém,Vorcaro inicia depoimentos à PF em pré-delação e defesa propõe não poupar ninguém. Leia mais na Gazeta do Povo.,"O ex-banqueiro Daniel Vorcaro iniciou, nesta semana, uma série de depoimentos à Polícia Federal no processo de pré-delação antes de firmar o acordo com a instituição e a Procuradoria-geral da República. Apesar da resistência inicial de Vorcaro em falar de sua relação com ministros do Supremo Tribunal Federal, a orientação de sua defesa é para que a delação não poupe ninguém que tenha envolvimento ou participação em articulações e, assim, amplie a possibilidade de redução de pena e benefícios efetivos como recompensa da delação.

A reportagem apurou que o discurso de não poupar ninguém pode funcionar como uma estratégia da defesa para dar peso às negociações junto aos investigadores. Mas ainda não está claro até que ponto o ex-banqueiro pretende avançar em relação a autoridades do Judiciário. Isso porque a palavra final sobre a validade de uma delação cabe ao STF, o que, na prática, pode gerar cautela por parte do delator.

Não há precedentes no Judiciário brasileiro de situações em que ministros do STF tenham sido alvo de investigações abertas a partir de delações dessa natureza, e, para que qualquer citação avance, seria necessário apresentar provas robustas, sob risco de que as acusações sejam tratadas apenas como ilações.

A movimentação ocorre após Vorcaro formalizar a assinatura de um termo de confidencialidade na semana passada, considerada etapa inicial para a abertura das tratativas. O documento permite que o investigado apresente informações preliminares sob sigilo, que começam a ser analisadas pelas autoridades antes da formalização do acordo em definitivo.

Segundo apurado pela Gazeta do Povo com fontes ligadas às investigações, desde que chegou à superintendência da PF na quinta-feira (19), Vorcaro tem apontado para indicação de nomes e provas que corroborariam com sua delação, além das provas já colhidas em diferentes fases da operação Compliance Zero, que investiga fraudes financeiras envolvendo o agora liquidado Banco Master.

Vorcaro precisa apresent",Data Indisponível,https://www.gazetadopovo.com.br/republica/vorcaro-inicia-depoimentos-a-pf-em-pre-delacao-e-defesa-propoe-nao-poupar-ninguem/,gazetadopovo
Delação de Daniel Vorcaro: PF inicia depoimentos do caso,Daniel Vorcaro inicia pré-delação na PF e promete não poupar ninguém. Entenda os impactos da investigação sobre o Banco Master e o possível envolvimento do STF.,"O ex-banqueiro Daniel Vorcaro iniciou depoimentos à Polícia Federal em um processo de pré-delação. Investigado por fraudes no Banco Master, ele sinaliza que não poupará ninguém, incluindo autoridades do Judiciário, em troca de benefícios legais e redução de pena.

O que é o processo de pré-delação iniciado por Daniel Vorcaro?

É uma fase preliminar onde o investigado presta depoimentos iniciais sob sigilo após assinar um termo de confidencialidade. Nessa etapa, a Polícia Federal e a Procuradoria-Geral da República (PGR) avaliam se as informações e provas apresentadas são inéditas, relevantes e verídicas antes de fecharem o acordo definitivo de delação premiada.

Qual é a estratégia da defesa do ex-banqueiro?

A orientação dos advogados é que a colaboração seja ampla e sem restrições. A ideia é entregar nomes e provas que envolvam figuras dos três poderes da República. Eles acreditam que, quanto maior o alcance das revelações e a importância dos envolvidos citados, maiores serão as chances de Vorcaro obter benefícios significativos, como a diminuição de sua condenação.

Por que existe resistência dentro da PGR e do Judiciário?

Há uma preocupação com o impacto institucional de uma delação que atinja ministros do Supremo Tribunal Federal (STF). Além da necessidade de provas muito robustas para evitar que as acusações sejam vistas apenas como ataques sem base, o processo é sensível porque, historicamente, não há precedentes de ministros da Corte investigando seus próprios colegas a partir de delações desse tipo.

Quais crimes estão sendo investigados na operação?

Vorcaro é alvo da Operação Compliance Zero, que apura um esquema de fraudes financeiras e irregularidades envolvendo o agora liquidado Banco Master. A Polícia Federal busca aprofundar as conexões desse esquema com agentes públicos e entender como as articulações políticas e jurídicas facilitavam as atividades ilegais da instituição.

O que determina a validade e o sucesso dessa delação?

A eficiência do acord",Data Indisponível,https://www.gazetadopovo.com.br/republica/quem-e-daniel-vorcaro-e-por-que-sua-delacao-preocupa-o-stf/,gazetadopovo
Show trials: julgamentos políticos usados para perseguir opositores,"Os 'show trials' foram usados por ditaduras para eliminar opositores. De Stalin a Hitler, conheça a história desses julgamentos de fachada","Advogados atrás de pistas e testemunhas de última hora, jornalistas em frente aos tribunais, tensão nos corredores. O juiz está prestes a dar a sentença, mas todo mundo já sabe o veredicto: ele foi selado antes mesmo do julgamento começar. Poderia ser ficção, mas a história está cheia de exemplos reais. Os “show trials”, também conhecidos como julgamentos de fachada ou julgamentos políticos, são uma ferramenta usada por regimes autoritários para calar os opositores e reforçar seu poder.

Na definição do dicionário Cambridge, consistem em um julgamento organizado por um governo para ter efeito sobre a opinião pública e reduzir a oposição política, e não para encontrar a verdade. Ou seja, não importa o que for apresentado pela defesa ou acusação, o réu já está condenado.

Os primeiros julgamentos de fachada datam da década de 1930, na União Soviética, quando o ditador Joseph Stalin, depois de afundar a economia, passou a eliminar vários oponentes políticos. O objetivo era manter o poder por meio do terror, mandando um claro recado sobre o que aconteceria com os “inimigos do povo”.

Este tipo de julgamento costuma ser feito “para cumprir tabela”, com cartas marcadas. No nazismo, eram rápidos. Na URSS e na China ganhavam mais holofotes para deixarem clara as suas mensagens.

União Soviética: provas criadas e confissões sob tortura

Na União Soviética, Stalin usou três sessões para eliminar inimigos e manipular a opinião pública retratando os acusados ​​como traidores perigosos. Os “Julgamentos de Moscou” aconteceram durante o Grande Expurgo, como ficou conhecida a perseguição que levou à prisão e morte de pelo menos 750 mil pessoas, entre líderes, políticos e críticos de Stalin.

Os condenados eram fuzilados ou enviados para campos de trabalho forçado, os “gulags”, onde sofriam torturas físicas e psicológicas. Calcula-se que mais de 20 milhões de pessoas tenham passado por estes campos até sua extinção definitiva, na década de 1980.

O expurgo incluía antigos aliados, t",Data Indisponível,https://www.gazetadopovo.com.br/ideias/show-trials-julgamentos-politicos-perseguir-opositores/#comentarios?ref=comentarios-materia,gazetadopovo
