titulo,subtitulo,texto,data,url,portal
"Turbulência no Tesouro: oportunidades e riscos dos títulos públicos com guerra, leilões e circuit breakers",Queda no Tesouro Direto surpreende investidores. Entenda como a alta dos juros impacta os títulos e o que fazer diante da volatilidade.,"Março ilustrou isso bem. Até quem comprou títulos IPCA + 6% ou + 7% ao ano quando eles estavam sendo muito recomendados no mercado financeiro há alguns meses deve ter visto a carteira cair nas últimas semanas graças a uma nova disparada das taxas. Na sexta-feira (27), todos os ativos indexados à inflação pagavam mais de 7% de juro real, com taxas variando entre 8,00% e 7,08%. Entre os prefixados, os retornos eram de 14,11% e 14,25%.

A volatilidade no mês foi tanta que com certa frequência a plataforma do Tesouro Direto deu “circuit breaker” – quando interrompe a negociação dos títulos prefixados ou indexados à inflação em pregões de muita oscilação nas taxas. O Tesouro Nacional teve que fazer a segunda maior intervenção da história para garantir liquidez no mercado secundário e tentar minimizar de alguma forma o efeito. Contamos isso aqui.

Por que o Tesouro Direto caiu?

Robson Casagrande, especialista em investimentos e sócio da GT Capital, explica o mercado antecipou um fechamento mais rápido da curva de juros reais com base em um cenário que dependia de desinflação consistente, melhora fiscal e um ambiente global mais benigno. “Esses vetores se mostraram mais instáveis, especialmente o fiscal e os juros internacionais, o que levou à reabertura das taxas em março.”

A guerra no Oriente Médio também ajudou. O conflito entre Estados Unidos e Israel contra o Irã fechou o Estreito de Ormuz, por onde escoa um quinto do petróleo global. Isso fez o preço da commodity disparar aos maiores patamares em anos, pressionando as expectativas de inflação pelo mundo.

O mês do petróleo: como a alta de quase 40% da commodity pode criar efeito cascata no mercado

Junto a essa pressão inflacionária, a economia do Brasil segue aquecida. O Índice Nacional de Preços ao Consumidor Amplo 15 (IPCA-15) de março veio acima do esperado, com destaque para a inflação de serviços. As incertezas com a trajetória das contas públicas, que está na pauta há alguns anos, também não amenizou.

Publi",2026-03-30 09:34:48-03:00,https://einvestidor.estadao.com.br/investimentos/tesouro-direto-queda-marcacao-a-mercado-juros-oportunidades-riscos/,estadao
Fundo que mais cresce na gestora da Suno investe em usinas solares; veja a rentabilidade,Suno Energia Limpa (SNEL11)  investe em usinas solares de médio porte e já reúne 87 mil cotistas,"O atrativo, segundo José Eduardo Daronco, RI da gestora, é a rentabilidade da aplicação: desde o início, em 2022, o fundo rendeu 75%, enquanto o Índice de Fundos Imobiliários (IFIX) subiu cerca de 30%. Naquele ano, entrou em vigor a Lei 14.300, que definiu limites para micro e mini geração, abrindo caminho para a construção de usinas de médio porte focadas em injetar energia solar na rede para terceiros.

Leia mais: Brasil tem energia solar até 7 vezes mais barata do que nos EUA, diz estudo

Publicidade

Invista com o apoio de conteúdos exclusivos e diários. Cadastre-se na Ágora Investimentos

Só tem um fundo imobiliário que também é focado no segmento na bolsa, porém tem mandato híbrido: o RENV11. Mas o produto é bem menor do que o da asset: tem menos de 700 cotistas, e é mais focado em títulos de crédito. O restante dos fundos, especialmente os FI-Infras, podem investir de forma indireta no setor, pois costumam ser mais diversificados e têm na carteiras outros tipos de empresas de geração de energia.

O produto é marcado por sua descorrelação com o mercado, conta Daronco. Seu risco está relacionado à produção menor do que a esperada de energia, manutenção do negócio, retorno de clientes para o mercado de energia elétrica e eventuais mudanças na regulação de energia solar. Existem ainda pontos de atenção relacionados ao desenvolvimento de obra, conexão com a rede de energia elétrica e captação de clientes. Contudo, recentemente o fundo vem desenvolvendo menos usinas e optando por compras as que já estão em funcionamento: são 37 no portfólio em diversos estados e regiões do país, como Nordeste, Centro-Oeste e Sudeste. O pagamento de dividendos mensais do fundo gira em torno de 16%. Como dependem de operações reais, suas cotas tendem a ser mais voláteis.

Entre os investidores do fundo estão, além de pessoas físicas, famílias, algumas com mais de R$ 100 milhões ou mais para investir, e grupos corporativos, como Vivaz Energia e a Fortlev. Também fazem parte do quadro ",2026-03-27 17:25:55-03:00,https://einvestidor.estadao.com.br/direto-da-faria-lima/fundo-mais-cresce-suno-esg-usinas-solares-snel11/,estadao
Atlas/Estadão: Tarcísio tem 53% de aprovação e 45% de desaprovação,"Aprovação do governador atinge 74,9% entre evangélicos; para metade do eleitorado, gestão é “melhor ou muito melhor” que as tucanas","Futuro da candidatura do Missão é o fiel da balança das chances de Tarcísio vencer no 1º turno em SP 2:52 Resultado de Kim Kataguiri entre jovens e transferência de votos no 2º turno mostram desafio ao governador para confirmar favoritismo no 1º turno. Crédito: Ricardo Corrêa

Confira o resumo que a LE.IA, a IA do Estadão, fez pra você Gerando resumo Abrir o resumo

O governador de São Paulo, Tarcísio de Freitas (Republicanos), é aprovado por 53% dos eleitores paulistas e desaprovado por 45%, segundo pesquisa Atlas/Estadão divulgada nesta terça-feira, 31.

A pesquisa ouviu 2.254 eleitores de São Paulo por recrutamento digital aleatório e tem margem de erro de 2 pontos porcentuais para mais ou para menos. O nível de confiança é de 95%. O levantamento, realizado entre os dias 24 a 27 de março, foi registrado no Tribunal Superior Eleitoral (TSE) sob o protocolo BR-01079/2026.

Na avaliação de governo, Tarcísio soma 45% de ótimo ou bom, 40% de ruim ou péssimo e 16% de regular.

A aprovação do governador varia conforme o segmento do eleitorado. Na maioria dos estratos, porém, os índices positivos superam os negativos.

Publicidade

O governador de São Paulo Tarcísio de Freitas (Republicanos) Foto: Monica Andrade / Governo do Esta

PUBLICIDADE Entre os grupos com maior aprovação estão evangélicos (74,9%), eleitores de 45 a 59 anos (66,6%), homens (57,5%) e moradores das regiões de Presidente Prudente e Marília (68,3%).

Por outro lado, a desaprovação é mais elevada entre eleitores de 60 anos ou mais (56,8%), jovens de 16 a 24 anos (53,2%) e pessoas com ensino superior (51,6%).

O levantamento também pediu aos eleitores que comparassem o desempenho de Tarcísio com os governos do PSDB em São Paulo. Para 49,9%, a gestão do governador é “melhor ou muito melhor” do que as tucanas. Já 40,1% consideram este governo “pior ou muito pior” que os anteriores. Para 7,6%, as gestões são iguais, e 2,4% não souberam responder.

A Atlas ainda questionou os eleitores sobre o caminho que o ",Data Indisponível,https://www.estadao.com.br/politica/atlasestadao-tarcisio-tem-53-de-aprovacao-e-45-de-desaprovacao/,estadao
Onde e como os grandes investidores institucionais estão alocando seus recursos?,Marco Saravalle trata sobre como os grandes investidores institucionais estão alocando seus recursos em cenário de incerteza política; leia mais.,"Para os investidores institucionais — especialmente as Entidades Fechadas de Previdência Complementar (EFPCs) e os Regimes Próprios de Previdência Social (RPPS) —, o cenário de volatilidade global e os desafios fiscais domésticos impõem a necessidade de uma revisão profunda nas estratégias de portfólio.

Com mandatos de longo prazo atrelados a metas atuariais rigorosas, a seleção de gestores com capacidade comprovada de leitura de cenário e execução tática torna-se o pilar central para a preservação e o crescimento do patrimônio.

Publicidade

Para mapear as instituições capazes de entregar consistência nesse ambiente multifacetado, a edição de março de 2026 da Revista Investidor Institucional publicou o seu tradicional ranking “Melhores Fundos” (com data-base de 31 de dezembro de 2025)

O raio-x completo do mercado exigiu um processamento quantitativo de alta complexidade. Para garantir o rigor matemático da avaliação de 820 fundos de mais de 100 gestoras diferentes, em janelas de 12, 24 e 36 meses, a publicação contou com o levantamento de dados e a estruturação de cálculos realizados pela DataBay.

Ao cruzar os resultados dessa análise quantitativa com o termômetro atual do mercado, fica evidente que as estratégias de sobrevivência e a busca por alfa estão sendo recalibradas em todas as principais classes de ativos.

Para embasar essa leitura, o estudo também incorporou a visão qualitativa de líderes das maiores gestoras de recursos do país, reunindo perspectivas de casas como Itaú, Bradesco, XP, BTG, BNP Paribas, MAG Investimentos, Banco do Brasil, Caixa Econômica Federal e SulAmérica.

Renda Fixa: a transição na trajetória dos juros

O cenário de renda fixa reflete um momento de inflexão. Após períodos de juros nominais e reais historicamente altos, o mercado precifica o início de uma virada no ciclo de política monetária.

Publicidade

No entanto, o Banco Central conduz essa transição em um terreno minado por ruídos fiscais e pela resiliência inflacionária no ",2026-03-30 14:14:57-03:00,https://einvestidor.estadao.com.br/colunas/marco-saravalle/onde-e-como-os-grandes-investidores-institucionais-estao-alocando-seus-recursos/,estadao
"O preço médio da gasolina chega a US$ 4 nos EUA, uma ‘dor de cabeça’ para motoristas e para Trump","Um mês após os primeiros ataques EUA-Israel e a resposta do Irã, que interrompeu o fornecimento de petróleo no Golfo Pérsico, os motoristas estão pagando bem mais para abastecer","Os efeitos da guerra no Irã para o agronegócio brasileiro 8:37 No Paraná, produtores rurais suspendem investimentos e adiam compra de máquinas. Crédito: Reportagem: José Maria Tomazela | Fotografia e som: Daniel Teixeira | Edição: Júlia Pereira

Confira o resumo que a LE.IA, a IA do Estadão, fez pra você Gerando resumo Abrir o resumo

Nesta terça-feira, 31, o preço médio da gasolina nos Estados Unidos ultrapassou os US$ 4 por galão (3,785 litros), um nível que não era atingido desde agosto de 2022. A alta nos preços faz parte de uma sequência de aumentos quase ininterruptos desde o início da guerra no Oriente Médio, que está corroendo o poder de compra dos consumidores americanos.

Desde o final de fevereiro, o preço médio da gasolina comum subiu 35%, segundo dados da associação automobilística AAA.

O fato de a gasolina estar custando mais de US$ 4 por galão — há um mês, estava abaixo de US$ 3 — pode levar os motoristas americanos a mudar hábitos de consumo.

Nesta terça-feira, 31, placa mostra preço da gasolina acima de US$ 4, em Freeport, no Estado do Maine (EUA) Foto: Robert F. Bukaty/AP

PUBLICIDADE “Temos essa obsessão com os preços da gasolina porque eles ditam muitas coisas como ‘Podemos dirigir? Podemos fazer coisas que gostamos?’ E agora parte disso está em risco”, disse Patrick De Haan, analista da GasBuddy, que também monitora os preços dos combustíveis. “À medida que nos aproximamos do segundo mês de aumentos e os preços estão muito mais altos”, acrescentou, “a pressão sobre os orçamentos dos americanos e seus gastos vai aumentar consideravelmente”.

Para o presidente Donald Trump, que não faz muito tempo se vangloriava de como os preços haviam caído desde sua reeleição em 2024, a lembrança tão visível das consequências da guerra representa um fardo político .

“É uma grande dor de cabeça para quem estiver no poder quando algo assim acontece”, disse Kate Gordon, ex-assessora sênior do Departamento de Energia e atual diretora executiva da California Forw",Data Indisponível,https://www.estadao.com.br/economia/o-preco-medio-da-gasolina-chega-a-us-4-nos-eua-uma-dor-de-cabeca-para-motoristas-e-para-trump/,estadao
‘Empregado’ de Vorcaro no BC abriu firma voltada a crianças carentes para receber dinheiro do Master,Empresa de ‘treinamentos’ que teria sido contratada por operador de banqueiro foi aberta em julho de 2025 e registrada em endereço residencial; Belline Santana não se manifestou,"Confira o resumo que a LE.IA, a IA do Estadão, fez pra você O ex-chefe de Supervisão do Banco Central, Belline Santana, é investigado por enriquecimento ilícito após abrir uma empresa de educação financeira para crianças carentes, supostamente financiada pelo Banco Master. A Polícia Federal aponta que Belline e Paulo Sérgio Neves de Souza, ex-diretor do BC, receberam propinas para atuar como consultores informais do banqueiro Daniel Vorcaro. A Controladoria-Geral da União abriu processos administrativos contra ambos, e a empresa de Belline está sob suspeita de irregularidades. Abrir o resumo

BRASÍLIA — O ex-chefe de Supervisão do Banco Central (BC) Belline Santana abriu uma empresa destinada à educação financeira de crianças carentes para receber dinheiro do Banco Master, conforme investigação aberta pela autoridade monetária.

O BC começou a apurar, no ano passado, o vínculo entre Belline e o empresário Leonardo Palhares, apontado pela Polícia Federal como operador do banqueiro Daniel Vorcaro, dono do Master, e concluiu que houve indícios de enriquecimento ilícito do ex-chefe de supervisão.

Endereço do ex-chefe de Supervisão do BC que abriu empresa e registrou no mesmo local, na Vila Mariana, em São Paulo Foto: Tiago Queiroz/Estadão

Procurado por meio do advogado, Belline Santana não se manifestou.

ex-chefe de departamento de Supervisão Bancária do BC Belline Santana Foto: Reprodução/Instagram@bellinesa

PUBLICIDADE O servidor do Banco Central, afastado em janeiro deste ano por conta de uma investigação própria da autoridade monetária, foi alvo de uma operação da PF em março e classificado pelo ministro André Mendonça, do Supremo Tribunal Federal (STF), como uma espécie de “empregado” e “consultor” de Vorcaro no BC. Segundo a PF, Belline Santana e Paulo Sérgio Neves de Souza, ex-diretor de Fiscalização do BC, foram cooptados por Vorcaro e receberam “mesada” para trabalhar como consultores informais do banco. Na semana passada, a Controladoria-Geral da União (CG",Data Indisponível,https://www.estadao.com.br/economia/empregado-vorcaro-banco-central-abriu-empresa-criancas-carentes-receber-dinheiro-master/,estadao
Bradesco BBI classifica balanço da JHSF (JHSF3) como sólido e com valor patrimonial 100% acima da ação,"Nesta terça-feira (31), a JHSF (JHSF3) divulgou os resultados do balanço do 4T25, considerados pelo Bradesco BBI com potencial de valorização das ações.","Em relatório, eles destacaram que o avanço nos resultados da JHSF foram puxados pela venda de estoques de imóveis avaliados em R$ 5,2 bilhões, em dezembro, para um fundo imobiliário.

Com a entrada de parte dos recursos dessa transação, a companhia passou de uma dívida líquida de R$ 2,2 bilhões no terceiro trimestre para um caixa líquido de R$ 2,3 bilhões no quarto trimestre de 2025, o que ajudará a abastecer os investimentos nos projetos imobiliários em desenvolvimentos.

Publicidade

Invista em oportunidades que combinam com seus objetivos. Faça seu cadastro na Ágora Investimentos

Os analistas do Bradesco BBI apontaram que o valor patrimonial líquido (NAV, na sigla em inglês) da JHSF está mais que 100% acima do seu valor de mercado (até o fechamento do pregão de ontem).

“Estimamos o valor patrimonial líquido (NAV) da JHSF em R$ 11,9 bilhões, contra uma cotação de mercado de R$ 5,9 bilhões”, apontaram.

Em termos de valuation (valor do ativo), a JHSF agora é negociada a um múltiplo de 0,8 vezes o valor contábil por ação (P/VP) e 0,5 vezes o valor patrimonial líquido (P/NAV), o que ainda é visto pelos analistas como atraente, apesar da valorização de 107% das ações nos últimos doze meses.

Os analistas citaram ainda que a unidade de negócios de receita recorrente da JHSF atingiu um Ebitda (sigla em inglês para Lucro Antes de Juros, Impostos, Depreciação e Amortização) de R$ 658 milhões em 2025, o que implica um múltiplo EV/EBITDA de 6,0 vezes para o JHSF3, contra 9,4 vezes para as companhias de shoppings listadas na bolsa – mesmo sem atribuir valor à unidade de negócios de construção residencial do JHSF.

“Em nossa opinião, isso parece excessivamente conservador”, descreveram.

O Bradesco BBI tem classificação outperform (perspectiva de desempenho acima da média do mercado) para as ações da JHSF, com preço-alvo de R$ 10. Às 14h34, as ações da empresa eram negociadas a R$ 9,40, alta de 9,43%, enquanto o Índice Imobiliário (Imob) subia 4,50%, e o Ibovespa avançava 2",2026-03-31 14:43:42-03:00,https://einvestidor.estadao.com.br/mercado/bradesco-bbi-balanco-4t25-jhsf-jhsf3-solido-valor-patrimonial-100-acao/,estadao
Dólar sobe em março com guerra e juros dos EUA — e deixa mercado em alerta para abril,"O dólar subiu em março por causa da guerra no Oriente Médio e pelo tom cauteloso do Fed. No ano, a moeda ainda cai cerca de 4,66%. Veja o que analistas esperam para abril e em qual faixa a cotação deve se estabilizar.","O movimento do dólar ao longo do mês foi ditado principalmente pelo cenário externo, com picos de tensão geopolítica e mudanças nas expectativas para os juros americanos. Foi esse pano de fundo que marcou a virada do câmbio em março, depois de encerrar fevereiro em queda de 2,16%.

No início do mês, o dólar ainda refletia o ambiente mais favorável ao real visto em fevereiro e chegou a testar a mínima de R$ 5,12. A inflexão veio na sequência, com a escalada do conflito entre Irã, Israel e Estados Unidos, que elevou a aversão ao risco e impulsionou a moeda americana.

O episódio mais dramático do mês aconteceu no começo de março, quando o dólar disparou quase 2% em um único dia, chegando a bater R$ 5,34 na máxima intradia.

O gatilho foi uma declaração de autoridades da Guarda Revolucionária Iraniana ameaçando bloquear navios no Estreito de Ormuz, por onde passa cerca de 20% do petróleo mundial. O petróleo ultrapassou a barreira dos US$ 100 o barril, e o mercado reagiu com aversão ao risco e migração para ativos mais seguros, com o dólar entre eles.

Publicidade

Invista em oportunidades que combinam com seus objetivos. Faça seu cadastro na Ágora Investimentos

Segundo Ítalo Teles, especialista em investimentos e sócio-fundador do Grupo Nexco, o encarecimento da energia foi o elo que conectou o conflito à dinâmica cambial. “Como energia é um insumo básico para praticamente toda a economia, seu encarecimento tende a pressionar preços em diversos setores”, diz.

Isso, conforme ele, reforçou a percepção de que os juros nos Estados Unidos devem permanecer elevados por mais tempo. “E esse foi, possivelmente, o fator mais relevante: a comunicação do Federal Reserve sinalizando cautela em relação ao início de cortes de juros. Juros altos nos EUA tornam os investimentos no país mais atrativos, aumentando a demanda por dólar e pressionando moedas de países emergentes, como o real”, explica.

O movimento do dólar em março não foi exclusivo do Brasil. O Índice do Dólar (DXY), qu",2026-03-31 16:56:49-03:00,https://einvestidor.estadao.com.br/ultimas/dolar-fecha-marco-alta-guerra-oriente-medio-o-que-esperar-abril/,estadao
"Corrida mundial pela sucata de alumínio pode comprometer reciclagem no Brasil, diz CEO da Abal","Segundo Janaina Donas, com a demanda mundial de alumínio crescendo, países como a China estão ampliando capacidade de reciclagem e importando mais sucata do Brasil","Confira o resumo que a LE.IA, a IA do Estadão, fez pra você Gerando resumo Abrir o resumo

Foto: Tiago Queiroz/Estadão Entrevista com Janaina Donas Presidente-executiva da Abal A reciclagem de alumínio é um caso de sucesso no Brasil, mas ainda há desafios importantes a superar. Segundo Janaina Donas, presidente-executiva da Associação Brasileira do Alumínio (Abal), a exportação de sucata é uma das principais preocupações, pois impede o país de atingir todo o seu potencial de reciclagem. Enquanto isso, países como a China utilizam em suas linhas de produção alumínio - ou restos dele - importados do Brasil. “O Brasil possui capacidade instalada superior ao volume processado: em 2024, foram recicladas cerca de 645 mil toneladas, embora a capacidade ultrapasse 1 milhão. A disputa global por sucata é um dos principais entraves. Com a demanda mundial de alumínio crescendo rapidamente, países como a China estão ampliando suas capacidades de reciclagem e importando sucata para atender à demanda”, diz. Para Janaina, a COP-30 em Belém será uma oportunidade para mostrar ao mundo que o Brasil tem um dos alumínios mais sustentáveis do mundo - com baixa pegada de carbono, alto índice de reciclagem e uma cadeia circular que gera benefícios ambientais e sociais. “O setor quer destacar que o alumínio é parte da solução para a descarbonização global e que o País pode se consolidar como potência em reciclagem e reindustrialização verde, com protagonismo na transição energética.” A seguir, os principais trechos da entrevista:

Quais são hoje os principais desafios para a descarbonização do setor de alumínio no Brasil?

Apesar de o Brasil ter uma intensidade carbônica (a quantidade de gases emitida na atmosfera) 3,3 vezes menor que a média global, ainda há espaço para avanços. O principal desafio está na substituição de combustíveis fósseis nas refinarias, onde a biomassa, como cavaco de eucalipto e resíduos do açaí, já vem sendo usada para reduzir emissões. Há também desafios tecnológi",Data Indisponível,https://www.estadao.com.br/economia/era-do-clima-cop-30-entrevista-presidente-abal-aluminio/,estadao
Como a inteligência artificial pode melhorar a mobilidade urbana,,"Como a inteligência artificial pode melhorar a mobilidade urbana:

553 visualizações - 29/02/2024 0 | 11

Dados coletados pelo sistema de videotelemetria para frotas podem trazer mais eficiência, segurança e redução do impacto ambiental",Data Indisponível,https://mobilidade.estadao.com.br/canal-de-videos/como-a-inteligencia-artificial-pode-melhorar-a-mobilidade-urbana,estadao
Tempo da ciência em debate: atraso no sistema de patentes reacende discussão sobre inovação em saúde,Projetos em análise no Legislativo buscam compensar demora administrativa na concessão de direitos de propriedade intelectual e ampliar previsibilidade para pesquisas que levam décadas até chegar aos pacientes,"Um gargalo estrutural no sistema de patentes tem levantado preocupações entre pesquisadores brasileiros, empresas e especialistas em inovação.

Isso porque está sendo observado uma demora na análise de pedidos, que pode consumir parte significativa do período de exclusividade previsto em lei, reduzindo o tempo efetivo de proteção das tecnologias e afetando a viabilidade econômica de projetos científicos de longo prazo.

Vale lembrar que, para que novo tratamento chegue ao paciente, são necessários anos, muitas vezes décadas, de pesquisa científica, investimentos elevados e um ambiente regulatório capaz de transformar conhecimento em inovação aplicada.

Por isso, o tempo é fundamental em relação à expectativa de recuperação, qualidade de vida e esperança.

Um caso emblemático dessa situação é o da tecnologia associada à polilaminina, uma molécula ligada à regeneração de tecidos e estudada por seu potencial em terapias para reparação celular.

O pedido de patente foi protocolado em 2008, mas a decisão administrativa só foi publicada em 2025, após 17 anos de espera. Nesse intervalo, grande parte do prazo legal de proteção já havia transcorrido.

“Uma patente tem 20 anos no papel, mas a efetividade dela só se materializa a partir do momento em que ela é concedida”, diz Thiago Falda, presidente da Associação Brasileira de Bioinovação (ABBI) e porta-voz do Movimento Brasil pela Inovação. “Por isso, é importante que seja concedida num prazo mais curto. Esse atraso gera risco e insegurança durante todo o período em que o pedido ficou em atraso.”

De acordo com especialistas, a demora produz impactos que vão além da esfera jurídica, enquanto a proteção formal prevista em lei não reflete necessariamente o valor real da patente.

Ambiente regulatório

Hoje, três propostas em tramitação no Congresso Nacional – o Projeto de Lei (PL) 5.810/2025, a emenda 4 ao Projeto de Lei (PL) 2.210/2022 e o Projeto de Lei Complementar (PLP) 32/2026 – buscam enfrentar esse problema ao prever me",Data Indisponível,https://bluestudio.estadao.com.br/tempo-da-ciencia-em-debate-atraso-no-sistema-de-patentes-reacende-discussao-sobre-inovacao-em-saude/,estadao
