titulo,subtitulo,texto,data,url,portal
Os Jogos Olímpicos na Grécia Antiga,,"Seja qual for a sua espiritualidade, imagine o ritual que mais eleva o seu coração. Pense também na celebração cívica que mais excita suas paixões patrióticas. Agora, imagine uma cúpula geopolítica – com chefes de Estado, embaixadores e suas delegações. Um festival cultural – com arquitetura monumental, galerias de esculturas, récitas de poetas e filósofos, música, dança, truques de mágica. Acrescente uma feira de mercadores e inventores. Agora, coloque tudo isso sob o mesmo sol, e, bem no centro, atletas nus em competições de alta performance. Pronto, agora você tem um vislumbre do que eram os jogos olímpicos na Grécia Antiga.

A disputa foi a quintessência da vida grega, o combustível de sua cultura. As cidades competiam entre si em leis e instituições; os poetas, em versos; os filósofos, em argumentos. Hesíodo desafiou Homero. Ésquilo e Sófocles concorriam nos festivais teatrais de Dionísio. Xenófanes contestava os poetas; Sócrates, os sofistas; os estoicos, epicuristas e céticos contestavam uns aos outros. A historiografia de Heródoto nasceu da guerra contra os persas e a de Tucídides da guerra entre Esparta e Atenas. A democracia era uma arena onde cidadãos disputavam o poder pela força da palavra. Os espaços de treino e disputas físicas foram sublimados e hoje consagram os nomes de nossas instituições culturais e educacionais: as palestras, a academia, os liceus, o ginásio.

Mas se o espírito agônico dos helênicos foi destruição criativa, foi também criação destrutiva, que os impediu de forjarem uma nação, os mergulhou em guerras fratricidas e levou à sua capitulação sob potências estrangeiras.

A política dividia as cidades gregas, a religião fracassou em uni-las – mas o esporte conseguiu. Nos jogos, o conflito se transformava em espetáculo e a rivalidade em celebração. Guerras eram suspensas pela trégua sacrossanta; caravanas atravessavam mares e montanhas; e a Grécia, eternamente dilacerada, conhecia por instantes a comunhão. Sob o calor e a poeira de Olímp",2025-11-01 12:00:00+00:00,https://estadodaarte.estadao.com.br/o-canone-em-pauta/os-jogos-olimpicos-na-grecia-antiga/,estadao
Bike elétrica na praia: quais cuidados devemos tomar?,"Com as férias, muitas pessoas devem levar sua bike elétrica na praia. Mas com isso é necessário também tomar algumas precauções","Com as férias escolares e o final de ano se aproximando, o destino de muitas pessoas para descansar é a praia, além disso, muitos ciclistas levam suas bikes para pedalar na areia. Com a nova categoria de bikes elétricas crescendo no País, muitos planejam também levar sua bike elétrica na praia. Entretanto, são necessários vários cuidados para não desgastar partes elétricas e mecânicas.

“A praia é um dos lugares mais agradáveis para pedalar, mas também é um dos mais desafiadores para a bicicleta. A combinação de sal, areia e calor acelera o desgaste de componentes mecânicos e elétricos”, afirma David Peterle, CEO da Oggi Bikes.

Leia mais: Saiba por que o brasileiro costuma comprar bicicleta elétrica urbana com pneus para todo terreno",2025-12-12 15:34:09+00:00,https://mobilidade.estadao.com.br/mobilidade-para-que/saiba-quais-os-cuidados-especiais-para-sua-bicicleta-eletrica-na-praia/,estadao
"‘Quem não acompanha futebol pede o Neymar na Copa’, diz ex-jogador da seleção",Ex-atacante Dodô critica pedidos pelo retorno do camisa 10 após derrota do Brasil para a França,"Neymar fala sobre desejo de ir à Copa: 'Posso ajudar a seleção, sei das qualidades que eu tenho' 1:44 Crédito: Neymar Jr/YouTube

Confira o resumo que a LE.IA, a IA do Estadão, fez pra você Gerando resumo Abrir o resumo

O nome de Neymar voltou a ser entoado pela torcida brasileira durante a derrota por 2 a 1 para a França, na última quinta-feira, 26, em amistoso disputado no Gillette Stadium. A manifestação reacendeu o debate sobre um possível retorno do atacante à seleção, mas não encontra apoio de Dodô, ex-jogador do Brasil e atualmente comentarista.

Neymar sonha em voltar à seleção brasileira para disputar a Copa do Mundo Foto: Vitor Silva/CBF

Em entrevista à TMC Esporte, Dodô foi direto ao avaliar o cenário e contestou a ideia de que há opções claras fora da lista de convocados. Para ele, o grupo atual representa o que há de disponível no momento, e os pedidos por Neymar passam por uma visão desconectada da realidade recente do jogador.

Quem está fora da seleção que poderia estar jogando? Nossa seleção é esse time que está aí convocado. Falam dos laterais, quem são os outros que poderiam ser convocados? Os meias, quem são dois meias que poderiam ser convocados no lugar desses que foram? São os caras que a gente tem. Quem fala isso, não acompanha futebol. Quem não acompanha futebol, pede o Neymar na seleção, porque não está vendo como ele está jogando. Dodô, ex-jogador da seleção brasileira

PUBLICIDADE O torcedor verá nesta terça-feira, 31, a última partida da seleção brasileira antes de Carlo Ancelotti revelar os 26 convocados para a Copa do Mundo. O amistoso contra a Croácia, em Orlando, será a oportunidade derradeira para os atletas convocados mostrarem serviço. Será também a chance para o Brasil provar conseguir ser competitivo contra um adversário europeu relevante no cenário mundial. Contra a França, em Boston, na semana passada, a seleção mostrou pobreza ofensiva, errou demais e foi derrotada.",Data Indisponível,https://www.estadao.com.br/esportes/quem-nao-acompanha-futebol-pede-o-neymar-na-copa-diz-ex-jogador-da-selecao-npres/,estadao
Quanto custa a entrada de um apartamento nos principais bairros de São Paulo?,Levantamento da Loft analisa custo da entrada e preço das prestações nas regiões com maior número de transações na capit,"Veja quanto custa o preço médio de entrada para adquirir um imóvel nos principais bairros de São Paulo, de acordo com levantamento da Loft:",Data Indisponível,https://imoveis.estadao.com.br/webstories/quanto-custa-a-entrada-de-um-apartamento-nos-principais-bairros-de-sao-paulo/,estadao
[OPINIÃO] Por que construir apartamentos de luxo pode reduzir o aluguel dos mais pobres,"Artigo escrito por Gustavo Favaron, CEO do GRI Institute, sobre como o aumento de alugueis de luxo pode movimentar o segmento econômico.","Durante anos, o debate sobre a crise habitacional foi dominado por uma ideia aparentemente intuitiva: construir empreendimentos de alto padrão encarece as cidades e agrava o problema do aluguel. A solução, segundo essa narrativa, estaria quase exclusivamente na produção de habitação popular.

O problema é que, quando confrontada com dados empíricos em escala, essa tese começa a ruir.

Dados da empresa de inteligência imobiliária CoStar mostram algo que contraria frontalmente o senso comum: em diversas grandes cidades americanas, o aumento da oferta de apartamentos de alto padrão ajudou a reduzir os aluguéis em todo o mercado, inclusive no estoque antigo.

Esse dado não resolve a crise habitacional. Mas muda completamente o enquadramento do problema.

Publicidade

O que os dados mostram nos Estados Unidos

Segundo os dados, o aluguel médio nos Estados Unidos caiu 0,18% em novembro, a maior queda mensal em mais de 15 anos. A retração foi puxada justamente por cidades que, nos últimos anos, construíram muito acima da média nacional.

Os números são claros:

Austin (TX): crescimento médio anual do estoque de 6,8% e queda acumulada de aluguel de 15,2% desde o pico;

Phoenix (AZ): crescimento de 4,9% e queda de 9,0%.

Denver (CO): crescimento de 4,3% e queda de 8,5%.

Nashville, Charlotte, Orlando, Raleigh: todas com expansão robusta de oferta e quedas relevantes nos aluguéis

Em contraste, cidades que construíram pouco, como Nova York, San Francisco e Los Angeles, registraram aluguéis praticamente estáveis ou resistentes à queda, mesmo enfrentando a mesma conjuntura macroeconômica.

A dinâmica observada é conhecida na literatura econômica: inquilinos de renda mais alta migram para imóveis novos, liberando unidades intermediárias e antigas. Para competir, proprietários do estoque mais velho reduzem preços. Em alguns mercados analisados, os aluguéis de edifícios antigos caíram até 11%, chegando a valores inferiores aos de unidades formalmente classificadas como “acessíveis",2026-02-02 18:50:35+00:00,https://imoveis.estadao.com.br/artigos/opiniao-por-que-construir-apartamentos-de-luxo-pode-reduzir-o-aluguel-dos-mais-pobres/,estadao
[OPINIÃO] Vender não é mais problema. Produzir é,"Os indicadores recentes do mercado imobiliário mostram crescimento de lançamentos, recuperação de vendas e expansão do crédito habitacional. O orçamento","Os indicadores recentes do mercado imobiliário mostram crescimento de lançamentos, recuperação de vendas e expansão do crédito habitacional. O orçamento do FGTS para 2025 supera R$140 bilhões, com mais de R$120 bilhões destinados à habitação. O Minha Casa Minha Vida voltou a ter escala. A demanda existe. O acesso ao crédito direcionado também. Porém, o desempenho comercial não resolve a equação produtiva.

O FGTS, formado a partir de depósitos equivalentes a 8% da folha do trabalhador formal, sustenta o ciclo da habitação popular. É um instrumento poderoso e socialmente necessário. Ainda assim, ele não configura um sistema de capitalização da indústria da construção. Ele financia a unidade. Não financia a estrutura produtiva que a torna possível.

Essa distinção é central.

No Brasil financia-se o projeto. Financia-se a incorporação e a construção vinculadas a um empreendimento específico. O capital entra na SPE e se encerra com a entrega das chaves.

Publicidade

Diferentemente do ecossistema de tecnologia, onde empresas captam recursos para estruturar método, equipe, plataforma e crescimento, a construção civil não encontra capital dedicado à sua própria organização produtiva. Industrializar exige investimento contínuo. E investimento contínuo exige capital que não esteja preso apenas ao ciclo da obra.

Ao mesmo tempo, o custo do tempo tornou-se determinante. A taxa básica de juros está em 15% ao ano, com juros reais acima de 9%. Em um setor cujo ciclo pode ultrapassar trinta meses, isso altera completamente a lógica financeira. Estudos setoriais apontam que ineficiências podem alongar obras em até treze meses, com perdas estimadas em dezenas de bilhões de reais no período recente. O prazo deixou de ser apenas variável operacional. Tornou-se variável econômica.

Mas não é apenas o juro que consome capital. A burocracia também tem preço. Aprovações demoradas, revisões sucessivas, exigências cumulativas e insegurança regulatória impactam o fluxo antes mesmo do iníci",2026-03-06 21:30:00+00:00,https://imoveis.estadao.com.br/artigos/opiniao-vender-nao-e-mais-problema-produzir-e/,estadao
Novo menu do Paloma traz sabores com inspiração espanhola aos pés do Copan,"Chef Gabi Guerriero aposta em coração de pato, sardinha com massa folhada e porco ibérico e reformula menu do bar de vinhos e restaurante","Confira o resumo que a LE.IA, a IA do Estadão, fez pra você

Confira o resumo que a LE.IA, a IA do Estadão, fez pra você

O Copan, um dos edifícios mais icônicos de SP, ganha novos sabores com a repaginada do menu do Paloma, um bar vinhos com pegada de restaurante que serve desde belisquetes a pratos e sobremesas.

Toast de patê de fígado com coração de pato, figo e sálvia Foto: Ana Weber/Divulgação

A chef Gabi Guerriero acaba de incluir, por exemplo, uma potente toast de patê de fígado com coração de pato, figos e sálvia (R$ 56), perfeita para quem adora uma bela bomba de umami. Já o escabeche de sardinha em massa folhada recheada com ricota, tapenade e picles de cebola (R$ 59) traz acidez misturada a um frescor surpreendentemente amenteigado a mais uma nova entradinha.

Escabeche de sardinha em massa folhada recheada com ricota, tapenade e picles de cebola Foto: Ana Weber/Divulgação

Outras opções para começar os trabalhos são o couvert, com pão de fermentação natural, azeite, vinagre de romã e gildas (R$ 38), combinação típica dos bares bascos que inclui azeitona, anchova e pimentão defumado. Além disso, boas alternativas são as ostras (R$ 55) acompanhadas por tomate verde em salsa mignonette e molho com perfil vegetal e ácido; pupunha confitada com salsa cítrica de alcaparras e limão-siciliano (R$ 45); batata e couve de bruxelas assadas com molho tonnato, manchego e hortelã (R$ 49); e a salada de polvo com erva-doce, laranja e sumac (R$ 75).

PUBLICIDADE

Porco ibérico com feijão branco cremoso e escarola à la plancha Foto: Ana Weber/Divulgação

Para o prato principal, aposte sem medo no porco ibérico com feijão branco cremoso e escarola à la plancha (R$ 89). O vazio com radicchio, alho-poró e glacê com jerez (R$ 92), a calamarata com lula ao alho, ervilha-torta e anis (R$ 79) e a endívia e bok choy braseados com beurre blanc e vinagrete de avelã (R$ 65) também fazem valer a visita.

Torrija com crema catalana, chantilly e laranja do Paloma Foto: Ana Weber/Divu",Data Indisponível,https://www.estadao.com.br/paladar/restaurantes-e-bares/novo-menu-do-paloma-traz-sabores-com-inspiracao-espanhola-aos-pes-do-copan/,estadao
Habitar o texto: uma entrevista com James Wood,Crítico inglês revisita a própria trajetória — entre o rigor dos juízos e a revisão de seus excessos — e reflete sobre os critérios que orientam sua prática e sua leitura da ficção.,"O conteúdo a seguir dá sequência à parceria entre o Estado da Arte e a Electra, revista internacional de pensamento e cultura contemporânea editada em Lisboa. Considerado um dos críticos literários mais aclamados — e temidos — das últimas décadas, James Wood conversa com Afonso Dias Ramos sobre o percurso que o levou de uma educação religiosa na Inglaterra até a consagração no circuito literário norte-americano, no qual se destacou como redator e crítico da revista The New Yorker. Conhecido no Brasil pelos livros Como Funciona a Ficção (Cosac Naify, 2011) e A Coisa Mais Próxima da Vida (SESI-SP Editora, 2017), Wood é autor de romances e ensaios premiados.

Publicado na seção “Primeira Pessoa” do número 17 da Electra, o texto aqui reproduzido mantém a grafia do português de Portugal.

Foto: Stephanie Mitchell/Harvard Staff Photographer.

James Wood é frequentemente apontado como o principal crítico literário do mundo anglo-americano. Nasceu em 1965, em Durham, no Reino Unido. Estudou em Eton com uma bolsa de música, e em Cambridge. É professor de Prática da Crítica Literária na Universidade de Harvard, e redactor e crítico literário na revista The New Yorker. Foi o principal crítico literário do jornal The Guardian e chefe de redacção no The New Republic. Os seus ensaios e recensões aparecem regularmente no New York Times, New York Review of Books, The Guardian e na London Review of Books. James Wood continua a inspirar mais temor no mundo literário anglófono do que qualquer outro crítico. Apelidado de «elegante assassino» pelo Boston Globe ou de «estripador cortês» pela n+1, tem sido considerado a figura mais temida entre as letras americanas por causa das recensões brutalmente frontais pelas quais ficou conhecido desde o início de carreira. A reputação ficou a dever-se a acutilantes ensaios que tanto desmontavam a prosápia hipermasculina de Paul Auster como acusavam John Updike de desleixo intelectual, desde demolidoras críticas a escritores consagrados como Toni M",2026-03-21 13:55:46+00:00,https://estadodaarte.estadao.com.br/literatura/habitar-o-texto-uma-entrevista-com-james-wood/,estadao
"PGR inclui procuradores em auxílio-alimentação contra regra do STF, mas recua e corrige erro","Após editar portaria prevendo R$ 1.860 a procuradores e servidores do Ministério Público da União, a Procuradoria-Geral voltou atrás e limitou o valor apenas aos servidores para não violar decisão do Supremo sobre penduricalhos","“Quando se trata de penduricalhos, Gonet acorda para criticar o STF"", diz Andreazza 4:29 Andreazza fala sobre as críticas do procurador-geral da República, Paulo Gonet, às decisões do STF sobre a suspensão de verbas indenizatórias, os penduricalhos. Crédito: TV Estadão

A Procuradoria-Geral da República fixou nesta terça-feira, 21, o valor mensal do auxílio-alimentação de procuradores e servidores do Ministério Público da União em R$ 1.860,51. A norma contrariava regras impostas pelo Supremo Tribunal Federal sobre penduricalhos e verbas adicionais e foi corrigida horas depois. A PGR limitou o reajuste de R$ 76,09 apenas aos servidores do órgão.

A primeira versão da portaria violava o artigo 7 da proposta apresentada pelos dez ministros do Supremo na última quarta-feira, 25. O parágrafo veta expressamente parcelas indenizatórias ou auxílios previstos em decisões administrativas, resoluções, leis estaduais, incluindo o auxílio-alimentação.

Parágrafo veta expressamente parcelas indenizatórias ou auxílios previstos em decisões administrativas, resoluções, leis estaduais, incluindo o auxílio-alimentação Foto: STF

PUBLICIDADE “A criação e alteração de verbas de caráter remuneratório, indenizatório ou auxílios somente poderão ser realizadas por Lei Federal (CF, art.37, §11) ou por decisão do Supremo Tribunal Federal"", também determinou o Supremo no artigo 9 da tese. No julgamento, o STF determinou a extinção de 15 penduricalhos do funcionalismo público, manteve oito verbas indenizatórias e fixou que a soma dessas parcelas não poderá ultrapassar 35% do subsídio bruto, mantido pela Corte em R$ 46.366,19, teto do funcionalismo pago aos ministros do Supremo. Na prática, a decisão criou um novo teto de R$ 78 mil e ainda recriou um benefício extinto há 20 anos.

As normas compõem um regime de transição que valerá até que o Congresso edite lei para estabelecer quais parcelas indenizatórias serão cabíveis para as carreiras de Estado. A decisão passa a valer a partir do mês-base",Data Indisponível,https://www.estadao.com.br/politica/blog-do-fausto-macedo/pgr-inclui-procuradores-em-auxilio-alimentacao-contra-regra-do-stf-mas-recua-e-corrige-erro/,estadao
"‘Nunca fui convidada; se for, vamos pensar’, diz Tereza Cristina sobre ser vice de Flávio Bolsonaro","Nos bastidores, senadora do Progressistas é cotada para vice na chapa de filho do ex-presidente, pré-candidato à Presidência pelo PL","Confira o resumo que a LE.IA, a IA do Estadão, fez pra você Gerando resumo Abrir o resumo

BRASÍLIA - A senadora Tereza Cristina (Progressistas-MS) afirma que “não chegou o convite” para ser candidata a vice na chapa encabeçada pelo também senador Flávio Bolsonaro (PL-RJ), pré-candidato à Presidência da República pelo PL. Se o convite for feito, complementa, irá “pensar mais à frente”.

“Nossa senhora, esse assunto não sai da minha frente. Nunca fui convidada. Se eu for, lá na frente nós vamos pensar. Nunca chegou esse convite”, afirmou em entrevista ao Estadão.

'Se o Trump atrapalhar muito, eles (o agro exportador) vão ficar contra. Se o Trump atrapalhar menos, eles vão ficar a favor', diz senadora Foto: Wilton Junior/Estadão

PUBLICIDADE A senadora também afirmou que o agronegócio brasileiro tem uma posição pragmática, especialmente os exportadores, e irá se distanciar do presidente dos EUA caso sejam prejudicados pela guerra no Irã travada por Donald Trump. “Tem vários agros, mas vamos falar do agro exportador. O agro que é onde (a guerra) pode atrapalhar. O agro exportador é muito pragmático. Se o Trump atrapalhar muito, eles vão ficar contra. Se o Trump atrapalhar menos, eles vão ficar a favor, porque o agro é conservador. Mas, assim, o agro é pragmático”, afirmou.

Publicidade

Nesta segunda-feira, 30, o presidente do PL, Valdemar Costa Neto, afirmou que torce para que uma mulher seja escolhida como vice de Flávio Bolsonaro.

“Eu torço para que seja uma mulher. Porque as mulheres, apesar de ter pouca mulher aqui, são muito melhores do que os homens, em todos os sentidos”, afirmou durante evento do grupo Lide, em São Paulo.

Levantamento do instituto Paraná Pesquisas divulgado nesta segunda-feira indica um cenário de disputa acirrada entre o atual presidente Luiz Inácio Lula da Silva (PT) e o senador Flávio Bolsonaro (PL-RJ) em um eventual segundo turno das eleições de 2026, com o filho do ex-presidente Jair Bolsonaro (PT) numericamente à frente.

De acordo co",Data Indisponível,https://www.estadao.com.br/politica/teresa-cristina-cotada-vice-flavio-bolsonaro-presidencia/,estadao
"Lula sabia que Alckmin era única opção; alguém mais à esquerda seria problema, e MDB não queria vaga",Manutenção da chapa tal qual concorreu em 2022 reflete o isolamento relativo do governo na busca por novos parceiros de peso,"O presidente Luiz Inácio Lula da Silva confirmou, nesta terça-feira, 31, o que as cúpulas do PT e do PSB já sabiam há pelo menos um ano. Geraldo Alckmin será novamente seu vice na corrida eleitoral.

PUBLICIDADE Sem desmerecer a trajetória política do ex-governador paulista, fato é que, desde que a popularidade de Lula começou a despencar no ano passado, eles tinham ciência de que não havia chances de conseguir atrair outra sigla grande para a composição, como MDB ou PSD. Em meados de 2025, em meio às informações de que os estrategistas palacianos pressionariam por outro vice, e também na avaliação de que Alckmin poderia ser o melhor palanque para Lula na disputa em São Paulo, um cacique socialista foi taxativo ao afirmar à Coluna do Estadão que “Lula não teria outra opção segura para vice”. A conclusão considerava três pontos:

Se optasse por uma composição com o próprio PT de Fernando Haddad ou o PSOL de Guilherme Boulos, por exemplo, ele daria um recado de radicalização à esquerda, o que amplia o risco de rejeição de setores da sociedade e do eleitorado.

O PSB mantém sua fidelidade a Lula e consegue com Alckmin apontar mais equilíbrio à chapa.

Siglas que integram todos os governos, independentemente da coloração partidária, só formalizam sua presença na chapa quando a expectativa de vitória do candidato é inequívoca, o que não ocorre hoje.

Publicidade

O que se vê agora, portanto, é que a manutenção da chapa tal qual concorreu em 2022 reflete o isolamento relativo do governo na busca por novos parceiros de peso.

Durante meses, nomes expressivos do MDB, como o ministro dos Transportes, Renan Filho (AL), e o governador do Pará Helder Barbalho, alimentaram expectativas de se viabilizarem como nomes para a vice-presidência. No entanto, o partido decidiu manter sua estratégia de independência, preferindo não se amarrar formalmente a um projeto de reeleição neste momento.

Paralelamente, o nome de Gilberto Kassab, presidente do PSD, também chegou a ser ventilado co",Data Indisponível,https://www.estadao.com.br/politica/coluna-do-estadao/lula-sabia-que-alckmin-era-unica-opcao-alguem-mais-a-esquerda-seria-problema-e-mdb-nao-queria-vaga/,estadao
Sebastião Salgado: fotos de atentado contra Reagan ajudaram fotógrafo a retratar excluídos do mundo,Brasileiro fotografou o atentado a tiros de posição privilegiada em 1981 e com a renda da venda das fotos adquiriu autonomia para realizar seus trabalhos autorais,"Reportagem da Revista Manchete sobre fotos feitas por Sebastião Salgado do atentado contra Ronald Reagan. Foto: Revista Manchete/Editora Bloch

“Essas fotos não são o meu melhor material fotográfico, nem minha melhor reportagem, mas sem dúvida a sorte me ajudou e este foi o meu maior momento em um tema da atualidade. E muito dificilmente uma coisa como esta acontecem duas vezes a um mesmo profissional”. Sebastião Salgado, Revista Manchete 26/9/1981

É a velha história de estar no lugar certo na hora certa. Fotógrafo já com algum prestígio internacional em 1981, o brasileiro Sebastião Salgado [1944 - 2025] foi parar em Washington quase que por acaso, pautado de última hora pela revista do New York Times. Era para fazer imagens para um balanço dos 100 dias de governo de Ronald Reagan.

PUBLICIDADE Acabou registrando, em 30 de março de 1981, de uma posição privilegiadíssima, a sequência do atentado a tiros que John Hincley Jr. fez contra o presidente americano para impressionar a jovem atriz Jodie Foster. Os detalhes do lance de sorte de Salgado foram contados numa reportagem assinada por Tarlis Batista na extinta revista Manchete seis meses depois.

O dinheiro que ganhou com a venda das imagens - mais de 100 mil dólares na ápoca - permitiu a Salgado ter, a partir dali, a independência financeira para começar a realizar por conta própria, sem vínculo com agências ou veículos, o trabalho que o consagraria anos depois, retratando o mundo com seu estilo único, com ênfase nas populações excluídas.

Publicidade

“Tive tempo de fazer uma foto dele sorrindo e acenando para o povo e logo em seguida ouvi os primeiros estampidos Eram secos e em tudo iguais a fogos de artifício”, contou Salgado a repórter da revista Manchete.

“Pensei, aliás, apenas nessa possibilidade. Mas, numa fração de segundo, percebi que alguém estava atirando no presidente. Sem tirar o olho do visor, segui fotografando. Fazia tudo automaticamente, sem ter uma noção exata do que estava realmente acontecendo",Data Indisponível,https://www.estadao.com.br/acervo/sebastiao-salgado-fotos-de-atentado-contra-reagan-ajudaram-fotografo-a-retratar-excluidos-do-mundo/,estadao
