titulo,subtitulo,texto,data,url,portal
Cláudio Michelon: ‘Perceber propriedades normativas é um pressuposto do raciocínio jurídico’,Titular da Cátedra de Filosofia do Direito da Universidade de Edimburgo fala sobre seus trabalhos em teoria do direito e teoria das virtudes e sobre a filosofia de Simone Weil.,"O Estado da Arte dá início a uma série de entrevistas com filósofos brasileiros de destacada atuação na academia brasileira e no cenário internacional. Buscando reconstituir os percursos de formação de pesquisadores e professores, rememorando o papel de sucessivas gerações no processo de consolidação da filosofia no Brasil — sem descuidar de interrogar as agendas de investigação dos pensadores entrevistados —, esses diálogos pretendem oferecer uma amostra (certamente limitada) da produção filosófica das últimas décadas a partir do testemunho direto de algumas de suas figuras centrais.

A estreia da série, intitulada Conversações Filosóficas, traz uma entrevista com Cláudio Michelon, professor titular da Cátedra de Filosofia do Direito na Universidade de Edimburgo, na Escócia. Graduado em Direito pela Universidade Federal do Rio Grande do Sul (1992), onde também obteve seu mestrado (1996), doutorou-se pela Universidade de Edimburgo em 2001. Foi professor da faculdade de Direito da UFRGS até 2006, exercendo paralelamente a advocacia no escritório Souto Correa Advogados (atividade que mantém até hoje), antes de ingressar definitivamente na Edinburgh Law School em 2007.

Autor de uma vasta produção que se estende da reflexão acerca da teoria da argumentação jurídica à estrutura normativa do direito privado, Michelon ocupou posições de grande prestígio, entre as quais a HLA Hart Visiting Fellowship em Oxford (2007) e a British Academy Visiting Fellowship (2006-7), sendo atualmente Diretor do Edinburgh Centre for Legal Theory. Entre seus principais livros, destacam-se Being Apart from Reasons: The Role of Reasons in Public and Private Moral Decision-Making (Springer, 2006) — que se origina de sua tese de doutorado sob a orientação de Zenon Bankowski —, Aceitação e Objetividade (Revista dos Tribunais, 2004) e Direito Privado, Razão e Justiça (Almedina, 2023), além de um grande número de influentes volumes editados e artigos publicados internacionalmente.

Nesta entrevista,",2026-03-26 00:16:05+00:00,https://estadodaarte.estadao.com.br/filosofia/claudio-michelon-perceber-propriedades-normativas-e-um-pressuposto-do-raciocinio-juridico/,estadao
Haiti x Islândia - Amistosos de seleções 2026,"Amistosos de seleções 2026: Acompanhe ao vivo Haiti x Islândia. Confira lance a lance, escalação, estatísticas e mais no Estadão!",,2026-03-31 00:00:00,https://www.estadao.com.br/esportes/futebol/haiti-islandia-ao-vivo-amistosos-de-selecoes-2026-03-31/,estadao
"Dino determina suspensão de pagamentos de ‘penduricalhos’ pelo Executivo, Legislativo e Judiciário",Liminar de ministro do STF também abrange Estados e municípios; relator fala em medida para por fim ao ‘império dos penduricalhos’,"Reforma administrativa em 10 pontos: Supersalários do serviço público podem acabar? 00:56 Reforma administrativa prevê o fim dos penduricalhos e um limite no salário de funcionários públicos; proposta está em discussão no Congresso Nacional. Crédito: Isabel Lima/Estadão

BRASÍLIA – O ministro do Supremo Tribunal Federal (STF) Flávio Dino concedeu liminar para suspender o pagamento dos chamados penduricalhos para servidores federais do Executivo, Legislativo e Judiciário. A decisão de Dino ainda atinge Estados e municípios.

O ministro do Supremo Tribunal Federal (STF) Flávio Dino determinou suspendeu de pagamento de penduricalhos salariais Foto: Wilton Junior/Estadão

PUBLICIDADE Pela decisão, os pagamentos de adicionais que não estão previstos em lei devem ser suspensos após 60 dias. Até lá, os Três Poderes deverão rever todos os itens pagos como adicionais salariais e que acabam contribuindo para que vencimentos no funcionalismo ultrapassem o teto que é o salário de um ministro do STF, equivalente hoje a R$ 46,3 mil. “Aquelas verbas que não foram expressamente previstas em lei – votada no Congresso Nacional ou nas Assembleias Legislativas ou nas Câmaras Municipais (de acordo com cada esfera de competência) – devem ser imediatamente suspensas após o prazo fixado”, destacou Dino.

O ministro determinou que os chefes de Poderes devem publicar ato discriminando cada verba remuneratória, indenizatória ou auxílio, o seu valor, o respectivo critério de cálculo e o fundamento legal específico.

Publicidade

Dino defendeu que o Congresso regule uma lei que defina quais são as verbas indenizatórias “realmente admissíveis como exceção ao teto e ao subteto”.

Ele intimou o presidente da República, Luiz Inácio Lula da Silva (PT), e os presidentes do Senado, Davi Alcolumbre (União-AP), e da Câmara, Hugo Motta (Republicanos-PB), para que tomem as medidas políticas para suprir a omissão inconstitucional. “Por este caminho, certamente será mais eficaz e rápido o fim do Império dos",Data Indisponível,https://www.estadao.com.br/politica/dino-determina-suspensao-de-pagamentos-de-penduricalhos-pelo-executivo-legislativo-e-judiciario/,estadao
Idade é principal fator de risco para morte por câncer colorretal,"Pesquisa com dados de internações em hospitais públicos de São Paulo revela que, conforme a faixa etária avança, a probabilidade de óbito após a cirurgia para retirar tumor aumenta","Como evitar um câncer de intestino 1:24 Confira os hábitos de vida que preservam a saúde do órgão. Crédito: Estadão

Confira o resumo que a LE.IA, a IA do Estadão, fez pra você Gerando resumo Abrir o resumo

O Brasil vive um cenário de aumento preocupante da incidência de câncer de cólon e reto, mais conhecido como câncer colorretal. Estimativas epidemiológicas do Instituto Nacional de Câncer (INCA), descritas em fevereiro na Revista Brasileira de Cancerologia, projetam que 53.810 pessoas desenvolverão a doença a cada ano entre 2026 e 2028. Isso significa que esse tipo de tumor representará cerca de 10,4% de todos os novos diagnósticos de neoplasias no país.

Esse fenômeno não se reflete apenas em um maior número de casos, mas também em mais internações e óbitos. Em um artigo publicado em março no ANZ Journal of Surgery, uma equipe de pesquisadores do Centro de Estudos e Promoção de Políticas de Saúde (CEPPS), do Einstein Hospital Israelita, analisou os dados de internações em hospitais públicos do estado de São Paulo entre 2000 e 2023. Uma das conclusões é que, conforme a faixa etária avança, a probabilidade de óbito após a cirurgia para retirar o tecido tumoral no cólon e reto aumenta de forma consistente.

Câncer de intestino é o segundo mais frequente entre homens e mulheres no Brasil Foto: Peakstock/Adobe Stock

PUBLICIDADE Outro achado importante diz respeito ao tipo de internação. Pacientes submetidos a cirurgias de urgência apresentam risco significativamente maior de morte em comparação aos operados de forma eletiva. Isso sugere que o diagnóstico tardio e a necessidade de intervenção em situações críticas contribuem para piores desfechos clínicos. O tempo de internação e a presença de comorbidades também influenciam o risco de mortalidade. Hospitalizações mais longas e pacientes com outras doenças associadas tendem a apresentar maior probabilidade de morrer, o que indica quadros clínicos mais complexos e maior gravidade. “Com base nesses achados, treinamos ",Data Indisponível,https://www.estadao.com.br/saude/idade-e-principal-fator-de-risco-para-morte-por-cancer-colorretal/,estadao
CPIs tentam expor o Supremo e os ministros dão o troco,"Em votação que barrou prorrogação dos trabalhos na CPI do INSS, prevaleceu o espírito de corpo","Independentemente das teses jurídicas defendidas, o que se viu no plenário do Supremo Tribunal Federal (STF) nesta quinta-feira, 26, foi uma irritação dos ministros com os parlamentares que comandam as Comissões Parlamentares de Inquérito (CPIs) no Congresso.

PUBLICIDADE Nas últimas semanas, as CPIs vêm fustigando o tribunal, com vazamentos de informações à imprensa e com pedidos de quebra de sigilo. Os ministros viram no pedido de liminar para a prorrogação da CPMI do INSS a oportunidade de dar o troco. Foram 8 votos a 2 contra a prorrogação. Com a exceção do relator André Mendonça, que concedeu a liminar, e do ministro Luiz Fux, todos os demais votaram contra. Coube ao decano Gilmar Mendes as críticas mais duras e diretas.

Posição do ministro André Mendonça foi derrotada pela divergência de oito, dos dez ministros da Corte Foto: Gustavo Moreno/STF

“O problema maior é a falta total de escrúpulo, porque se divulga dados confiados exatamente na certeza da impunidade. Foi o que ocorreu agora. Pessoas adultas já velhas, com mais de 60 anos, entrando na sala da CPI com óculos para depois ficar contando coisas. Isso é indigno para o Parlamento”.

Publicidade

Ele se referia aos vazamentos da CPI do INSS, cujos servidores efetivamente descumprem a lei. Teve muita fofoca circulando por aí sobre a vida do ex-banqueiro Daniel Vorcaro, mas também saíram de lá muitas informações de interesse público.

Foi graças ao trabalho da imprensa que soube-se das conversas entre o ministro Alexandre de Moraes e Daniel Vorcaro no dia em que banqueiro foi preso - diálogos ainda não explicadas pelo ministro.

A CPI do Crime Organizado também está nos calcanhares do Supremo com pedidos de quebra de sigilo da Maridt, que pertence ao ministro Dias Toffoli, e do fundo Arleen. O fundo Arleen, do ecossistema de Vorcaro, que comprou a participação da Maridt num resort de luxo no Paraná. Ambos os pedidos foram derrubados pelo ministro Gilmar.

Para negar a prorrogação da CPMI do INSS, os ministr",Data Indisponível,https://www.estadao.com.br/politica/raquel-landim/cpis-tentam-expor-o-supremo-e-os-ministros-dao-o-troco/,estadao
‘Voto pronto e enviado para vc’; PF suspeita que lobista controlava ações no STJ,"Catálogo de Andreson de Oliveira, alvo da Operação Sisamnes, revela esquema de ‘dentro para fora’ dos tribunais, com servidores se ligando a lobistas para oferecer decisões; ministra do STJ, Isabel Gallotti não é alvo das investigações e diz que ‘está à disposição para auxiliar’; Daimler Campos, ex-chefe de gabinete de Gallotti, diz que seu nome foi usado de ‘maneira espúria’","A Polícia Federal encontrou no celular do lobista Andreson de Oliveira Gonçalves - emblemático personagem do suposto mercado de venda de sentenças que se teria instalado em tribunais estaduais e no Superior Tribunal de Justiça -, uma lista de processos ligados ao gabinete da ministra Isabel Gallotti, segundo análise preliminar da investigação.

Expressão 'voto pronto e enviado para você', segundo relatório da PF, pode indicar 'controle paralelo das atividades jurisdicionais' no STJ Foto: Reprodução

Publicidade

Servidores e assessores de gabinetes supostamente se aproximavam de advogados e lobistas para oferecer decisões favoráveis, num sistema que, nas palavras dos investigadores, “transformava o resultado processual em objeto de leilão”.

“Fontes ouvidas revelaram que operadores vinculados ao gabinete receberam listagens de processos em tramitação, a partir das quais passavam a procurar advogados ou partes interessadas, oferecendo a eles a possibilidade de aquisição do resultado jurisdicional”, crava o relatório, subscrito pelo delegado Marco Bontempo.

Ao Estadão, os advogados de Andreson afirmaram que “está definitivamente comprovado que só a defesa segue a regra do sigilo imposto à investigação.”

‘Você comanda’

Mensagens trocadas no dia 7 de fevereiro de 2020 revelam ainda novas interações entre os lobistas Andreson de Oliveira e Roberto Zampieri, advogado assassinado em dezembro de 2023 à porta de seu escritório em Cuiabá por um pistoleiro de aluguel.

Publicidade

Segundo a PF, Andreson informava Zampieri sobre o andamento de um processo identificado como “os ED da Cátia”, que tramitava no gabinete da ministra Gallotti.

Andreson Gonçalves informava Roberto Zampieri sobre andamento de um processo que tramitava no gabinete da ministra Isabel Gallotti, do STJ Foto: Reprodução

Mensagens revelam interações entre os lobistas Andreson Gonçalves e Roberto Zampieri, que foi assassinado em 2023 Foto: Reprodução

Andreson escreveu no WhatsApp para Zampieri que o ca",Data Indisponível,https://www.estadao.com.br/politica/blog-do-fausto-macedo/voto-pronto-e-enviado-para-vc-pf-suspeita-que-lobista-controlava-acoes-no-stj/,estadao
Como usar o Imposto de Renda 2026 para apoiar causas sociais,"Saiba como destinar parte do Imposto de Renda para projetos sociais sem custo adicional. Guia explica quem pode, quanto é possível doar e como fazer na prática.","Dentro desse mesmo procedimento, porém, existe uma possibilidade menos explorada e frequentemente subestimada. A legislação brasileira permite que parte do imposto devido seja direcionada a projetos sociais, sem que isso represente desembolso adicional. Não se trata de doar do próprio bolso, nem de elevar a carga tributária. O contribuinte passa a ter algum poder de escolha sobre o destino de uma fração do tributo que já seria recolhido.

Essa alternativa, embora prevista há anos, ainda convive com desconhecimento e dúvidas práticas, o que limita sua utilização em larga escala.

Como funciona

O mecanismo está disponível para pessoas físicas que optam pelo modelo completo da declaração do Imposto de Renda. Nesse formato, o contribuinte pode direcionar uma parcela do imposto devido a fundos públicos que financiam políticas sociais específicas.

Publicidade

Conteúdos e análises exclusivas para ajudar você a investir. Faça seu cadastro na Ágora Investimentos

O contribuinte não é obrigado a destinar o valor máximo nem a dividir entre os fundos. Ele pode escolher se vai destinar, qual fundo apoiar e quanto direcionar, respeitando o limite legal.

Esse limite é de até 6% do imposto devido, mas funciona como um teto, não como uma obrigação. É possível direcionar 1%, 2%, 4% ou qualquer valor dentro desse intervalo.

Dentro da própria declaração, a destinação direta se concentra em dois tipos de fundos: os Fundos dos Direitos da Criança e do Adolescente e os Fundos dos Direitos da Pessoa Idosa. O contribuinte pode escolher apenas um deles ou dividir o valor entre os dois.

Esses fundos existem nas esferas municipal, estadual e federal. Isso significa que, além de escolher o tipo de causa, o contribuinte também pode decidir se quer que o recurso fique na sua cidade, no seu estado ou em nível nacional.

Publicidade

O que muda é o destino do dinheiro, não o valor pago. Se há imposto a pagar, o valor destinado é abatido do total devido. Se há restituição, a quantia é incorpor",2026-03-30 14:28:16-03:00,https://einvestidor.estadao.com.br/educacao-financeira/imposto-de-renda-irpf-doacao-causas-sociais-como-fazer/,estadao
[OPINIÃO] IA e robótica na construção: por que 2026 pode marcar um ponto de virada para o setor?,Artigo de Cristiano Gregorius sobre como a IA e a robótica na construção podem promover uma revolução na construção este ano.,"Se 2024 e 2025 foram anos marcados por testes, provas de conceito e projetos-piloto, 2026 tende a ser o período em que a inteligência artificial e a robótica ganham escala na indústria da construção. A pressão por redução de custos e prazos, aliada à escassez de mão de obra e à maturidade das plataformas digitais, aceleram uma mudança estrutural no setor.

Nesse novo contexto, a discussão deixa de ser se vamos usar IA e robôs e passa a ser mais estratégica: em 2026, quais decisões e tarefas devem ser automatizadas primeiro para tornar a operação mais previsível?

Essa mudança de foco já pode ser observada nos números do setor. De acordo com o Report de Inteligência Artificial na Construção Civil, uma iniciativa do Ecossistema Sienge e da GRUA Insights, o uso de IA nas atividades profissionais saltou de 15% em 2023 para 38% em 2025, mas apenas 28,9% das empresas adotam IA de forma institucionalizada, revelando um grande potencial de transformação em 2026.

Em um ambiente cada vez mais pressionado por custos, o cumprimento de prazos e a escassez crescente de mão de obra criam um cenário em que decisões sustentadas apenas em experiência e intuição se tornam insuficientes. A construção, historicamente dependente do “feeling” dos gestores, começa a migrar para uma lógica orientada por dados. Modelos de IA capazes de cruzar históricos de produtividade, custos, logística e riscos externos elevam o nível do planejamento e permitem antecipar problemas antes que eles se transformem em prejuízos.

Publicidade

Nesse momento, a integração da IA aos fluxos de trabalho deixa de ser um diferencial e passa a ser o mínimo esperado. Copilotos operacionais conectados a sistemas de gestão já não servem apenas para gerar relatórios, mas para automatizar tarefas, padronizar informações e apoiar decisões críticas em orçamento, planejamento, compras e controle da obra.

Empresas que não possuem processos bem definidos e dados confiáveis tendem a investir em ferramentas sem extrair valor re",2026-02-04 17:29:00+00:00,https://imoveis.estadao.com.br/artigos/opiniao-ia-e-robotica-na-construcao-por-que-2026-pode-marcar-um-ponto-de-virada-para-o-setor/,estadao
Abertura de mercado: declarações de Trump alteram ânimos dos investidores; Ibovespa deve mostrar volatilidade,"A abertura de mercado dessa terça-feira (31) é pautada pela notícia, veiculada pelo Wall Street Journal, de que o presidente Donald Trump estaria disposto a encerrar a campanha militar americana contra o Irã; saiba mais","Mesmo que o Estreito de Ormuz permaneça em grande parte fechado, o sinal anima os mercados acionários nesta manhã, embora ainda gere certa desconfiança, dado o histórico de reviravoltas nestes tipos de pronunciamento. De fato, os conflitos ainda seguem e um drone iraniano atingiu um petroleiro kuwaitiano totalmente carregado ao largo de Dubai, reacendendo preocupações no setor de transporte marítimo.

Para além das bolsas, o dólar hoje opera de lado frente a maioria das moedas, mas caminha para registrar o melhor mês desde outubro de 2024, os rendimentos dos títulos de renda fixa de dívida pública do governo norte-americano (Treasuries) recuam e o ouro registra leve ganho.

Publicidade

Invista em oportunidades que combinam com seus objetivos. Faça seu cadastro na Ágora Investimentos

Já entre as principais commodities, os contratos futuros do petróleo seguem em alta, o que fez com que a gasolina nos Estados Unidos superasse a média de US$ 4 por galão pela primeira vez desde agosto de 2022, enquanto os preços futuros do minério de ferro caíram 0,80% na madrugada em Dalian, aos US$ 116,88 por tonelada.

Ainda digno de nota, o alumínio se dirige ao maior ganho mensal em quase dois anos, impulsionado por interrupções na oferta.

Por aqui, considerando o fim de trimestre, a sessão do Ibovespa hoje deve ser mais volátil, especialmente no mercado de câmbio, com a formação da Ptax do mês e que servirá como referência para os resultados corporativos.",2026-03-31 09:23:16-03:00,https://einvestidor.estadao.com.br/mercado/abertura-de-mercado-ibovespa-hoje-guerra-trump-dolar-treasuries/,estadao
Estação Franco da Rocha recebe campanhas de vacinação,A Linha 7-Rubi está promovendo vacinação e testes rápidos na Estação Franco da Rocha nos dias 11 e 19 de dezembro,"Os testes rápidos são bem simples de serem realizados, com um pequeno furo na ponta do dedo e uma gota de sangue, os exames oferecem resultados dentro de 30 minutos. Para a vacinação, não é necessária a carteira de vacinação para tomar o imunizante.

A ação é uma parceria da TIC Trens com a prefeitura de Franco da Rocha e segundo Diana Mari Siqueira, gerente de Experiência do Cliente da TIC Trens, a ideia da nova concessrionária é fazer com que as estações possam ser espaços de serviço público ampliado como esse de vacinação e testes rápidos para algumas doenças.

Estação Franco da Rocha deve ser modernizada segundo planos da TIC Trens

A TIC Trens assumiu a concessão da Linha 7-Rubi por um período de 30 anos no último dia 26 de novembro e já colocou trens com a nova identidade visual. A empresa espera padronizar a frota até 2027. A empresa terá a responsabilidade de modernizar as 17 estações da linha, além das linhas férreas em seus 57 km de extensão. Diariamente a Linha 7-Rubi transporta cerca de 400 mil passageiros por dia.

Leia também: Trens do Metrô passam a operar 24 horas durante os finais de semana até fevereiro de 2026",2025-12-11 11:00:00+00:00,https://mobilidade.estadao.com.br/mobilidade-para-que/estacao-franco-da-rocha-da-linha-7-rubi-recebe-campanhas-de-vacinacao-e-testes-rapidos/,estadao
10 receitas com couve para sair do refogado de sempre,"Da feijoada ao suco verde, a couve-manteiga mostra sua versatilidade em receitas simples que vão de sopas e saladas a pratos tradicionais","Confira o resumo que a LE.IA, a IA do Estadão, fez pra você

Confira o resumo que a LE.IA, a IA do Estadão, fez pra você

A couve é muito presente na cozinha brasileira. Aparece no prato feito, acompanha a feijoada, entra no suco verde e vira refogado rápido para completar a refeição. Simples e versátil, funciona como uma grande parceira do dia a dia, combina com tudo e ainda acrescenta cor, textura e sabor ao prato. Neste caderno de receitas, a ideia é mostrar como a couve pode entrar em diferentes preparos, com receitas práticas que apresentam novas formas de levar essa folha tão presente à mesa.

Além da versatilidade na cozinha, a couve também chama atenção pelo valor nutricional. Segundo a matéria de saúde, a variedade mais comum no Brasil, a couve-manteiga, é rica em vitamina C, nutriente importante para o sistema imunológico. Assim como outros vegetais da mesma família, ela contém compostos naturais chamados isotiocianatos, associados ao bom funcionamento do intestino e ao equilíbrio da microbiota. Esses benefícios aparecem com mais força quando a couve faz parte de uma alimentação variada, acompanhada de boa hidratação e prática regular de atividade física.

A seguir, você encontra sete receitas com couve para preparar em casa. São ideias simples e saborosas que mostram como essa folha pode aparecer no dia a dia de maneiras diferentes e agradar a todo mundo à mesa.

Couve refogada para feijoada

Couve refolgada Foto: Ana Bacellar

PUBLICIDADE

A couve refogada é um acompanhamento clássico do dia a dia. Simples e rápida de preparar, combina com diferentes pratos e costuma aparecer tanto nas refeições cotidianas quanto ao lado de receitas tradicionais, como a feijoada. Cortada em tirinhas finas e refogada rapidamente, mantém o verde vivo, a textura macia e o sabor marcante.

Veja receita

Suco verde com couve

Suco verde Foto: Maryna - stock.adobe.com

O suco verde ficou popular pela combinação de folhas, como a couve, com frutas e outros ingredientes que equi",Data Indisponível,https://www.estadao.com.br/paladar/caderno-de-receitas/10-receitas-com-couve-ideias-faceis-e-diferentes-para-usar-couve-manteiga-no-dia-a-dia/,estadao
